{
  "title": "History of the Broken Isles",
  "metadata": {
    "Era": "Ancient to Present",
    "Key Event": "Battle of the Broken Straits (~118 years ago)",
    "Founder": "[[Vaelith Draegor]] (refused crown)",
    "Result": "Pirate Confederation established",
    "Related": "[[The Broken Isles]]"
  },
  "epigraph": "Before The Storm, we were prey. After The Storm, we became the hunters.",
  "atAGlance": "The Broken Isles weren't always unified. For generations, they were scattered‚Äînative orcs and goblins, desperate refugees, independent pirates preying on each other as much as the mainland.\n\nThen the Thelassian came to finish their genocide.\n\n118 years ago, a massive Imperial fleet sailed east to destroy the pirate havens and hunt down escaped drow. They found Vaelith Draegor waiting. The Storm united every captain, every clan, every desperate soul who had nowhere else to run.\n\nThe Battle of the Broken Straits destroyed the Empire fleet. 30+ warships sunk. The survivors begged Vaelith to be king. He refused.\n\n*\"I don't want your throne. I want the sea. Choose your own king.\"*\n\nThey did. The Confederation was born. And The Storm has watched over it ever since.\n\n*Common saying: \"The Isles belong to whoever sits the throne. The throne belongs to The Storm.\"*\n\n---",
  "commonKnowledge": "### The First Peoples (Ancient)\n\nBefore outsiders arrived, the islands were already inhabited:\n- **Orcs** on Stormcrag (farming, raiding, clan feuds)\n- **Goblins** on Greenfire Isle (early shipbuilding)\n- **Bugbears** in Mistwood (hunting, ruins)\n\nWhere they came from is lost to time. They simply were.\n\n### The Refugee Era (~200-120 years ago)\n\nAs mainland persecution intensified, desperate people fled to the Isles:\n- Kingdom commoners fleeing noble rule\n- Drow escaping the genocide\n- Half-breeds rejected by both societies\n- Criminals, deserters, the desperate\n\nIntegration was rough. The First Peoples didn't welcome invaders. But shared enemies‚Äîthe mainland powers‚Äîeventually created common ground.\n\n### The Scattering (~120-118 years ago)\n\nFor decades, the Isles had no unity:\n- Pirates preyed on each other\n- No safe harbors\n- Mainland powers picked off ships one by one\n- Every captain for themselves\n\n### The Empire's Wrath (~118 years ago)\n\nThe Thelassian decided to end the drow escape route permanently. Emperor Valandor authorized a purge fleet: 40+ warships, thousands of soldiers, orders to show no mercy.\n\nWord reached the Isles. Panic spread. Individual captains couldn't fight a fleet.\n\n### The Storm Rises\n\n[Vaelith Draegor](/npcs/vaelith-the-storm-draegor) had sailed these waters for 180 years, destroying Empire ships but ignoring Isles politics. This time was different. The Empire was coming for drow‚Äîfor his people.\n\nHe sailed into Freehold Harbor and called every captain to gather:\n\n> *\"The Empire comes to finish what they started. We fight, or we die‚Äînot today, but soon, one by one. I will fight. Those who sail with me will have the protection of The Storm.\"*\n\nEvery captain chose to fight.\n\n### The Battle of the Broken Straits\n\n~100 pirate vessels against 40 Imperial warships. Vaelith used local knowledge to force the Empire into narrow channels where numbers meant nothing.\n\n**Result:** 30+ Imperial ships destroyed. The survivors fled. The drow they came to hunt watched their hunters drown.\n\n### The Founding\n\nAfter the battle, captains begged Vaelith to rule. He refused:\n\n> *\"Choose your own king. Make your own laws. I will be here if the Empire returns.\"*\n\nThe first Moot established:\n- The Pirate Monarch (elected)\n- Harbor Peace (Vaelith's demand)\n- Tribute system for collective defense\n- Freehold as capital\n\n### Since Then\n\n**~60 years ago:** Saltmere founded as commercial capital\n**~20 years ago:** Gorrath unites orc clans\n**~3 years ago:** Graza Bloodtide becomes Queen\n\nThe Confederation has endured 118 years. Monarchs rise and fall. The Storm remains.\n\n---",
  "secretKnowledge": "### Why Vaelith Refused the Crown\n\nThe official story: He wanted the sea, not power.\n\n**The deeper truth:** Vaelith saw what crowns did. The Empire's emperor has ruled for 1,500 years, and look what the Empire became. The Kingdom's king barely controls his lords. Power corrupts. Thrones demand compromise.\n\nBy refusing to rule, Vaelith kept himself pure. He answers to no one. He compromises nothing. He can destroy the Empire with single-minded focus.\n\n**The strategic genius:** By refusing power, he gained more than any crown could give. Everyone owes him. No one can challenge him. He rules by not ruling.\n\n### The Lost First Monarch\n\nThe name of the first Pirate King is genuinely lost. Some say it was deliberate‚ÄîVaelith ordered the name forgotten so no dynasty could claim descent.\n\nOthers say the first monarch was... unremarkable. Chosen to fill a role, not for greatness. The Confederation needed a figurehead. They got one. He died. No one remembered.\n\n### What Vaelith Did Before\n\n180 years between his escape and the Battle. What did he do?\n\n**The truth:** He hunted. Every Empire ship that strayed too far east. Every slaver. Every naval patrol. He learned the waters. He built his fleet one captured ship at a time. He became a legend before he ever appeared at Freehold.\n\n**His kill count:** Unknown, but estimates range in the hundreds of ships over those decades. The Empire knows. They don't talk about it.\n\n### The Saltmere Conspiracy\n\nThe official history says three merchants founded Saltmere together.\n\n**The truth:** Vaelith suggested it. Not directly‚Äîthrough intermediaries. He saw the Confederation needed economic stability to survive. He nudged the right people toward the right opportunity. The founders think it was their idea.\n\nIt was his.\n\n### The Empire's Silence\n\nWhy hasn't the Empire tried again in 118 years?\n\n**What most believe:** Fear of The Storm.\n\n**What Vaelith suspects:** The Empire is waiting. Building strength. Planning. The next attack will be overwhelming‚Äîor not come at all. Valandor is patient. 118 years is nothing to an immortal.\n\n**The truth Vaelith doesn't know:** Valandor has considered it many times. Each time, his advisors talk him out of it. The risk is too high. The cost too great. And somewhere in his ancient heart, Valandor wonders if the drow haven't suffered enough.\n\n### Plot Hooks\n\n| Hook | Description |\n|------|-------------|\n| **The First Monarch's Name** | Someone claims to have found records of the first Pirate King. What does the name reveal? Why was it hidden? |\n| **The Storm's Log** | Vaelith kept records during those 180 years alone. His early logbooks still exist. What's in them? |\n| **The Saltmere Papers** | Evidence emerges that Vaelith orchestrated Saltmere's founding. Does this change anything? |\n| **The Empire Returns** | After 118 years, the Empire is building a new fleet. Is this the final confrontation? |\n| **Before the Battle** | Flashback adventure: the desperate days before the Storm rose. What were the PCs' ancestors doing? |\n\n### The Real Foundation\n\nThe Confederation exists because of fear. Not fear of enemies‚Äîfear of Vaelith.\n\nEvery monarch knows: rule poorly, and The Storm might care. Every captain knows: break Harbor Peace, and The Storm will respond. Every settlement knows: threaten the Confederation, and The Storm is the Confederation's response.\n\nHe doesn't need to act. The possibility of action is enough.\n\n**This is why the Isles work:** Not because the system is good, but because everyone fears what happens if it fails.\n\n---",
  "connections": "flowchart TD\n    subgraph Ancient[\"‚è≥ Ancient\"]\n        First[\"First Peoples<br/>Orcs, Goblins, Bugbears\"]\n    end\n    \n    subgraph Refugees[\"üìú ~200-120 years ago\"]\n        Flee[\"Refugees Arrive<br/>Drow, Humans, Others\"]\n    end\n    \n    subgraph Crisis[\"‚öîÔ∏è ~118 years ago\"]\n        Fleet[\"Empire Fleet<br/>(40 ships)\"]\n        Storm[\"Vaelith Unites<br/>the Isles\"]\n        Battle[\"Battle of<br/>Broken Straits\"]\n        Founding[\"Confederation<br/>Founded\"]\n    end\n    \n    subgraph Modern[\"üìç Now\"]\n        Conf[\"The Confederation<br/>Graza rules, Storm watches\"]\n    end\n    \n    First --> Flee\n    Flee --> Fleet\n    Fleet --> Storm\n    Storm --> Battle\n    Battle -->|\"Empire destroyed\"| Founding\n    Founding --> Conf\n    \n    style Storm fill:#4a4a4a,color:#fff\n    style Battle fill:#f4cccc,color:#000\n    style Conf fill:#d9ead3,color:#000",
  "seeAlso": [
    "The Broken Isles",
    "Vaelith Draegor",
    "Freehold Harbor",
    "Saltmere",
    "Graza Bloodtide"
  ],
  "rawContent": "# History of the Broken Isles\n\n> *\"Before The Storm, we were prey. After The Storm, we became the hunters.\"*\n\n| | |\n|---|---|\n| **Era** | Ancient to Present |\n| **Key Event** | Battle of the Broken Straits (~118 years ago) |\n| **Founder** | [Vaelith Draegor](/npcs/vaelith-the-storm-draegor) (refused crown) |\n| **Result** | Pirate Confederation established |\n| **Related** | [The Broken Isles](/factions/the-broken-isles) |\n\n---\n\n## At a Glance\n> **What anyone in the Isles would know**\n\nThe Broken Isles weren't always unified. For generations, they were scattered‚Äînative orcs and goblins, desperate refugees, independent pirates preying on each other as much as the mainland.\n\nThen the Thelassian came to finish their genocide.\n\n118 years ago, a massive Imperial fleet sailed east to destroy the pirate havens and hunt down escaped drow. They found Vaelith Draegor waiting. The Storm united every captain, every clan, every desperate soul who had nowhere else to run.\n\nThe Battle of the Broken Straits destroyed the Empire fleet. 30+ warships sunk. The survivors begged Vaelith to be king. He refused.\n\n*\"I don't want your throne. I want the sea. Choose your own king.\"*\n\nThey did. The Confederation was born. And The Storm has watched over it ever since.\n\n*Common saying: \"The Isles belong to whoever sits the throne. The throne belongs to The Storm.\"*\n\n---\n\n## Common Knowledge\n> **What Isles residents, historians, or sailors would know**\n\n### The First Peoples (Ancient)\n\nBefore outsiders arrived, the islands were already inhabited:\n- **Orcs** on Stormcrag (farming, raiding, clan feuds)\n- **Goblins** on Greenfire Isle (early shipbuilding)\n- **Bugbears** in Mistwood (hunting, ruins)\n\nWhere they came from is lost to time. They simply were.\n\n### The Refugee Era (~200-120 years ago)\n\nAs mainland persecution intensified, desperate people fled to the Isles:\n- Kingdom commoners fleeing noble rule\n- Drow escaping the genocide\n- Half-breeds rejected by both societies\n- Criminals, deserters, the desperate\n\nIntegration was rough. The First Peoples didn't welcome invaders. But shared enemies‚Äîthe mainland powers‚Äîeventually created common ground.\n\n### The Scattering (~120-118 years ago)\n\nFor decades, the Isles had no unity:\n- Pirates preyed on each other\n- No safe harbors\n- Mainland powers picked off ships one by one\n- Every captain for themselves\n\n### The Empire's Wrath (~118 years ago)\n\nThe Thelassian decided to end the drow escape route permanently. Emperor Valandor authorized a purge fleet: 40+ warships, thousands of soldiers, orders to show no mercy.\n\nWord reached the Isles. Panic spread. Individual captains couldn't fight a fleet.\n\n### The Storm Rises\n\n[Vaelith Draegor](/npcs/vaelith-the-storm-draegor) had sailed these waters for 180 years, destroying Empire ships but ignoring Isles politics. This time was different. The Empire was coming for drow‚Äîfor his people.\n\nHe sailed into Freehold Harbor and called every captain to gather:\n\n> *\"The Empire comes to finish what they started. We fight, or we die‚Äînot today, but soon, one by one. I will fight. Those who sail with me will have the protection of The Storm.\"*\n\nEvery captain chose to fight.\n\n### The Battle of the Broken Straits\n\n~100 pirate vessels against 40 Imperial warships. Vaelith used local knowledge to force the Empire into narrow channels where numbers meant nothing.\n\n**Result:** 30+ Imperial ships destroyed. The survivors fled. The drow they came to hunt watched their hunters drown.\n\n### The Founding\n\nAfter the battle, captains begged Vaelith to rule. He refused:\n\n> *\"Choose your own king. Make your own laws. I will be here if the Empire returns.\"*\n\nThe first Moot established:\n- The Pirate Monarch (elected)\n- Harbor Peace (Vaelith's demand)\n- Tribute system for collective defense\n- Freehold as capital\n\n### Since Then\n\n**~60 years ago:** Saltmere founded as commercial capital\n**~20 years ago:** Gorrath unites orc clans\n**~3 years ago:** Graza Bloodtide becomes Queen\n\nThe Confederation has endured 118 years. Monarchs rise and fall. The Storm remains.\n\n---\n\n## Secret Knowledge\n> **DM-only information**\n\n### Why Vaelith Refused the Crown\n\nThe official story: He wanted the sea, not power.\n\n**The deeper truth:** Vaelith saw what crowns did. The Empire's emperor has ruled for 1,500 years, and look what the Empire became. The Kingdom's king barely controls his lords. Power corrupts. Thrones demand compromise.\n\nBy refusing to rule, Vaelith kept himself pure. He answers to no one. He compromises nothing. He can destroy the Empire with single-minded focus.\n\n**The strategic genius:** By refusing power, he gained more than any crown could give. Everyone owes him. No one can challenge him. He rules by not ruling.\n\n### The Lost First Monarch\n\nThe name of the first Pirate King is genuinely lost. Some say it was deliberate‚ÄîVaelith ordered the name forgotten so no dynasty could claim descent.\n\nOthers say the first monarch was... unremarkable. Chosen to fill a role, not for greatness. The Confederation needed a figurehead. They got one. He died. No one remembered.\n\n### What Vaelith Did Before\n\n180 years between his escape and the Battle. What did he do?\n\n**The truth:** He hunted. Every Empire ship that strayed too far east. Every slaver. Every naval patrol. He learned the waters. He built his fleet one captured ship at a time. He became a legend before he ever appeared at Freehold.\n\n**His kill count:** Unknown, but estimates range in the hundreds of ships over those decades. The Empire knows. They don't talk about it.\n\n### The Saltmere Conspiracy\n\nThe official history says three merchants founded Saltmere together.\n\n**The truth:** Vaelith suggested it. Not directly‚Äîthrough intermediaries. He saw the Confederation needed economic stability to survive. He nudged the right people toward the right opportunity. The founders think it was their idea.\n\nIt was his.\n\n### The Empire's Silence\n\nWhy hasn't the Empire tried again in 118 years?\n\n**What most believe:** Fear of The Storm.\n\n**What Vaelith suspects:** The Empire is waiting. Building strength. Planning. The next attack will be overwhelming‚Äîor not come at all. Valandor is patient. 118 years is nothing to an immortal.\n\n**The truth Vaelith doesn't know:** Valandor has considered it many times. Each time, his advisors talk him out of it. The risk is too high. The cost too great. And somewhere in his ancient heart, Valandor wonders if the drow haven't suffered enough.\n\n### Plot Hooks\n\n| Hook | Description |\n|------|-------------|\n| **The First Monarch's Name** | Someone claims to have found records of the first Pirate King. What does the name reveal? Why was it hidden? |\n| **The Storm's Log** | Vaelith kept records during those 180 years alone. His early logbooks still exist. What's in them? |\n| **The Saltmere Papers** | Evidence emerges that Vaelith orchestrated Saltmere's founding. Does this change anything? |\n| **The Empire Returns** | After 118 years, the Empire is building a new fleet. Is this the final confrontation? |\n| **Before the Battle** | Flashback adventure: the desperate days before the Storm rose. What were the PCs' ancestors doing? |\n\n### The Real Foundation\n\nThe Confederation exists because of fear. Not fear of enemies‚Äîfear of Vaelith.\n\nEvery monarch knows: rule poorly, and The Storm might care. Every captain knows: break Harbor Peace, and The Storm will respond. Every settlement knows: threaten the Confederation, and The Storm is the Confederation's response.\n\nHe doesn't need to act. The possibility of action is enough.\n\n**This is why the Isles work:** Not because the system is good, but because everyone fears what happens if it fails.\n\n---\n\n## Connections\n\n```mermaid\nflowchart TD\n    subgraph Ancient[\"‚è≥ Ancient\"]\n        First[\"First Peoples<br/>Orcs, Goblins, Bugbears\"]\n    end\n    \n    subgraph Refugees[\"üìú ~200-120 years ago\"]\n        Flee[\"Refugees Arrive<br/>Drow, Humans, Others\"]\n    end\n    \n    subgraph Crisis[\"‚öîÔ∏è ~118 years ago\"]\n        Fleet[\"Empire Fleet<br/>(40 ships)\"]\n        Storm[\"Vaelith Unites<br/>the Isles\"]\n        Battle[\"Battle of<br/>Broken Straits\"]\n        Founding[\"Confederation<br/>Founded\"]\n    end\n    \n    subgraph Modern[\"üìç Now\"]\n        Conf[\"The Confederation<br/>Graza rules, Storm watches\"]\n    end\n    \n    First --> Flee\n    Flee --> Fleet\n    Fleet --> Storm\n    Storm --> Battle\n    Battle -->|\"Empire destroyed\"| Founding\n    Founding --> Conf\n    \n    style Storm fill:#4a4a4a,color:#fff\n    style Battle fill:#f4cccc,color:#000\n    style Conf fill:#d9ead3,color:#000\n```\n\n---\n\n## See Also\n\n- [The Broken Isles](/factions/the-broken-isles) - The confederation today\n- [Vaelith Draegor](/npcs/vaelith-the-storm-draegor) - The Storm\n- [Freehold Harbor](/geography/freehold-harbor) - Political capital\n- [Saltmere](/geography/saltmere) - Economic capital\n- [Graza Bloodtide](/npcs/graza-bloodtide) - Current monarch\n\n---\n\n*\"118 years ago, we were scattered and dying. The Storm gave us a choice: unite or perish. We chose to live. We've been living ever since.\"*\n",
  "sourcePath": "03-History/History of the Broken Isles.md",
  "slug": "history-of-the-broken-isles",
  "category": "history"
}