{
  "title": "The Founding - 80 Years Ago",
  "metadata": {
    "Date": "80 years ago",
    "Location": "Central mountain pass",
    "Key Figures": "[[Vera Wyrdweaver]], [[Thaelen Ruincalen]], [[Thorongil (Vaethor)]]",
    "Result": "Creation of [[Veraheim]]",
    "Significance": "Changed the balance of power forever"
  },
  "epigraph": "She split a mountain for love. She built a city for spite. She proved them all wrong.",
  "atAGlance": "80 years ago, the most powerful human sorceress fell in love with the last elven dragon rider. When both their peoples tried to tear them apart, she split a mountain and built a city where neither empire could reach them.\n\nVeraheim stands as sanctuary for the rejected, the exiled, the unwanted. The tunnel through the mountain is now the only safe trade route between east and west. Both powers hate it. Both powers need it.\n\nA dragon guards the peak. Anyone who threatens the city faces Vera's power and Thaelen's blade and Thorongil's flame.\n\n*Common saying: \"She didn't just build a city. She built a middle finger aimed at two empires.\"*\n\n---",
  "commonKnowledge": "### The Crisis\n\nA catastrophe threatened the mountain pass‚Äîthe vital trade route between the Thelassian and Aloria was collapsing. Avalanches, earthquakes, something unstable in the deep rock. Travelers were dying. Trade was stopping.\n\n### The Meeting\n\n**Thaelen Ruincalen**‚Äîthe last Dragon Knight with an intact bond‚Äîwas dispatched by the Empire. His official mission: investigate the crisis. His secret mission: eliminate Vera Wyrdweaver, a human sorceress the Empire considered a threat.\n\nWhen he found her, she was in the midst of the disaster, using her power to save lives. Elven lives. Human lives. Anyone trapped in the collapse.\n\nThaelen had a choice: complete his mission or help her save people. He chose honor over orders.\n\n### The Love\n\nIn the aftermath, saving lives together, they fell in love. The dragon rider and the sorceress. The elf and the human. The Empire's greatest weapon and the Kingdom's most powerful mage.\n\nThorongil‚ÄîThaelen's dragon‚Äîapproved. He recognized something in Vera: a spirit as fierce as any dragon's.\n\n### The Outrage\n\nBoth powers reacted with fury:\n\n**The Thelassian:** Accused Vera of using enchantment to seduce their champion. Demanded Thaelen's return. Called Vera a witch and a threat.\n\n**The Aloria:** Accused the elves of kidnapping their greatest sorceress. Demanded Vera's return. Called the Empire traitors and liars.\n\n### The Hunt\n\nBoth powers sent forces to capture the pair. Soldiers died. Knights died. Dragon Knights died‚Äîagainst Thorongil, they had no chance.\n\nThe violence was senseless. The politics were petty. Two empires fought over two people who just wanted to be left alone.\n\n### The Mountain Splits\n\nIn her rage at the senseless death, Vera's power manifested fully.\n\n**She split the mountain.**\n\nRaw magical force, grief and anger made manifest, tore the rock apart. The pass that had been collapsing became a canyon‚Äîcontrolled, deliberate, carved by will alone.\n\nAnd in that canyon, 500 feet above the ground, she carved a city.\n\n### Veraheim Born\n\n\"Vera's Home.\" A sanctuary accessible only by lifts she controlled. A dragon on the peak. A trade route through the tunnel below‚Äîthe only safe passage between east and west.\n\nBoth empires could threaten. Neither could attack. The dragon alone made assault suicide. Vera's demonstrated power made it worse.\n\nThey came to negotiate. They stayed to trade. They've been paying tolls ever since.\n\n---",
  "secretKnowledge": "### The Truth About Thaelen's Mission\n\nThaelen wasn't just sent to \"investigate.\" Velindor Shadowmere had identified Vera as a potential threat‚Äîa human with power approaching elven archmages, loyal to no one, impossible to control.\n\n**The secret order:** If opportunity arose, eliminate her. Make it look like the disaster killed her. Report back that she died heroically.\n\n**What Thaelen did:** He burned the orders. He never told Vera. He's never told anyone. Velindor suspects but has no proof.\n\n### What Vera Killed\n\nWhen she split the mountain, she wasn't just shaping rock. Imperial soldiers and Kingdom knights were in the pass, trying to capture them.\n\n**The death toll:** Unknown. Vera doesn't know exactly. Thaelen does‚Äîhe counted the bodies. Dozens. Maybe more.\n\n**The cover-up:** No one talks about it. The official history is that she \"created\" Veraheim, not that she killed people doing it. Both empires buried the truth because admitting their soldiers died to a single sorceress was humiliating.\n\n**Vera's guilt:** She knows she killed people. She tells herself it was self-defense. She tells herself they would have killed her and Thaelen. She tells herself there was no choice. She's not sure she believes it.\n\n### Thorongil's Choice\n\nWhen Thaelen fell in love with a human, Thorongil had to choose: his bond or his species.\n\n**He chose his bond.** Without hesitation.\n\n**Why:** Dragons bond for life. The relationship between rider and dragon is deeper than species loyalty. When Thaelen chose Vera, Thorongil chose her too‚Äînot as a second bond, but as pack. Family. His.\n\n**The consequence:** He can never return to dragon society. The elders consider him a traitor twice over‚Äîonce for siding with elves in the war, once for helping his rider defect. He doesn't care. His family is on the mountain.\n\n### The Lift Vulnerability\n\nThe lifts are powered by Vera's magic, tied to her life force. If she dies, they stop working within hours.\n\n**Who knows:**\n- Thaelen (terrified of it)\n- Vera (won't discuss it)\n- Velindor Shadowmere (has agents investigating)\n\n**The problem:** Vera is human. She'll die eventually‚Äîof age if nothing else. When she does, 3,500 people are trapped 500 feet in the air with no way down.\n\n**The solution:** None. They've tried to create backup systems. Nothing works. The magic is uniquely hers.\n\n### Why the Empires Don't Attack\n\n**The official reasons:**\n- The dragon\n- Vera's power\n- Economic necessity\n\n**The deeper reasons:**\n- Fear of what Vera might do if cornered\n- Uncertainty about what other powers she has\n- The example she set‚Äîshe killed soldiers by splitting a mountain\n- Neither empire wants to be the one that triggers her full rage\n\n### The Real Reason Thaelen Defected\n\nIt wasn't just love. Thaelen discovered the truth about the Dragon War‚Äîthat elves struck first against the drow, that the genocide was built on lies.\n\n**His choice:** Stay in an empire built on hidden crimes, or leave with the woman he loved. Love made it easy. The truth made it necessary.\n\n### Plot Hooks\n\n| Hook | Description |\n|------|-------------|\n| **The Death Count** | Someone has a list of everyone Vera killed when she split the mountain. Blackmail? Justice? Revenge? |\n| **Velindor's Orders** | The original assassination orders surface. What happens when Vera learns the truth? |\n| **The Succession Problem** | Vera's mortality becomes public knowledge. Panic spreads. Is there a solution? |\n| **Thorongil's Kin** | A young dragon arrives at Veraheim. It wants to meet Thorongil. What does it want? |\n| **The Anniversary** | 80 years since the founding. Both empires are planning \"commemorations.\" Are they celebrations or threats? |\n\n---",
  "connections": "flowchart TD\n    subgraph Before[\"‚è≥ Before\"]\n        Crisis[\"Mountain Crisis\"]\n        Mission[\"Thaelen's Secret<br/>Mission: Kill Vera\"]\n    end\n    \n    subgraph Meeting[\"üíï The Meeting\"]\n        Save[\"They Save Lives<br/>Together\"]\n        Love[\"They Fall in Love\"]\n        Thor[\"Thorongil Approves\"]\n    end\n    \n    subgraph Reaction[\"‚öîÔ∏è The Reaction\"]\n        Empire[\"Empire: She<br/>Enchanted Him!\"]\n        Kingdom[\"Kingdom: They<br/>Kidnapped Her!\"]\n        Hunt[\"Both Send<br/>Forces\"]\n    end\n    \n    subgraph Creation[\"üèîÔ∏è The Creation\"]\n        Rage[\"Vera's Rage\"]\n        Split[\"Mountain Splits\"]\n        Deaths[\"Soldiers Die<br/>(hidden truth)\"]\n        City[\"Veraheim Born\"]\n    end\n    \n    Crisis --> Save\n    Mission --> Save\n    Save --> Love\n    Love --> Thor\n    Thor --> Empire & Kingdom\n    Empire & Kingdom --> Hunt\n    Hunt --> Rage\n    Rage --> Split\n    Split --> Deaths\n    Split --> City\n    \n    style Deaths fill:#f4cccc,color:#000\n    style City fill:#d9ead3,color:#000\n    style Love fill:#fff2cc,color:#000",
  "seeAlso": [
    "Veraheim",
    "Vera Wyrdweaver",
    "Thaelen Ruincalen",
    "Thorongil (Vaethor)",
    "The Floating Docks"
  ],
  "rawContent": "# The Founding - 80 Years Ago\n\n> *\"She split a mountain for love. She built a city for spite. She proved them all wrong.\"*\n\n| | |\n|---|---|\n| **Date** | 80 years ago |\n| **Location** | Central mountain pass |\n| **Key Figures** | [Vera Wyrdweaver](/npcs/vera-wyrdweaver), [Thaelen Ruincalen](/npcs/thaelen-ruincalen), [Thorongil (Vaethor)](/npcs/thorongil-vaethor) |\n| **Result** | Creation of [Veraheim](/factions/veraheim-the-sanctuary) |\n| **Significance** | Changed the balance of power forever |\n\n---\n\n## At a Glance\n> **What everyone knows**\n\n80 years ago, the most powerful human sorceress fell in love with the last elven dragon rider. When both their peoples tried to tear them apart, she split a mountain and built a city where neither empire could reach them.\n\nVeraheim stands as sanctuary for the rejected, the exiled, the unwanted. The tunnel through the mountain is now the only safe trade route between east and west. Both powers hate it. Both powers need it.\n\nA dragon guards the peak. Anyone who threatens the city faces Vera's power and Thaelen's blade and Thorongil's flame.\n\n*Common saying: \"She didn't just build a city. She built a middle finger aimed at two empires.\"*\n\n---\n\n## Common Knowledge\n> **What most people would know about the founding**\n\n### The Crisis\n\nA catastrophe threatened the mountain pass‚Äîthe vital trade route between the Thelassian and Aloria was collapsing. Avalanches, earthquakes, something unstable in the deep rock. Travelers were dying. Trade was stopping.\n\n### The Meeting\n\n**Thaelen Ruincalen**‚Äîthe last Dragon Knight with an intact bond‚Äîwas dispatched by the Empire. His official mission: investigate the crisis. His secret mission: eliminate Vera Wyrdweaver, a human sorceress the Empire considered a threat.\n\nWhen he found her, she was in the midst of the disaster, using her power to save lives. Elven lives. Human lives. Anyone trapped in the collapse.\n\nThaelen had a choice: complete his mission or help her save people. He chose honor over orders.\n\n### The Love\n\nIn the aftermath, saving lives together, they fell in love. The dragon rider and the sorceress. The elf and the human. The Empire's greatest weapon and the Kingdom's most powerful mage.\n\nThorongil‚ÄîThaelen's dragon‚Äîapproved. He recognized something in Vera: a spirit as fierce as any dragon's.\n\n### The Outrage\n\nBoth powers reacted with fury:\n\n**The Thelassian:** Accused Vera of using enchantment to seduce their champion. Demanded Thaelen's return. Called Vera a witch and a threat.\n\n**The Aloria:** Accused the elves of kidnapping their greatest sorceress. Demanded Vera's return. Called the Empire traitors and liars.\n\n### The Hunt\n\nBoth powers sent forces to capture the pair. Soldiers died. Knights died. Dragon Knights died‚Äîagainst Thorongil, they had no chance.\n\nThe violence was senseless. The politics were petty. Two empires fought over two people who just wanted to be left alone.\n\n### The Mountain Splits\n\nIn her rage at the senseless death, Vera's power manifested fully.\n\n**She split the mountain.**\n\nRaw magical force, grief and anger made manifest, tore the rock apart. The pass that had been collapsing became a canyon‚Äîcontrolled, deliberate, carved by will alone.\n\nAnd in that canyon, 500 feet above the ground, she carved a city.\n\n### Veraheim Born\n\n\"Vera's Home.\" A sanctuary accessible only by lifts she controlled. A dragon on the peak. A trade route through the tunnel below‚Äîthe only safe passage between east and west.\n\nBoth empires could threaten. Neither could attack. The dragon alone made assault suicide. Vera's demonstrated power made it worse.\n\nThey came to negotiate. They stayed to trade. They've been paying tolls ever since.\n\n---\n\n## Secret Knowledge\n> **DM-only information**\n\n### The Truth About Thaelen's Mission\n\nThaelen wasn't just sent to \"investigate.\" Velindor Shadowmere had identified Vera as a potential threat‚Äîa human with power approaching elven archmages, loyal to no one, impossible to control.\n\n**The secret order:** If opportunity arose, eliminate her. Make it look like the disaster killed her. Report back that she died heroically.\n\n**What Thaelen did:** He burned the orders. He never told Vera. He's never told anyone. Velindor suspects but has no proof.\n\n### What Vera Killed\n\nWhen she split the mountain, she wasn't just shaping rock. Imperial soldiers and Kingdom knights were in the pass, trying to capture them.\n\n**The death toll:** Unknown. Vera doesn't know exactly. Thaelen does‚Äîhe counted the bodies. Dozens. Maybe more.\n\n**The cover-up:** No one talks about it. The official history is that she \"created\" Veraheim, not that she killed people doing it. Both empires buried the truth because admitting their soldiers died to a single sorceress was humiliating.\n\n**Vera's guilt:** She knows she killed people. She tells herself it was self-defense. She tells herself they would have killed her and Thaelen. She tells herself there was no choice. She's not sure she believes it.\n\n### Thorongil's Choice\n\nWhen Thaelen fell in love with a human, Thorongil had to choose: his bond or his species.\n\n**He chose his bond.** Without hesitation.\n\n**Why:** Dragons bond for life. The relationship between rider and dragon is deeper than species loyalty. When Thaelen chose Vera, Thorongil chose her too‚Äînot as a second bond, but as pack. Family. His.\n\n**The consequence:** He can never return to dragon society. The elders consider him a traitor twice over‚Äîonce for siding with elves in the war, once for helping his rider defect. He doesn't care. His family is on the mountain.\n\n### The Lift Vulnerability\n\nThe lifts are powered by Vera's magic, tied to her life force. If she dies, they stop working within hours.\n\n**Who knows:**\n- Thaelen (terrified of it)\n- Vera (won't discuss it)\n- Velindor Shadowmere (has agents investigating)\n\n**The problem:** Vera is human. She'll die eventually‚Äîof age if nothing else. When she does, 3,500 people are trapped 500 feet in the air with no way down.\n\n**The solution:** None. They've tried to create backup systems. Nothing works. The magic is uniquely hers.\n\n### Why the Empires Don't Attack\n\n**The official reasons:**\n- The dragon\n- Vera's power\n- Economic necessity\n\n**The deeper reasons:**\n- Fear of what Vera might do if cornered\n- Uncertainty about what other powers she has\n- The example she set‚Äîshe killed soldiers by splitting a mountain\n- Neither empire wants to be the one that triggers her full rage\n\n### The Real Reason Thaelen Defected\n\nIt wasn't just love. Thaelen discovered the truth about the Dragon War‚Äîthat elves struck first against the drow, that the genocide was built on lies.\n\n**His choice:** Stay in an empire built on hidden crimes, or leave with the woman he loved. Love made it easy. The truth made it necessary.\n\n### Plot Hooks\n\n| Hook | Description |\n|------|-------------|\n| **The Death Count** | Someone has a list of everyone Vera killed when she split the mountain. Blackmail? Justice? Revenge? |\n| **Velindor's Orders** | The original assassination orders surface. What happens when Vera learns the truth? |\n| **The Succession Problem** | Vera's mortality becomes public knowledge. Panic spreads. Is there a solution? |\n| **Thorongil's Kin** | A young dragon arrives at Veraheim. It wants to meet Thorongil. What does it want? |\n| **The Anniversary** | 80 years since the founding. Both empires are planning \"commemorations.\" Are they celebrations or threats? |\n\n---\n\n## Connections\n\n```mermaid\nflowchart TD\n    subgraph Before[\"‚è≥ Before\"]\n        Crisis[\"Mountain Crisis\"]\n        Mission[\"Thaelen's Secret<br/>Mission: Kill Vera\"]\n    end\n    \n    subgraph Meeting[\"üíï The Meeting\"]\n        Save[\"They Save Lives<br/>Together\"]\n        Love[\"They Fall in Love\"]\n        Thor[\"Thorongil Approves\"]\n    end\n    \n    subgraph Reaction[\"‚öîÔ∏è The Reaction\"]\n        Empire[\"Empire: She<br/>Enchanted Him!\"]\n        Kingdom[\"Kingdom: They<br/>Kidnapped Her!\"]\n        Hunt[\"Both Send<br/>Forces\"]\n    end\n    \n    subgraph Creation[\"üèîÔ∏è The Creation\"]\n        Rage[\"Vera's Rage\"]\n        Split[\"Mountain Splits\"]\n        Deaths[\"Soldiers Die<br/>(hidden truth)\"]\n        City[\"Veraheim Born\"]\n    end\n    \n    Crisis --> Save\n    Mission --> Save\n    Save --> Love\n    Love --> Thor\n    Thor --> Empire & Kingdom\n    Empire & Kingdom --> Hunt\n    Hunt --> Rage\n    Rage --> Split\n    Split --> Deaths\n    Split --> City\n    \n    style Deaths fill:#f4cccc,color:#000\n    style City fill:#d9ead3,color:#000\n    style Love fill:#fff2cc,color:#000\n```\n\n---\n\n## See Also\n\n- [Veraheim](/factions/veraheim-the-sanctuary) - The city she built\n- [Vera Wyrdweaver](/npcs/vera-wyrdweaver) - The founder\n- [Thaelen Ruincalen](/npcs/thaelen-ruincalen) - The last dragon rider\n- [Thorongil (Vaethor)](/npcs/thorongil-vaethor) - The guardian\n- [The Floating Docks](/geography/the-floating-docks) - The shadow of her idealism\n\n---\n\n*\"Two empires couldn't stop her. Two empires couldn't hold her. So she built her own.\"*\n",
  "sourcePath": "03-History/The Founding - 80 Years Ago.md",
  "slug": "the-founding-80-years-ago",
  "category": "history"
}