{
  "title": "Aelindir Graceborn",
  "metadata": {
    "Age": "400 years",
    "Race": "High Elf, Male",
    "Role": "Protocols, Rituals, Court Events",
    "Reports To": "Voice of the Throne (Aerindel Silvarion)",
    "Location": "Eternal Spire, Crown Plaza"
  },
  "epigraph": "Protocol exists so that no one must think. Follow it, and nothing can go wrong.",
  "atAGlance": "Aelindir Graceborn orchestrates every ceremony, ritual, and formal event in the Imperial court. He knows the correct greeting for every rank, the proper seating for every occasion, and the precise way to handle 1,500 years of accumulated protocol. Without him, the court would descend into chaos within a week.\n\n---",
  "commonKnowledge": "- Has organized every Imperial ceremony for 300 years\n- Knows the precedence order of every noble house\n- Can recite proper protocol for situations that haven't occurred in centuries\n- Has never allowed a seating disaster (his proudest achievement)\n\n---\n\nFussy, perfectionist, secretly anxious. Treats minor protocol violations as catastrophes. Memorizes guest lists obsessively. Surprisingly effective at smoothing over social disasters—he's seen everything. Considers his work essential to Imperial dignity.\n\n---",
  "secretKnowledge": "He loathes the nobility. After 300 years of watching them obsess over table placement while the Empire has real problems, he's developed a quiet contempt. He serves perfectly because professionalism demands it, not because he respects them.\n\n---",
  "seeAlso": [],
  "rawContent": "# Aelindir Graceborn\n\n**Master of Ceremonies** | Eternal Spire (Court Position)\n\n> *\"Protocol exists so that no one must think. Follow it, and nothing can go wrong.\"*\n\n| | |\n|---|---|\n| **Age** | 400 years |\n| **Race** | High Elf, Male |\n| **Role** | Protocols, Rituals, Court Events |\n| **Reports To** | Voice of the Throne (Aerindel Silvarion) |\n| **Location** | Eternal Spire, Crown Plaza |\n\n---\n\n## Overview\n\nAelindir Graceborn orchestrates every ceremony, ritual, and formal event in the Imperial court. He knows the correct greeting for every rank, the proper seating for every occasion, and the precise way to handle 1,500 years of accumulated protocol. Without him, the court would descend into chaos within a week.\n\n---\n\n## Personality & Approach\n\nFussy, perfectionist, secretly anxious. Treats minor protocol violations as catastrophes. Memorizes guest lists obsessively. Surprisingly effective at smoothing over social disasters—he's seen everything. Considers his work essential to Imperial dignity.\n\n---\n\n## Key Facts\n\n- Has organized every Imperial ceremony for 300 years\n- Knows the precedence order of every noble house\n- Can recite proper protocol for situations that haven't occurred in centuries\n- Has never allowed a seating disaster (his proudest achievement)\n\n---\n\n## Secret (DM Only)\n\nHe loathes the nobility. After 300 years of watching them obsess over table placement while the Empire has real problems, he's developed a quiet contempt. He serves perfectly because professionalism demands it, not because he respects them.\n\n---\n\n## Connections\n\n- **Aerindel Silvarion**: Superior - Coordinates announcements and ceremonies\n- **All noble houses**: Professional necessity - Manages their constant demands\n- **Aelindra Songweaver**: Colleague - Cultural events require coordination\n",
  "sourcePath": "06-NPCs/Thelassian/Aelindir Graceborn.md",
  "slug": "aelindir-graceborn",
  "category": "npcs"
}