{
  "title": "Boss Nix Quickfingers",
  "metadata": {
    "Age": "29",
    "Race": "Goblin",
    "Role": "Swarm Fleet Commander",
    "Fleet": "30+ small vessels",
    "Base": "Skarath / Freehold Harbor"
  },
  "atAGlance": "**Boss Nix Quickfingers** - The Swarm Lord\n\n- Goblin captain commanding the LARGEST fleet by ship count‚Äî30+ vessels\n- The catch: they're all small. Sloops, cutters, skiffs, boats other captains would dismiss\n- Swarm tactics make thirty small ships deadlier than one big one\n- Manic, chaotic, fast-talking‚Äîand surprisingly effective\n- *Common saying: \"They laughed at his boats. Then thirty boats showed up at once.\"*\n\n| | |\n|---|---|\n| **Age** | 29 |\n| **Race** | Goblin |\n| **Role** | Swarm Fleet Commander |\n| **Fleet** | 30+ small vessels |\n| **Base** | Skarath / Freehold Harbor |\n\n---",
  "commonKnowledge": "### Appearance & Manner\nSmall even for a goblin (3'2\"). Wiry, constantly in motion, can't sit still. Pale green skin, huge yellow darting eyes, enormous twitching ears. Wears an oversized captain's coat (stolen, too big, doesn't care). Long nimble fingers always fidgeting. Manic grin like he knows a joke no one else gets.\n\n### Personality\nNever stops moving. Talks fast, thinks faster. Five plans running simultaneously. Attention span of a caffeinated squirrel. Exhausting to be around. \"More is always better\" is his philosophy. Thirty ships? Why not fifty? Numbers, numbers, numbers.\n\n### The Swarm Fleet\n- 30+ small vessels (fluctuates constantly)\n- Each carries 8-15 goblins\n- ~400 crew across the fleet\n- All from Skarath goblin families\n- Fast, maneuverable, expendable, NUMEROUS\n\n### Swarm Tactics\nAgainst large ships: fifteen small ships surround, attack from all directions, board before they can respond. Can't fight them all at once. Death by a thousand cuts. If losing, scatter in thirty directions‚Äîenemy can only chase a few.\n\n### Famous Maneuver: \"The Net\"\nCircle target with fifteen+ boats. Throw grappling hooks from all sides. Board from every direction. Whole attack takes under ten minutes.\n\n### Known Relationships\n- **The Storm:** Absolutely terrified. Has ordered fleet to NEVER approach *Sorrow*. \"Some fights you run.\"\n- **The Rapier:** Mutual amusement. Different styles, same cockiness.\n- **The Admiral:** Contempt from Kozrek‚Äî\"undisciplined rabble.\" Nix escaped his trap once and bought five new boats with the profit.\n\n---",
  "secretKnowledge": "### True Nature\nThe manic exterior hides sharp cunning. Coordinating thirty ships requires intelligence most don't credit him with. He knows exactly where every vessel is, tracks complex logistics, and plans multiple contingencies. Underestimating him is a mistake many have made once.\n\n### Why It Works\n- **Cheap:** Can replace losses easily\n- **Fast:** Outrun what they can't fight\n- **Nimble:** Go places big ships can't\n- **Numerous:** Overwhelm through count\n- **Disposable:** Losing one isn't catastrophic\n\n### The Skarath Connection\nNix is from Skarath, the goblin shipbuilding center. His family builds ships. He buys at discount. This is why he can maintain such a large fleet‚Äîwholesale prices from relatives. Threatening Skarath threatens his entire operation.\n\n### Revenue Streams\n- Standard piracy (cargo)\n- Transport for hire (move things quietly)\n- Scouting services (nobody watches waters like Nix)\n- Salvage operations (quick to reach wrecks)\n- Smuggling (small ships, hidden coves)\n\n### Goblin Logic\n- \"Fair fight\" means you planned poorly\n- Overwhelming force is the only force\n- Running away is valid tactic\n- Survival beats honor\n- Profit over pride\n\n### What He Wants\n- More ships (always more)\n- Fifty ships would be nice\n- Respect despite the jokes\n- His family's prosperity\n\n### What He Fears\n- The Storm (sensibly)\n- Storms (weather‚Äîsmall ships are vulnerable)\n- Losing coordination (thirty ships need communication)\n- Something hunting his ships (pirates don't just vanish...)\n\n### Story Hooks\n\n| Hook | Description |\n|------|-------------|\n| **The Blockade** | Need to break a naval blockade? Nix's swarm is perfect distraction. |\n| **Missing Ships** | Several boats disappeared. Pirates don't just vanish. What's hunting them? |\n| **The Expansion** | Nix wants fifty ships. His moves threaten other captains' territories. |\n| **The Race** | Bet between Nix and The Rapier‚Äîwho reaches a point first? Stakes are high. |\n| **Goblin Family Drama** | Conflict in Skarath threatens ship supply. He needs to solve family problems. |\n| **The Salvage** | Nix found something in a wreck. Something valuable. Something others want. |\n\n---",
  "seeAlso": [],
  "rawContent": "# Boss Nix Quickfingers\n\n## At a Glance\n> **What anyone in the Broken Isles would know**\n\n**Boss Nix Quickfingers** - The Swarm Lord\n\n- Goblin captain commanding the LARGEST fleet by ship count‚Äî30+ vessels\n- The catch: they're all small. Sloops, cutters, skiffs, boats other captains would dismiss\n- Swarm tactics make thirty small ships deadlier than one big one\n- Manic, chaotic, fast-talking‚Äîand surprisingly effective\n- *Common saying: \"They laughed at his boats. Then thirty boats showed up at once.\"*\n\n| | |\n|---|---|\n| **Age** | 29 |\n| **Race** | Goblin |\n| **Role** | Swarm Fleet Commander |\n| **Fleet** | 30+ small vessels |\n| **Base** | Skarath / Freehold Harbor |\n\n---\n\n## Common Knowledge\n> **What pirates, merchants, or visitors to the Isles would know**\n\n### Appearance & Manner\nSmall even for a goblin (3'2\"). Wiry, constantly in motion, can't sit still. Pale green skin, huge yellow darting eyes, enormous twitching ears. Wears an oversized captain's coat (stolen, too big, doesn't care). Long nimble fingers always fidgeting. Manic grin like he knows a joke no one else gets.\n\n### Personality\nNever stops moving. Talks fast, thinks faster. Five plans running simultaneously. Attention span of a caffeinated squirrel. Exhausting to be around. \"More is always better\" is his philosophy. Thirty ships? Why not fifty? Numbers, numbers, numbers.\n\n### The Swarm Fleet\n- 30+ small vessels (fluctuates constantly)\n- Each carries 8-15 goblins\n- ~400 crew across the fleet\n- All from Skarath goblin families\n- Fast, maneuverable, expendable, NUMEROUS\n\n### Swarm Tactics\nAgainst large ships: fifteen small ships surround, attack from all directions, board before they can respond. Can't fight them all at once. Death by a thousand cuts. If losing, scatter in thirty directions‚Äîenemy can only chase a few.\n\n### Famous Maneuver: \"The Net\"\nCircle target with fifteen+ boats. Throw grappling hooks from all sides. Board from every direction. Whole attack takes under ten minutes.\n\n### Known Relationships\n- **The Storm:** Absolutely terrified. Has ordered fleet to NEVER approach *Sorrow*. \"Some fights you run.\"\n- **The Rapier:** Mutual amusement. Different styles, same cockiness.\n- **The Admiral:** Contempt from Kozrek‚Äî\"undisciplined rabble.\" Nix escaped his trap once and bought five new boats with the profit.\n\n---\n\n## Secret Knowledge\n> **DM-only information**\n\n### True Nature\nThe manic exterior hides sharp cunning. Coordinating thirty ships requires intelligence most don't credit him with. He knows exactly where every vessel is, tracks complex logistics, and plans multiple contingencies. Underestimating him is a mistake many have made once.\n\n### Why It Works\n- **Cheap:** Can replace losses easily\n- **Fast:** Outrun what they can't fight\n- **Nimble:** Go places big ships can't\n- **Numerous:** Overwhelm through count\n- **Disposable:** Losing one isn't catastrophic\n\n### The Skarath Connection\nNix is from Skarath, the goblin shipbuilding center. His family builds ships. He buys at discount. This is why he can maintain such a large fleet‚Äîwholesale prices from relatives. Threatening Skarath threatens his entire operation.\n\n### Revenue Streams\n- Standard piracy (cargo)\n- Transport for hire (move things quietly)\n- Scouting services (nobody watches waters like Nix)\n- Salvage operations (quick to reach wrecks)\n- Smuggling (small ships, hidden coves)\n\n### Goblin Logic\n- \"Fair fight\" means you planned poorly\n- Overwhelming force is the only force\n- Running away is valid tactic\n- Survival beats honor\n- Profit over pride\n\n### What He Wants\n- More ships (always more)\n- Fifty ships would be nice\n- Respect despite the jokes\n- His family's prosperity\n\n### What He Fears\n- The Storm (sensibly)\n- Storms (weather‚Äîsmall ships are vulnerable)\n- Losing coordination (thirty ships need communication)\n- Something hunting his ships (pirates don't just vanish...)\n\n### Story Hooks\n\n| Hook | Description |\n|------|-------------|\n| **The Blockade** | Need to break a naval blockade? Nix's swarm is perfect distraction. |\n| **Missing Ships** | Several boats disappeared. Pirates don't just vanish. What's hunting them? |\n| **The Expansion** | Nix wants fifty ships. His moves threaten other captains' territories. |\n| **The Race** | Bet between Nix and The Rapier‚Äîwho reaches a point first? Stakes are high. |\n| **Goblin Family Drama** | Conflict in Skarath threatens ship supply. He needs to solve family problems. |\n| **The Salvage** | Nix found something in a wreck. Something valuable. Something others want. |\n\n---\n\n## Connections Map\n\n```mermaid\nflowchart TD\n    subgraph Swarm[\"üêù The Swarm Fleet\"]\n        Nix[\"<b>Boss Nix Quickfingers</b><br/>30+ small ships<br/>~400 goblins\"]\n    end\n    \n    Nix -->|\"terrified of\"| Storm[\"The Storm\"]\n    Nix <-->|\"amused by\"| Rennick[\"The Rapier\"]\n    Nix <-->|\"escaped from\"| Kozrek[\"The Admiral<br/>(contempt)\"]\n    \n    Nix -->|\"from / supplied by\"| Skarath[\"Skarath<br/>(family shipyards)\"]\n    \n    subgraph Tactics[\"Swarm Tactics\"]\n        Surround[\"Surround\"]\n        Overwhelm[\"Overwhelm\"]\n        Scatter[\"Scatter if losing\"]\n    end\n    \n    Nix --- Tactics\n    \n    style Nix fill:#d9ead3,color:#000\n    style Storm fill:#d5a6bd,color:#000\n```\n\n---\n\n## Famous Exploits\n\n**The Merchant Massacre:** Six large Empire merchants surrounded at dawn, all captured by noon. Biggest single haul in his career.\n\n**The Kingdom Trap:** Spotted ambush, led warships into shallows where small boats thrive, captured one. Sold it (too big for his fleet).\n\n**The Scatter:** Cornered by The Admiral's fleet. Ordered scatter‚Äîthirty ships, thirty directions. Admiral caught three. Nix was back to strength in two months.\n\n**The Bridge:** Lined up twenty boats, tied them together, created floating bridge to move cargo past patrol. Gone before dawn.\n\n---\n\n## Notes\n- Chaos with method\n- Numbers game personified\n- Natural contrast to single-ship captains\n- Skarath connection is vulnerability AND strength\n- Surprisingly competent beneath the mania\n",
  "sourcePath": "06-NPCs/Broken Isles/Nix Quickfingers.md",
  "slug": "boss-nix-quickfingers",
  "category": "npcs"
}