{
  "title": "Caelorn Sunblade",
  "metadata": {
    "Age": "320 years",
    "Race": "High Elf, Male",
    "Role": "Day Watch Commander",
    "Reports To": "Captain Thandril Ironsong",
    "Location": "Crown District (sunrise to sunset)"
  },
  "epigraph": "In daylight, everyone can see you. That's when you need to be perfect.",
  "atAGlance": "Caelorn Sunblade commands the Eternal Guard's day watch—protecting the Crown during formal audiences, public ceremonies, and the business of governance. Day watch is more visible, more ceremonial, and more politically complex. He handles crowds that night watch never sees.\n\n---",
  "commonKnowledge": "- Has commanded day watch for 150 years\n- Coordinates security for all Crown ceremonies\n- Can identify every noble by sight\n- Never allows weapons past the gates (with very rare exceptions)\n\n---\n\nPolished, professional, politically aware. Understands that day watch is performance as much as protection—the guards must look impressive while being deadly. Balances ceremony with security. More diplomatic than his night counterpart; he deals with nobles constantly.\n\n---",
  "secretKnowledge": "A noble once tried to bribe him for information about the Emperor's schedule. He refused—then didn't report it. The noble was from House Vaelindis, and exposing them would have created political chaos. He's not sure if he did the right thing. It haunts him.\n\n---",
  "seeAlso": [],
  "rawContent": "# Caelorn Sunblade\n\n**Day Warden** | Eternal Guard\n\n> *\"In daylight, everyone can see you. That's when you need to be perfect.\"*\n\n| | |\n|---|---|\n| **Age** | 320 years |\n| **Race** | High Elf, Male |\n| **Role** | Day Watch Commander |\n| **Reports To** | Captain Thandril Ironsong |\n| **Location** | Crown District (sunrise to sunset) |\n\n---\n\n## Overview\n\nCaelorn Sunblade commands the Eternal Guard's day watch—protecting the Crown during formal audiences, public ceremonies, and the business of governance. Day watch is more visible, more ceremonial, and more politically complex. He handles crowds that night watch never sees.\n\n---\n\n## Personality & Approach\n\nPolished, professional, politically aware. Understands that day watch is performance as much as protection—the guards must look impressive while being deadly. Balances ceremony with security. More diplomatic than his night counterpart; he deals with nobles constantly.\n\n---\n\n## Key Facts\n\n- Has commanded day watch for 150 years\n- Coordinates security for all Crown ceremonies\n- Can identify every noble by sight\n- Never allows weapons past the gates (with very rare exceptions)\n\n---\n\n## Secret (DM Only)\n\nA noble once tried to bribe him for information about the Emperor's schedule. He refused—then didn't report it. The noble was from House Vaelindis, and exposing them would have created political chaos. He's not sure if he did the right thing. It haunts him.\n\n---\n\n## Connections\n\n- **Thandril Ironsong**: Commander - Reports at dawn/dusk transitions\n- **Silindra Moonshadow**: Counterpart - Night Warden, mutual respect\n- **Noble houses**: Regular contact - They pass through his gates daily\n",
  "sourcePath": "06-NPCs/Thelassian/Caelorn Sunblade.md",
  "slug": "caelorn-sunblade",
  "category": "npcs"
}