{
  "title": "Caelorin Silvervow",
  "metadata": {
    "Age": "420 years",
    "Race": "High Elf, Male",
    "Role": "Manager of Foreign Agreements",
    "Reports To": "Starwarden Isileth",
    "Location": "Twilight Tower, Treaty Archives"
  },
  "epigraph": "A treaty is not paper. It is a promise. I hold all promises.",
  "atAGlance": "Caelorin Silvervow maintains every treaty, trade agreement, and diplomatic accord the Empire has ever signed. He knows the exact obligations, expiration dates, and loopholes in every foreign relationship. When disputes arise, he's consulted first—often, his word is final.\n\n---",
  "commonKnowledge": "- Manages archives of 1,500 years of diplomatic agreements\n- Can recite key clauses from any active treaty\n- Advises on diplomatic precedent before negotiations\n- Has identified 12 technical violations by the Aloria (unclaimed)\n\n---\n\nMeticulous, dry, slightly pedantic. Quotes treaty clauses from memory mid-conversation. Takes obligations extremely seriously—a broken promise offends him personally. Surprisingly fierce in defending even minor agreements from violation.\n\n---",
  "secretKnowledge": "He's documented that the Empire has violated 3 treaties over the past 400 years. Minor violations, but real. He's never reported this. Admitting elven failures would be worse than the violations themselves.\n\n---",
  "seeAlso": [],
  "rawContent": "# Caelorin Silvervow\n\n**Keeper of Treaties** | Twilight Tower (Twilight Assembly)\n\n> *\"A treaty is not paper. It is a promise. I hold all promises.\"*\n\n| | |\n|---|---|\n| **Age** | 420 years |\n| **Race** | High Elf, Male |\n| **Role** | Manager of Foreign Agreements |\n| **Reports To** | Starwarden Isileth |\n| **Location** | Twilight Tower, Treaty Archives |\n\n---\n\n## Overview\n\nCaelorin Silvervow maintains every treaty, trade agreement, and diplomatic accord the Empire has ever signed. He knows the exact obligations, expiration dates, and loopholes in every foreign relationship. When disputes arise, he's consulted first—often, his word is final.\n\n---\n\n## Personality & Approach\n\nMeticulous, dry, slightly pedantic. Quotes treaty clauses from memory mid-conversation. Takes obligations extremely seriously—a broken promise offends him personally. Surprisingly fierce in defending even minor agreements from violation.\n\n---\n\n## Key Facts\n\n- Manages archives of 1,500 years of diplomatic agreements\n- Can recite key clauses from any active treaty\n- Advises on diplomatic precedent before negotiations\n- Has identified 12 technical violations by the Aloria (unclaimed)\n\n---\n\n## Secret (DM Only)\n\nHe's documented that the Empire has violated 3 treaties over the past 400 years. Minor violations, but real. He's never reported this. Admitting elven failures would be worse than the violations themselves.\n\n---\n\n## Connections\n\n- **Isileth**: Superior - Treaty matters serve diplomacy\n- **Orinvel Starwhisper**: Colleague - Negotiates what Caelorin maintains\n- **Thaelorin**: Professional - Treaties become historical record\n",
  "sourcePath": "06-NPCs/Thelassian/Caelorin Silvervow.md",
  "slug": "caelorin-silvervow",
  "category": "npcs"
}