{
  "title": "First Steward Faendril",
  "metadata": {
    "Age": "Centuries of administrative experience",
    "Race": "Elf",
    "Title": "First Steward, The Hand of the Throne",
    "Role": "Administrator, Economic Planner",
    "Pillar": "Circle of Stewards"
  },
  "atAGlance": "**Faendril** - First Steward, Leader of the Circle of Stewards\n\n- Chief administrator of the Thelassian's daily governance\n- One of the Four Pillar leaders serving Emperor Valandor\n- Manages economy, infrastructure, trade, and non-elven populations\n- The one who makes everything actually work behind the scenes\n- *Common saying: \"The Emperor dreams. Faendril builds.\"*\n\n| | |\n|---|---|\n| **Age** | Centuries of administrative experience |\n| **Race** | Elf |\n| **Title** | First Steward, The Hand of the Throne |\n| **Role** | Administrator, Economic Planner |\n| **Pillar** | Circle of Stewards |\n\n---",
  "commonKnowledge": "### Appearance & Manner\nPractical elegance rather than mystical bearing. Carries scrolls, ledgers, or administrative implements. Eyes that assess value and efficiency. Moves with purposeâ€”no motion wasted. Speaks in specifics: numbers, timelines, resources.\n\n### Personality (Public)\nThe efficient hand that keeps the Empire running. Thinks in centuries of economic planning. Balances immediate needs with long-term vision. More interested in what works than what's traditional. The Pillar most likely to deal with practical realities.\n\n### Role & Responsibilities\n- Day-to-day governance and administration\n- Trade, infrastructure, and economic planning\n- Regional administrators and Enclave coordination\n- The **Office of the Lesser Peoples** (non-elven populations)\n- Century-scale economic planning\n- Member of the Circle of Four\n\n### The Office of the Lesser Peoples\nFaendril manages all non-elven citizens:\n- Implements second-class citizenship policies\n- Handles separate laws and courts for non-elves\n- Economic integration of subject races\n- Has more contact with non-elves than any other Pillar leader\n\n### The Veraheim Problem\nEconomic reality creates tension:\n- The tunnel is vital for east-west trade\n- Must deal with Veraheim despite not recognizing it\n- Trade flows through regardless of politics\n- Practical necessity vs. political embarrassment\n\n---",
  "secretKnowledge": "### True Nature\n*[Partially undefined for DM customization]*\n\n**The Key Question:** Does he believe in elven supremacy, or just maintain the system?\n\n**Archetype Options:**\n\n**Option 1 - The Efficient Machine:** Sees people as numbers, runs Empire like clockwork. Racism is just policy to implement.\n\n**Option 2 - The Pragmatic Moderate:** Personally not racist, but maintains system for stability. Understands Empire depends on non-elven labor.\n\n**Option 3 - The Secret Reformer:** Wants change but works within system slowly. Sees the cracks, quietly prepares alternatives.\n\n**Option 4 - The True Believer:** Genuinely believes \"lesser peoples\" need elven guidance. Kind in his condescension.\n\n### Non-Elven Contact\nHe sees what other Pillars don't:\n- Non-elven populations that power the economy\n- Talent wasted under restrictive policies\n- Growing unrest beneath the surface\n- Does this change his views? Or confirm them?\n\n### The Economic Truth\nEmpire depends on non-elves more than most admit:\n- Labor, trade, resources\n- The tunnel through Veraheim is essential\n- Drow trade embargo costs the Empire significantly\n- Faendril knows the numbers others ignore\n\n### What He Wants\n- Efficient, functioning Empire\n- Economic stability across centuries\n- Clear policies he can actually implement\n- Perhaps: gradual reform that doesn't destabilize\n\n### What He Fears\n- Economic collapse from rigid policies\n- Being blamed when reality contradicts ideology\n- The system breaking faster than he can fix it\n- Veraheim proving an alternative works\n\n### Story Hooks\n\n| Hook | Description |\n|------|-------------|\n| **The Trade Deal** | Faendril needs to negotiate with Veraheim. Officially impossible. Practically necessary. |\n| **The Numbers** | He shares economic realities with PCs. What they do with the information is up to them. |\n| **The Office** | PCs encounter the Office of Lesser Peoples. Faendril's policies in action. |\n| **The Reform** | He hints at changes he'd makeâ€”if he could. Is he recruiting allies? |\n| **The Crisis** | Economic disaster forces him to choose between ideology and survival. |\n\n---",
  "seeAlso": [],
  "rawContent": "# First Steward Faendril\n\n## At a Glance\n> **What anyone in the Thelassian would know**\n\n**Faendril** - First Steward, Leader of the Circle of Stewards\n\n- Chief administrator of the Thelassian's daily governance\n- One of the Four Pillar leaders serving Emperor Valandor\n- Manages economy, infrastructure, trade, and non-elven populations\n- The one who makes everything actually work behind the scenes\n- *Common saying: \"The Emperor dreams. Faendril builds.\"*\n\n| | |\n|---|---|\n| **Age** | Centuries of administrative experience |\n| **Race** | Elf |\n| **Title** | First Steward, The Hand of the Throne |\n| **Role** | Administrator, Economic Planner |\n| **Pillar** | Circle of Stewards |\n\n---\n\n## Common Knowledge\n> **What elves, merchants, or diplomats would know**\n\n### Appearance & Manner\nPractical elegance rather than mystical bearing. Carries scrolls, ledgers, or administrative implements. Eyes that assess value and efficiency. Moves with purposeâ€”no motion wasted. Speaks in specifics: numbers, timelines, resources.\n\n### Personality (Public)\nThe efficient hand that keeps the Empire running. Thinks in centuries of economic planning. Balances immediate needs with long-term vision. More interested in what works than what's traditional. The Pillar most likely to deal with practical realities.\n\n### Role & Responsibilities\n- Day-to-day governance and administration\n- Trade, infrastructure, and economic planning\n- Regional administrators and Enclave coordination\n- The **Office of the Lesser Peoples** (non-elven populations)\n- Century-scale economic planning\n- Member of the Circle of Four\n\n### The Office of the Lesser Peoples\nFaendril manages all non-elven citizens:\n- Implements second-class citizenship policies\n- Handles separate laws and courts for non-elves\n- Economic integration of subject races\n- Has more contact with non-elves than any other Pillar leader\n\n### The Veraheim Problem\nEconomic reality creates tension:\n- The tunnel is vital for east-west trade\n- Must deal with Veraheim despite not recognizing it\n- Trade flows through regardless of politics\n- Practical necessity vs. political embarrassment\n\n---\n\n## Secret Knowledge\n> **DM-only information**\n\n### True Nature\n*[Partially undefined for DM customization]*\n\n**The Key Question:** Does he believe in elven supremacy, or just maintain the system?\n\n**Archetype Options:**\n\n**Option 1 - The Efficient Machine:** Sees people as numbers, runs Empire like clockwork. Racism is just policy to implement.\n\n**Option 2 - The Pragmatic Moderate:** Personally not racist, but maintains system for stability. Understands Empire depends on non-elven labor.\n\n**Option 3 - The Secret Reformer:** Wants change but works within system slowly. Sees the cracks, quietly prepares alternatives.\n\n**Option 4 - The True Believer:** Genuinely believes \"lesser peoples\" need elven guidance. Kind in his condescension.\n\n### Non-Elven Contact\nHe sees what other Pillars don't:\n- Non-elven populations that power the economy\n- Talent wasted under restrictive policies\n- Growing unrest beneath the surface\n- Does this change his views? Or confirm them?\n\n### The Economic Truth\nEmpire depends on non-elves more than most admit:\n- Labor, trade, resources\n- The tunnel through Veraheim is essential\n- Drow trade embargo costs the Empire significantly\n- Faendril knows the numbers others ignore\n\n### What He Wants\n- Efficient, functioning Empire\n- Economic stability across centuries\n- Clear policies he can actually implement\n- Perhaps: gradual reform that doesn't destabilize\n\n### What He Fears\n- Economic collapse from rigid policies\n- Being blamed when reality contradicts ideology\n- The system breaking faster than he can fix it\n- Veraheim proving an alternative works\n\n### Story Hooks\n\n| Hook | Description |\n|------|-------------|\n| **The Trade Deal** | Faendril needs to negotiate with Veraheim. Officially impossible. Practically necessary. |\n| **The Numbers** | He shares economic realities with PCs. What they do with the information is up to them. |\n| **The Office** | PCs encounter the Office of Lesser Peoples. Faendril's policies in action. |\n| **The Reform** | He hints at changes he'd makeâ€”if he could. Is he recruiting allies? |\n| **The Crisis** | Economic disaster forces him to choose between ideology and survival. |\n\n---\n\n## Connections Map\n\n```mermaid\nflowchart TD\n    subgraph Admin[\"ðŸ“Š Circle of Stewards\"]\n        Faendril[\"<b>First Steward Faendril</b><br/>Administration & Economy\"]\n    end\n    \n    Faendril -->|\"serves\"| Valandor[\"Emperor Valandor\"]\n    Faendril -->|\"manages\"| NonElves[\"Non-Elven<br/>Populations\"]\n    Faendril -->|\"handles\"| Trade[\"Trade & Economy\"]\n    \n    Faendril -.->|\"must deal with\"| Veraheim[\"Veraheim<br/>(economic necessity)\"]\n    \n    subgraph OtherPillars[\"Other Pillars\"]\n        Caerwyn[\"Caerwyn<br/>Military\"]\n        Thaelorin[\"Thaelorin<br/>Law\"]\n        Isileth[\"Isileth<br/>Magic\"]\n    end\n    \n    Faendril --- OtherPillars\n    \n    style Faendril fill:#d9ead3,color:#000\n    style NonElves fill:#fce5cd,color:#000\n    style Veraheim fill:#d9d2e9,color:#000\n```\n\n---\n\n## Notes\n- The practical face of elven governance\n- Most likely Pillar to see reality of non-elven populations\n- Natural contact for economic/trade plots\n- His characterization affects how oppressive the Empire feels\n- Could be ally, obstacle, or window into system's contradictions\n",
  "sourcePath": "06-NPCs/Thelassian/Faendril.md",
  "slug": "first-steward-faendril",
  "category": "npcs"
}