{
  "title": "First Remembrancer Thaelorin",
  "metadata": {
    "Age": "Ancient (likely 1,000+ years)",
    "Race": "Elf",
    "Title": "First Remembrancer, The Keeper of Ages",
    "Role": "Lore-master, Chief Justice",
    "Pillar": "Council of Memory"
  },
  "atAGlance": "**Thaelorin** - First Remembrancer, Leader of the Council of Memory\n\n- Keeper of all elven history, law, and records\n- One of the Four Pillar leaders serving Emperor Valandor\n- Chief justice who rules based on precedent and the 100-Year Review\n- Living repository of everything the Empire has ever known\n- *Common saying: \"Thaelorin forgets nothing. Neither does elven law.\"*\n\n| | |\n|---|---|\n| **Age** | Ancient (likely 1,000+ years) |\n| **Race** | Elf |\n| **Title** | First Remembrancer, The Keeper of Ages |\n| **Role** | Lore-master, Chief Justice |\n| **Pillar** | Council of Memory |\n\n---",
  "commonKnowledge": "### Appearance & Manner\nAncient beyond measure, even by elven standards. Carries himself with scholarly dignity. Eyes that seem to look into the past. Speaks with measured precision, often quoting historical precedent. Surrounded by books, scrolls, or attendants carrying records.\n\n### Personality (Public)\nThe embodiment of elven memory and law. Every ruling based on precedent. Every decision informed by history. Patient as only someone who has lived a thousand years can be. Fair within the framework of lawâ€”but the law itself may be unjust.\n\n### Role & Responsibilities\n- Final rulings on all legal matters\n- Maintains complete history of the Empire\n- Oversees the 100-Year Review system\n- Advises Emperor on historical precedent\n- Keeper of all treaties, laws, and records\n- Member of the Circle of Four\n\n### The 100-Year Review\nThe elven justice system Thaelorin administers:\n- Individuals judged on their last 100 years of achievement\n- Birth means nothingâ€”deeds over a century matter\n- Creates meritocracy... for those who live 100+ years\n- Non-elves almost always fail (shorter lifespans)\n\n### The Living Library\nThaelorin has access to (or memory of):\n- Every law ever enacted\n- Every treaty ever signed\n- Every precedent ever set\n- Complete history of elven civilization\n\n---",
  "secretKnowledge": "### True Nature\n*[Partially undefined for DM customization]*\n\n**The Key Question:** Does history teach him wisdom, or just justify the status quo?\n\n**Archetype Options:**\n\n**Option 1 - The Living Library:** Knows everything, quotes precedent constantly. Struggles with situations that have no precedent. The system IS justice.\n\n**Option 2 - The Just Judge:** Fair but inflexible. Law above emotion. Sees himself as servant of system, not its master.\n\n**Option 3 - The Wise Scholar:** Understands that history shows patternsâ€”including patterns of failure. Sees cracks others miss.\n\n**Option 4 - The Conservative:** Uses history to prevent all change. The past was better. Innovation is danger.\n\n### The Dragon War Records\nWhat does he know about 400 years ago?\n- Does he know drow (not elves) tortured dragons?\n- Are there records he keeps hidden?\n- Has he connected dots others haven't?\n- His archives could expose the truthâ€”or bury it\n\n### The Thaelen Ruling\nWhen Thaelen defected 80 years ago:\n- How did Thaelorin rule on his case?\n- Is Thaelen legally a traitor? Exile? Something else?\n- What was Thaelen's 100-Year Review before defection?\n- Does Thaelorin see tragedy where others see betrayal?\n\n### The Drow Policy\nThe kill-on-sight policy has legal basis:\n- Did Thaelorin create it? Inherit it? Just enforce it?\n- What historical justification exists in the records?\n- Does he know it's based on a lie?\n- What would he do if he learned the truth?\n\n### What He Wants\n- Preservation of knowledge and law\n- Justice within the system (as he defines it)\n- Historical accuracy (does this conflict with policy?)\n- Perhaps: understanding of patterns he's observed\n\n### What He Fears\n- Loss of records (destruction of memory)\n- Situations without precedent\n- Being wrong about something fundamental\n- The past containing truths that undermine the present\n\n### Story Hooks\n\n| Hook | Description |\n|------|-------------|\n| **The Precedent** | PCs need a legal ruling. Thaelorin's decision could change everything. |\n| **The Archive** | Something is hidden in his records. Getting access is the challenge. |\n| **The Truth** | He discovers (or reveals) what really happened 400 years ago. |\n| **The Review** | A PC or NPC faces the 100-Year Review. Thaelorin presides. |\n| **The Exception** | He must rule on something unprecedented. How does law handle the new? |\n\n---",
  "seeAlso": [],
  "rawContent": "# First Remembrancer Thaelorin\n\n## At a Glance\n> **What anyone in the Thelassian would know**\n\n**Thaelorin** - First Remembrancer, Leader of the Council of Memory\n\n- Keeper of all elven history, law, and records\n- One of the Four Pillar leaders serving Emperor Valandor\n- Chief justice who rules based on precedent and the 100-Year Review\n- Living repository of everything the Empire has ever known\n- *Common saying: \"Thaelorin forgets nothing. Neither does elven law.\"*\n\n| | |\n|---|---|\n| **Age** | Ancient (likely 1,000+ years) |\n| **Race** | Elf |\n| **Title** | First Remembrancer, The Keeper of Ages |\n| **Role** | Lore-master, Chief Justice |\n| **Pillar** | Council of Memory |\n\n---\n\n## Common Knowledge\n> **What elves, scholars, or those seeking justice would know**\n\n### Appearance & Manner\nAncient beyond measure, even by elven standards. Carries himself with scholarly dignity. Eyes that seem to look into the past. Speaks with measured precision, often quoting historical precedent. Surrounded by books, scrolls, or attendants carrying records.\n\n### Personality (Public)\nThe embodiment of elven memory and law. Every ruling based on precedent. Every decision informed by history. Patient as only someone who has lived a thousand years can be. Fair within the framework of lawâ€”but the law itself may be unjust.\n\n### Role & Responsibilities\n- Final rulings on all legal matters\n- Maintains complete history of the Empire\n- Oversees the 100-Year Review system\n- Advises Emperor on historical precedent\n- Keeper of all treaties, laws, and records\n- Member of the Circle of Four\n\n### The 100-Year Review\nThe elven justice system Thaelorin administers:\n- Individuals judged on their last 100 years of achievement\n- Birth means nothingâ€”deeds over a century matter\n- Creates meritocracy... for those who live 100+ years\n- Non-elves almost always fail (shorter lifespans)\n\n### The Living Library\nThaelorin has access to (or memory of):\n- Every law ever enacted\n- Every treaty ever signed\n- Every precedent ever set\n- Complete history of elven civilization\n\n---\n\n## Secret Knowledge\n> **DM-only information**\n\n### True Nature\n*[Partially undefined for DM customization]*\n\n**The Key Question:** Does history teach him wisdom, or just justify the status quo?\n\n**Archetype Options:**\n\n**Option 1 - The Living Library:** Knows everything, quotes precedent constantly. Struggles with situations that have no precedent. The system IS justice.\n\n**Option 2 - The Just Judge:** Fair but inflexible. Law above emotion. Sees himself as servant of system, not its master.\n\n**Option 3 - The Wise Scholar:** Understands that history shows patternsâ€”including patterns of failure. Sees cracks others miss.\n\n**Option 4 - The Conservative:** Uses history to prevent all change. The past was better. Innovation is danger.\n\n### The Dragon War Records\nWhat does he know about 400 years ago?\n- Does he know drow (not elves) tortured dragons?\n- Are there records he keeps hidden?\n- Has he connected dots others haven't?\n- His archives could expose the truthâ€”or bury it\n\n### The Thaelen Ruling\nWhen Thaelen defected 80 years ago:\n- How did Thaelorin rule on his case?\n- Is Thaelen legally a traitor? Exile? Something else?\n- What was Thaelen's 100-Year Review before defection?\n- Does Thaelorin see tragedy where others see betrayal?\n\n### The Drow Policy\nThe kill-on-sight policy has legal basis:\n- Did Thaelorin create it? Inherit it? Just enforce it?\n- What historical justification exists in the records?\n- Does he know it's based on a lie?\n- What would he do if he learned the truth?\n\n### What He Wants\n- Preservation of knowledge and law\n- Justice within the system (as he defines it)\n- Historical accuracy (does this conflict with policy?)\n- Perhaps: understanding of patterns he's observed\n\n### What He Fears\n- Loss of records (destruction of memory)\n- Situations without precedent\n- Being wrong about something fundamental\n- The past containing truths that undermine the present\n\n### Story Hooks\n\n| Hook | Description |\n|------|-------------|\n| **The Precedent** | PCs need a legal ruling. Thaelorin's decision could change everything. |\n| **The Archive** | Something is hidden in his records. Getting access is the challenge. |\n| **The Truth** | He discovers (or reveals) what really happened 400 years ago. |\n| **The Review** | A PC or NPC faces the 100-Year Review. Thaelorin presides. |\n| **The Exception** | He must rule on something unprecedented. How does law handle the new? |\n\n---\n\n## Connections Map\n\n```mermaid\nflowchart TD\n    subgraph Law[\"ðŸ“œ Council of Memory\"]\n        Thaelorin[\"<b>First Remembrancer Thaelorin</b><br/>Law, History, Justice\"]\n    end\n    \n    Thaelorin -->|\"serves\"| Valandor[\"Emperor Valandor\"]\n    Thaelorin -->|\"maintains\"| Records[\"All Elven Records<br/>Laws, History, Treaties\"]\n    Thaelorin -->|\"administers\"| Review[\"100-Year Review<br/>Justice System\"]\n    \n    Thaelorin -.->|\"ruled on\"| Thaelen[\"Thaelen Case<br/>(80 years ago)\"]\n    Thaelorin -.->|\"maintains\"| DrowPolicy[\"Drow Kill-on-Sight<br/>Policy\"]\n    \n    subgraph OtherPillars[\"Other Pillars\"]\n        Caerwyn[\"Caerwyn<br/>Military\"]\n        Isileth[\"Isileth<br/>Magic\"]\n        Faendril[\"Faendril<br/>Admin\"]\n    end\n    \n    Thaelorin --- OtherPillars\n    \n    style Thaelorin fill:#fce5cd,color:#000\n    style Records fill:#d9ead3,color:#000\n    style DrowPolicy fill:#f4cccc,color:#000\n```\n\n---\n\n## Notes\n- The keeper of truthâ€”but truth can be selective\n- His archives are campaign-changing resource\n- Natural contact for legal/historical plots\n- The 100-Year Review affects how non-elves experience the Empire\n- Could reveal or conceal Dragon War truth\n",
  "sourcePath": "06-NPCs/Thelassian/Thaelorin.md",
  "slug": "first-remembrancer-thaelorin",
  "category": "npcs"
}