{
  "title": "Galdorin Sorrowbane",
  "metadata": {
    "Age": "520 years",
    "Race": "High Elf, Male",
    "Role": "Maintains Dragon Knight Memorial",
    "Reports To": "Knight Commander Seraphel Dawnblade",
    "Location": "Iron Tower, Hall of Fallen Knights"
  },
  "epigraph": "Forty-seven fell. One turned. I remember them all.",
  "atAGlance": "Galdorin Sorrowbane maintains the Hall of Fallen Knights—the memorial to the 47 Dragon Knights who died in the Dragon War. He polishes armor, tends the empty stands, and preserves the memory of warriors who fell 400 years ago. It is a lonely duty, and he has performed it for 300 years.\n\n---",
  "commonKnowledge": "- Knows the name, history, and dragon of every fallen Knight\n- Has never missed a day of duty in 300 years\n- Conducts private remembrance ceremonies on war anniversaries\n- The only person allowed to touch Thaelen's armor (to keep it polished)\n\n---\n\nSomber, reverent, utterly devoted to the dead. Speaks of the fallen as if he knew them personally (he didn't—they died before his time). Treats the memorial as sacred ground. Surprisingly not morbid—he sees his work as honoring sacrifice, not dwelling on loss.\n\n---",
  "secretKnowledge": "He talks to the armor. Not madness—ritual. He tells the fallen what's happening in the Empire, what their sacrifice protected. And sometimes, late at night, he tells Thaelen's armor that he understands. Forty-seven died. Thaelen lived. That's not betrayal. That's survival.\n\n---",
  "seeAlso": [],
  "rawContent": "# Galdorin Sorrowbane\n\n**Keeper of the Memorial** | Iron Tower (Specialized Position)\n\n> *\"Forty-seven fell. One turned. I remember them all.\"*\n\n| | |\n|---|---|\n| **Age** | 520 years |\n| **Race** | High Elf, Male |\n| **Role** | Maintains Dragon Knight Memorial |\n| **Reports To** | Knight Commander Seraphel Dawnblade |\n| **Location** | Iron Tower, Hall of Fallen Knights |\n\n---\n\n## Overview\n\nGaldorin Sorrowbane maintains the Hall of Fallen Knights—the memorial to the 47 Dragon Knights who died in the Dragon War. He polishes armor, tends the empty stands, and preserves the memory of warriors who fell 400 years ago. It is a lonely duty, and he has performed it for 300 years.\n\n---\n\n## Personality & Approach\n\nSomber, reverent, utterly devoted to the dead. Speaks of the fallen as if he knew them personally (he didn't—they died before his time). Treats the memorial as sacred ground. Surprisingly not morbid—he sees his work as honoring sacrifice, not dwelling on loss.\n\n---\n\n## Key Facts\n\n- Knows the name, history, and dragon of every fallen Knight\n- Has never missed a day of duty in 300 years\n- Conducts private remembrance ceremonies on war anniversaries\n- The only person allowed to touch Thaelen's armor (to keep it polished)\n\n---\n\n## Secret (DM Only)\n\nHe talks to the armor. Not madness—ritual. He tells the fallen what's happening in the Empire, what their sacrifice protected. And sometimes, late at night, he tells Thaelen's armor that he understands. Forty-seven died. Thaelen lived. That's not betrayal. That's survival.\n\n---\n\n## Connections\n\n- **Seraphel Dawnblade**: Superior - Both serve the memory of Dragon Knights\n- **Caerwyn**: Professional - High Warden visits annually\n- **The Fallen**: Spiritual - His true companions\n",
  "sourcePath": "06-NPCs/Thelassian/Galdorin Sorrowbane.md",
  "slug": "galdorin-sorrowbane",
  "category": "npcs"
}