{
  "title": "Graza Bloodtide",
  "metadata": {
    "Age": "34",
    "Race": "Half-Orc",
    "Role": "Pirate Queen",
    "Fleet": "25 warships",
    "Base": "Freehold Harbor"
  },
  "atAGlance": "**Graza Bloodtide** - Pirate Queen of the Broken Isles\n\n- Half-orc woman who has ruled the pirate confederation for three years\n- Commands the largest official fleet (25 warships) from Freehold Harbor\n- Known for charisma AND brutal willingness to make examples\n- Rose to power through alliances and political skill\n- *Common saying: \"The Queen smiles before she strikes. The Storm doesn't bother.\"*\n\n| | |\n|---|---|\n| **Age** | 34 |\n| **Race** | Half-Orc |\n| **Role** | Pirate Queen |\n| **Fleet** | 25 warships |\n| **Base** | Freehold Harbor |\n\n---",
  "commonKnowledge": "### Appearance & Manner\nHalf-orc woman of commanding presence. Carries herself with the confidence of someone who earned her position through blood and cunning. Dresses in quality but practical clothing‚Äîwealth displayed without excess. Green-tinged skin, prominent but not grotesque tusks. Charismatic smile that can turn cold in an instant.\n\n### Personality\nPeople genuinely want to follow her‚Äîshe has that quality. Remembers names, remembers debts, makes people feel valued. But cross her and the warmth vanishes. She's executed captains publicly for betrayal, and the executions were memorable. The balance between inspiration and intimidation is her art form.\n\n### Public Role\n- Presides over the Moot (quarterly captain meetings)\n- Settles disputes between captains\n- Maintains Freehold Harbor operations\n- Collects tribute from all captains\n- Commands the Queen's Guard (~200 warriors)\n\n### Known Relationships\n- **The Storm (Vaelith Draegor):** Everyone knows she rules within his tolerance. She sends him tribute he never asked for.\n- **Gorrath Bloodstone:** Fellow half-blood, strong ally. Orc clans support her.\n- **The Admiral (Kozrek):** Useful but exhausting. Pays tribute properly.\n- **The Rapier (Rennick):** Unpredictable, respects his skill.\n\n### The Coronation Story\nWhen Graza took the throne, Vaelith Draegor attended. Stood in the back. Said nothing. When she looked at him, he gave a small nod. Then left. That nod is why she's still Queen.\n\n---",
  "secretKnowledge": "### True Nature\nGraza is a political survivor walking a knife's edge. She's smart enough to know her power exists within limits The Storm sets by existing. Every decision she makes is filtered through one question: \"Will this give The Storm a reason to notice me?\" She rules through skill, but she rules in his shadow.\n\n### The Fear She Lives With\n- The Storm could end her reign in an afternoon\n- His fleet is nearly double hers\n- He's been sailing for 300 years\n- She lies awake thinking about him\n- Not that he'll take her throne‚Äîthat she'll somehow give him a reason to act\n\n### Her Strategy with The Storm\n- Never challenge, never cross\n- Send tribute he never asked for (wise politics)\n- Consult him on major decisions affecting the Isles\n- Accept that her power exists within his tolerance\n- Hope indifference continues\n\n### What She Hasn't Revealed\n- Her past before becoming a captain (deliberately obscured)\n- How she really took the throne (the full story has dark edges)\n- That she's been approached by the Aloria about alliance against the Empire\n- Her contingency plans if The Storm turns against her\n\n### What She Wants\n- Build genuine authority independent of The Storm's tolerance\n- Strengthen the Confederation's defenses\n- Grow her personal fleet\n- Eventually: be remembered as a great Queen, not just a survivor\n\n### What She Fears\n- The Storm actively opposing her\n- Multiple legendary captains allying against her\n- Major military defeat\n- Being seen as weak\n\n### Story Hooks\n\n| Hook | Description |\n|------|-------------|\n| **Assassination Attempt** | Someone tries to kill Graza. Rival captain? External power? She needs answers without appearing weak. |\n| **The Storm Speaks** | Vaelith actually gives her an order. What could possibly have made him care? |\n| **Challenge for Throne** | A powerful captain formally challenges her. How does she respond? |\n| **Kingdom Alliance** | The Aloria secretly offers alliance against the Empire. Massive opportunity and massive risk. |\n| **The Queen's Secret** | Something in her past could destroy her if revealed. Someone knows. |\n\n---",
  "seeAlso": [],
  "rawContent": "# Graza Bloodtide\n\n## At a Glance\n> **What anyone in the Broken Isles would know**\n\n**Graza Bloodtide** - Pirate Queen of the Broken Isles\n\n- Half-orc woman who has ruled the pirate confederation for three years\n- Commands the largest official fleet (25 warships) from Freehold Harbor\n- Known for charisma AND brutal willingness to make examples\n- Rose to power through alliances and political skill\n- *Common saying: \"The Queen smiles before she strikes. The Storm doesn't bother.\"*\n\n| | |\n|---|---|\n| **Age** | 34 |\n| **Race** | Half-Orc |\n| **Role** | Pirate Queen |\n| **Fleet** | 25 warships |\n| **Base** | Freehold Harbor |\n\n---\n\n## Common Knowledge\n> **What pirates, merchants, or visitors to the Isles would know**\n\n### Appearance & Manner\nHalf-orc woman of commanding presence. Carries herself with the confidence of someone who earned her position through blood and cunning. Dresses in quality but practical clothing‚Äîwealth displayed without excess. Green-tinged skin, prominent but not grotesque tusks. Charismatic smile that can turn cold in an instant.\n\n### Personality\nPeople genuinely want to follow her‚Äîshe has that quality. Remembers names, remembers debts, makes people feel valued. But cross her and the warmth vanishes. She's executed captains publicly for betrayal, and the executions were memorable. The balance between inspiration and intimidation is her art form.\n\n### Public Role\n- Presides over the Moot (quarterly captain meetings)\n- Settles disputes between captains\n- Maintains Freehold Harbor operations\n- Collects tribute from all captains\n- Commands the Queen's Guard (~200 warriors)\n\n### Known Relationships\n- **The Storm (Vaelith Draegor):** Everyone knows she rules within his tolerance. She sends him tribute he never asked for.\n- **Gorrath Bloodstone:** Fellow half-blood, strong ally. Orc clans support her.\n- **The Admiral (Kozrek):** Useful but exhausting. Pays tribute properly.\n- **The Rapier (Rennick):** Unpredictable, respects his skill.\n\n### The Coronation Story\nWhen Graza took the throne, Vaelith Draegor attended. Stood in the back. Said nothing. When she looked at him, he gave a small nod. Then left. That nod is why she's still Queen.\n\n---\n\n## Secret Knowledge\n> **DM-only information**\n\n### True Nature\nGraza is a political survivor walking a knife's edge. She's smart enough to know her power exists within limits The Storm sets by existing. Every decision she makes is filtered through one question: \"Will this give The Storm a reason to notice me?\" She rules through skill, but she rules in his shadow.\n\n### The Fear She Lives With\n- The Storm could end her reign in an afternoon\n- His fleet is nearly double hers\n- He's been sailing for 300 years\n- She lies awake thinking about him\n- Not that he'll take her throne‚Äîthat she'll somehow give him a reason to act\n\n### Her Strategy with The Storm\n- Never challenge, never cross\n- Send tribute he never asked for (wise politics)\n- Consult him on major decisions affecting the Isles\n- Accept that her power exists within his tolerance\n- Hope indifference continues\n\n### What She Hasn't Revealed\n- Her past before becoming a captain (deliberately obscured)\n- How she really took the throne (the full story has dark edges)\n- That she's been approached by the Aloria about alliance against the Empire\n- Her contingency plans if The Storm turns against her\n\n### What She Wants\n- Build genuine authority independent of The Storm's tolerance\n- Strengthen the Confederation's defenses\n- Grow her personal fleet\n- Eventually: be remembered as a great Queen, not just a survivor\n\n### What She Fears\n- The Storm actively opposing her\n- Multiple legendary captains allying against her\n- Major military defeat\n- Being seen as weak\n\n### Story Hooks\n\n| Hook | Description |\n|------|-------------|\n| **Assassination Attempt** | Someone tries to kill Graza. Rival captain? External power? She needs answers without appearing weak. |\n| **The Storm Speaks** | Vaelith actually gives her an order. What could possibly have made him care? |\n| **Challenge for Throne** | A powerful captain formally challenges her. How does she respond? |\n| **Kingdom Alliance** | The Aloria secretly offers alliance against the Empire. Massive opportunity and massive risk. |\n| **The Queen's Secret** | Something in her past could destroy her if revealed. Someone knows. |\n\n---\n\n## Connections Map\n\n```mermaid\nflowchart TD\n    subgraph Freehold[\"üè¥‚Äç‚ò†Ô∏è Freehold Harbor\"]\n        Graza[\"<b>Graza Bloodtide</b><br/>Pirate Queen<br/>25 ships\"]\n    end\n    \n    Graza -->|\"rules within shadow of\"| Storm[\"Vaelith Draegor<br/>üåä The Storm<br/>40+ ships\"]\n    Graza -->|\"ally\"| Gorrath[\"Gorrath Bloodstone<br/>Orc Warchief\"]\n    Graza -->|\"manages\"| Kozrek[\"Kozrek<br/>The Admiral\"]\n    Graza -->|\"watches\"| Rennick[\"Rennick Vance<br/>The Rapier\"]\n    \n    Graza -->|\"collects tribute\"| Captains[\"All Captains\"]\n    Graza -->|\"sends tribute\"| Storm\n    \n    Storm -.->|\"tolerates\"| Graza\n    \n    style Graza fill:#d9d2e9,color:#000\n    style Storm fill:#d5a6bd,color:#000\n```\n\n---\n\n## Notes\n- Rules through charisma AND fear‚Äîthe balance is her skill\n- The Storm relationship is central to her character\n- Potential patron or employer for pirate campaigns\n- Her past is deliberately vague for DM customization\n- Political survivor, not action hero (though she can fight)\n",
  "sourcePath": "06-NPCs/Broken Isles/Graza Bloodtide.md",
  "slug": "graza-bloodtide",
  "category": "npcs"
}