{
  "title": "King Aldric Greymont",
  "metadata": {
    "Age": "52",
    "Seat": "Thornreich",
    "Family": "House Greymont",
    "Reign": "18 years",
    "Threat Level": "High (he's the King)"
  },
  "atAGlance": "**King Aldric Greymont** - King of the Aloria, \"The Diplomat King\"\n\n- Has ruled for 18 years from Thornreich, the Golden Castle\n- Known for political cunning rather than martial prowess‚Äîmore negotiator than warrior\n- Keeps the fractious Lords from tearing each other apart through careful manipulation\n- Controls the richest gold mines in the Kingdom, giving him economic leverage over everyone\n- *Common saying: \"The King's gold speaks louder than any Lord's sword.\"*\n\n| | |\n|---|---|\n| **Age** | 52 |\n| **Seat** | Thornreich |\n| **Family** | House Greymont |\n| **Reign** | 18 years |\n| **Threat Level** | High (he's the King) |\n\n---",
  "commonKnowledge": "### Appearance & Manner\nTall but not imposing, lean build going soft with age. Grey-streaked brown hair kept short and neat. Tired grey eyes that miss nothing. Well-groomed beard, silver at the edges. Dresses richly but practically‚Äîa king who works. Speaks carefully, weighs every word, rarely shows emotion in public.\n\n### Personality\nPatient, calculating, never acts in anger. Genuinely values stability over glory. Has a dry wit he rarely shows publicly. Treats his Lords like chess pieces‚Äîrespects their uses, doesn't trust their motives. Exhausted by the constant management of noble egos but hides it well.\n\n### Family\n- **Wife:** Queen Margarethe (n√©e Ravenscar, 49) - Political partnership and genuine affection. Runs her own spy network.\n- **Heir:** Crown Prince Roderick (28) - Martial, aggressive, impatient. Father and son clash constantly over policy.\n- **Daughters:** Eleanora (25, married to K√∂nigsford heir), Catarina (22, scholar, unmarried), Isabelle (19, newly on marriage market)\n- **Second Son:** Prince Aldwin (20) - The spare, intelligent but bitter about his uncertain role.\n\n### The Royal Court\nCommands 10,000 professional soldiers (Royal Army). Controls gold mines providing ~40% of crown income, plus 20% tax from all Lords. Maintains careful balance‚Äîno Lord too strong, no alliance too stable. Key supporters are Ravenscar (Queen's family) and K√∂nigsford (proximity).\n\n### Current Situation\nManaging the usual chaos: Ashfeld's Veraheim obsession, Wolfstein's border aggression, Blackthorne's scheming, Graustein's succession crisis. Growing concerned about Roderick's friendship with Lord Eisenwald and Lord Blackthorne. Trying to find suitable marriages for his remaining children without starting a war.\n\n---",
  "secretKnowledge": "### True Nature\nAldric is genuinely good at his job and genuinely tired of it. He took the throne at 34 and has spent 18 years preventing civil war through careful manipulation. He's not cruel, but he is utterly pragmatic‚Äîhe'll sacrifice individuals for stability without hesitation. He loves his family but sees them partly as political assets.\n\n### Hidden Fears\n- **Roderick:** His greatest fear. The Crown Prince is brave, aggressive, and stupid about politics. Roderick wants to attack Veraheim for glory. Aldric knows this would unite the elves and pirates against them and possibly end the Kingdom. He can't make Roderick understand.\n- **His own mortality:** He's 52 and feeling it. If he dies before Roderick matures, everything he's built could collapse.\n- **Lord Blackthorne:** Aldric knows Edmund is dangerous but can't prove anything. He suspects the murders but lacks evidence.\n\n### The Queen's Network\nMargarethe runs the Kingdom's intelligence operations. Aldric knows and approves, though he doesn't know every detail. Her spy network extends into every Lord's household. She's more ruthless than he is‚Äîshe's had people killed to protect the family. Aldric suspects but doesn't ask.\n\n### Political Manipulation\nAldric deliberately keeps the Lords divided:\n- Encourages Ravenscar-K√∂nigsford rivalry for his favor\n- Uses Ashfeld's Veraheim obsession to distract from real issues\n- Allows Belmont's debt schemes because they create useful leverage\n- Keeps Eisenwald busy with promises of future campaigns that never happen\n\n### The Succession Problem\nAldric is privately trying to delay Roderick's marriage because he fears any alliance will embolden his son. The Eisenwald and Blackthorne factions both want Roderick‚ÄîAldric is blocking both while appearing to consider all options.\n\n### What He Actually Wants\n- To live long enough for Roderick to mature (unlikely)\n- To find a wife for Roderick who will moderate him (searching)\n- To neutralize Blackthorne without starting a war (no clear path)\n- To die knowing the Kingdom will survive him (uncertain)\n\n### Story Hooks\n\n| Hook | Description |\n|------|-------------|\n| **The King's Mission** | Aldric needs something done quietly. He hires adventurers because Lords can't be trusted. |\n| **Succession Crisis** | Aldric falls ill. Roderick and various Lords begin positioning. The PCs must navigate the chaos. |\n| **The Evidence** | Proof of Blackthorne's crimes exists. Aldric wants it‚Äîbut using it could trigger civil war. |\n| **The Marriage Game** | One of the princesses' marriages becomes a flashpoint. PCs are caught in the political storm. |\n| **Father and Son** | Roderick plans something reckless. Does the party help the King stop him, or help Roderick succeed? |\n\n---",
  "seeAlso": [],
  "rawContent": "# King Aldric Greymont\n\n## At a Glance\n> **What anyone in the Kingdom would know**\n\n**King Aldric Greymont** - King of the Aloria, \"The Diplomat King\"\n\n- Has ruled for 18 years from Thornreich, the Golden Castle\n- Known for political cunning rather than martial prowess‚Äîmore negotiator than warrior\n- Keeps the fractious Lords from tearing each other apart through careful manipulation\n- Controls the richest gold mines in the Kingdom, giving him economic leverage over everyone\n- *Common saying: \"The King's gold speaks louder than any Lord's sword.\"*\n\n| | |\n|---|---|\n| **Age** | 52 |\n| **Seat** | Thornreich |\n| **Family** | House Greymont |\n| **Reign** | 18 years |\n| **Threat Level** | High (he's the King) |\n\n---\n\n## Common Knowledge\n> **What nobles, merchants, or acquaintances would know**\n\n### Appearance & Manner\nTall but not imposing, lean build going soft with age. Grey-streaked brown hair kept short and neat. Tired grey eyes that miss nothing. Well-groomed beard, silver at the edges. Dresses richly but practically‚Äîa king who works. Speaks carefully, weighs every word, rarely shows emotion in public.\n\n### Personality\nPatient, calculating, never acts in anger. Genuinely values stability over glory. Has a dry wit he rarely shows publicly. Treats his Lords like chess pieces‚Äîrespects their uses, doesn't trust their motives. Exhausted by the constant management of noble egos but hides it well.\n\n### Family\n- **Wife:** Queen Margarethe (n√©e Ravenscar, 49) - Political partnership and genuine affection. Runs her own spy network.\n- **Heir:** Crown Prince Roderick (28) - Martial, aggressive, impatient. Father and son clash constantly over policy.\n- **Daughters:** Eleanora (25, married to K√∂nigsford heir), Catarina (22, scholar, unmarried), Isabelle (19, newly on marriage market)\n- **Second Son:** Prince Aldwin (20) - The spare, intelligent but bitter about his uncertain role.\n\n### The Royal Court\nCommands 10,000 professional soldiers (Royal Army). Controls gold mines providing ~40% of crown income, plus 20% tax from all Lords. Maintains careful balance‚Äîno Lord too strong, no alliance too stable. Key supporters are Ravenscar (Queen's family) and K√∂nigsford (proximity).\n\n### Current Situation\nManaging the usual chaos: Ashfeld's Veraheim obsession, Wolfstein's border aggression, Blackthorne's scheming, Graustein's succession crisis. Growing concerned about Roderick's friendship with Lord Eisenwald and Lord Blackthorne. Trying to find suitable marriages for his remaining children without starting a war.\n\n---\n\n## Secret Knowledge\n> **DM-only information**\n\n### True Nature\nAldric is genuinely good at his job and genuinely tired of it. He took the throne at 34 and has spent 18 years preventing civil war through careful manipulation. He's not cruel, but he is utterly pragmatic‚Äîhe'll sacrifice individuals for stability without hesitation. He loves his family but sees them partly as political assets.\n\n### Hidden Fears\n- **Roderick:** His greatest fear. The Crown Prince is brave, aggressive, and stupid about politics. Roderick wants to attack Veraheim for glory. Aldric knows this would unite the elves and pirates against them and possibly end the Kingdom. He can't make Roderick understand.\n- **His own mortality:** He's 52 and feeling it. If he dies before Roderick matures, everything he's built could collapse.\n- **Lord Blackthorne:** Aldric knows Edmund is dangerous but can't prove anything. He suspects the murders but lacks evidence.\n\n### The Queen's Network\nMargarethe runs the Kingdom's intelligence operations. Aldric knows and approves, though he doesn't know every detail. Her spy network extends into every Lord's household. She's more ruthless than he is‚Äîshe's had people killed to protect the family. Aldric suspects but doesn't ask.\n\n### Political Manipulation\nAldric deliberately keeps the Lords divided:\n- Encourages Ravenscar-K√∂nigsford rivalry for his favor\n- Uses Ashfeld's Veraheim obsession to distract from real issues\n- Allows Belmont's debt schemes because they create useful leverage\n- Keeps Eisenwald busy with promises of future campaigns that never happen\n\n### The Succession Problem\nAldric is privately trying to delay Roderick's marriage because he fears any alliance will embolden his son. The Eisenwald and Blackthorne factions both want Roderick‚ÄîAldric is blocking both while appearing to consider all options.\n\n### What He Actually Wants\n- To live long enough for Roderick to mature (unlikely)\n- To find a wife for Roderick who will moderate him (searching)\n- To neutralize Blackthorne without starting a war (no clear path)\n- To die knowing the Kingdom will survive him (uncertain)\n\n### Story Hooks\n\n| Hook | Description |\n|------|-------------|\n| **The King's Mission** | Aldric needs something done quietly. He hires adventurers because Lords can't be trusted. |\n| **Succession Crisis** | Aldric falls ill. Roderick and various Lords begin positioning. The PCs must navigate the chaos. |\n| **The Evidence** | Proof of Blackthorne's crimes exists. Aldric wants it‚Äîbut using it could trigger civil war. |\n| **The Marriage Game** | One of the princesses' marriages becomes a flashpoint. PCs are caught in the political storm. |\n| **Father and Son** | Roderick plans something reckless. Does the party help the King stop him, or help Roderick succeed? |\n\n---\n\n## Connections Map\n\n```mermaid\nflowchart TD\n    subgraph Royal[\"üëë House Greymont\"]\n        Aldric[\"<b>King Aldric</b><br/>The Diplomat King\"]\n        Margarethe[\"Queen Margarethe<br/>The Steel Rose\"]\n        Roderick[\"Prince Roderick<br/>‚ö†Ô∏è The Young Lion\"]\n        Eleanora[\"Eleanora<br/>Married to K√∂nigsford\"]\n        Catarina[\"Catarina<br/>The Scholar\"]\n        Isabelle[\"Isabelle<br/>The Little Rose\"]\n        Aldwin[\"Aldwin<br/>The Spare\"]\n    end\n    \n    Aldric ---|\"partnership\"| Margarethe\n    Aldric ---|\"conflict\"| Roderick\n    \n    Aldric -->|\"trusts\"| Ravenscar[\"Lord Ravenscar\"]\n    Aldric -->|\"uses\"| Konigsford[\"Lord K√∂nigsford\"]\n    Aldric -->|\"watches\"| Blackthorne[\"Lord Blackthorne\"]\n    Aldric -->|\"tolerates\"| Ashfeld[\"Lord Ashfeld\"]\n    \n    Roderick -.->|\"cultivated by\"| Eisenwald[\"Lord Eisenwald\"]\n    Roderick -.->|\"drinking buddy\"| Blackthorne\n    \n    Margarethe -->|\"runs spies\"| Network[\"Intelligence Network\"]\n    \n    style Aldric fill:#fff2cc,color:#000\n    style Roderick fill:#f4cccc,color:#000\n    style Blackthorne fill:#d5a6bd,color:#000\n```\n\n---\n\n## Notes\n- Aldric is not an antagonist but may oppose PCs if they destabilize things\n- Can be patron, obstacle, or tragic figure depending on campaign\n- His death or incapacitation is a major campaign event trigger\n",
  "sourcePath": "06-NPCs/Aloria/King Aldric Greymont.md",
  "slug": "king-aldric-greymont",
  "category": "npcs"
}