{
  "title": "Lady Ithilwen Thelindor",
  "metadata": {
    "Age": "480 years",
    "Race": "High Elf, Female",
    "Role": "Great House Lady, Legal Dynasty Matriarch",
    "Aligned Pillar": "Silvered Tower (Council of Memory)",
    "Location": "Thelindor Estate, Inner City"
  },
  "epigraph": "Law is not what we feel. Law is what we agreed. That is its strength.",
  "atAGlance": "House Thelindor has produced judges, advocates, and legal scholars for 800 years. Lady Ithilwen is the most accomplished of them—she argued cases before the Council of Memory for 200 years before inheriting leadership. Her house shapes law through expertise, not military might.\n\n---",
  "commonKnowledge": "- Personally argued 50+ cases before the Council of Memory\n- Wrote three legal treatises still used as references\n- Her opinions influence how laws are interpreted\n- Has trained two current judges serving under Thaelorin\n\n---\n\nPrecise, logical, formidable in debate. Never argues from emotion—always precedent, always evidence. Can make devastating points without raising her voice. Respects intelligence, dismisses passion. Considers clear thinking the highest virtue.\n\n---",
  "secretKnowledge": "She knows the 100-Year Review system is unjust—the math makes it obvious. But she's spent 400 years within that system. Admitting its flaws would invalidate her life's work. So she doesn't examine it too closely.\n\n---",
  "seeAlso": [],
  "rawContent": "# Lady Ithilwen Thelindor\n\n**Head of House Thelindor** | Silver Quadrant (Legal Nobility)\n\n> *\"Law is not what we feel. Law is what we agreed. That is its strength.\"*\n\n| | |\n|---|---|\n| **Age** | 480 years |\n| **Race** | High Elf, Female |\n| **Role** | Great House Lady, Legal Dynasty Matriarch |\n| **Aligned Pillar** | Silvered Tower (Council of Memory) |\n| **Location** | Thelindor Estate, Inner City |\n\n---\n\n## Overview\n\nHouse Thelindor has produced judges, advocates, and legal scholars for 800 years. Lady Ithilwen is the most accomplished of them—she argued cases before the Council of Memory for 200 years before inheriting leadership. Her house shapes law through expertise, not military might.\n\n---\n\n## Personality & Approach\n\nPrecise, logical, formidable in debate. Never argues from emotion—always precedent, always evidence. Can make devastating points without raising her voice. Respects intelligence, dismisses passion. Considers clear thinking the highest virtue.\n\n---\n\n## Key Facts\n\n- Personally argued 50+ cases before the Council of Memory\n- Wrote three legal treatises still used as references\n- Her opinions influence how laws are interpreted\n- Has trained two current judges serving under Thaelorin\n\n---\n\n## Secret (DM Only)\n\nShe knows the 100-Year Review system is unjust—the math makes it obvious. But she's spent 400 years within that system. Admitting its flaws would invalidate her life's work. So she doesn't examine it too closely.\n\n---\n\n## Connections\n\n- **Thaelorin**: Professional ally - Legal expertise valued\n- **Nalindra Quietvoice**: Respect - Trained her early in career\n- **House Aeravel**: Rivalry - Military family, different values\n",
  "sourcePath": "06-NPCs/Thelassian/Lady Ithilwen Thelindor.md",
  "slug": "lady-ithilwen-thelindor",
  "category": "npcs"
}