{
  "title": "Lady Saelindra Caemorn",
  "metadata": {
    "Age": "620 years",
    "Race": "High Elf, Female",
    "Title": "Lady of House Caemorn",
    "Aligned Pillar": "Granite Tower (Circle of Stewards)",
    "Location": "Caemorn Estate (Inner City, Granite Quadrant)"
  },
  "atAGlance": "**Lady Saelindra Caemorn** - Head of House Caemorn, \"The Golden Hand\"\n\n- Matriarch of the wealthiest noble house in the Thelassian\n- Controls more trade routes and commercial interests than anyone except the Empire itself\n- Has led House Caemorn for 400 years, tripling their fortune\n- The power behind the Granite Towerâ€”Faendril relies on her economic expertise\n- *Common saying: \"Gold flows where Caemorn points. It has for four centuries.\"*\n\n| | |\n|---|---|\n| **Age** | 620 years |\n| **Race** | High Elf, Female |\n| **Title** | Lady of House Caemorn |\n| **Aligned Pillar** | Granite Tower (Circle of Stewards) |\n| **Location** | Caemorn Estate (Inner City, Granite Quadrant) |\n\n---",
  "commonKnowledge": "### Appearance & Manner\nElegant without ostentationâ€”her clothes are perfectly tailored but never flashy, her jewelry valuable but subtle. Silver hair arranged in elaborate traditional styles. Eyes the color of aged amber, always calculating. Moves with the confidence of someone who has never worried about money and never will. Her smile is warm; her accountants are not.\n\n### Personality (Public)\nGracious, cultured, charming. Hosts the most sought-after salons in the Inner City. Speaks multiple languages, knows everyone's business, remembers everyone's names. Appears friendly but every interaction is assessed for value. She's not cruelâ€”she's efficient. Friendship and profit aren't mutually exclusive.\n\n### House Caemorn's Wealth\nThe family fortune comes from:\n- **Trade networks**: Routes connecting all ten enclaves\n- **Banking**: Loans to lesser houses, guilds, even the Imperial treasury\n- **Property**: Holdings in every enclave, managed forests, mines\n- **Information**: Knowing what's worth buying before others do\n\nHouse Caemorn doesn't produce goodsâ€”they move them, finance them, and take a percentage of everything.\n\n### Political Influence\n- **Granite Tower**: Faendril consults her on major economic decisions\n- **Other Houses**: Most owe Caemorn money or favors\n- **Guilds**: Many are partially financed by Caemorn investments\n- **The Emperor**: She's been summoned to advise on economic matters\n\n### Her Methods\nShe doesn't threaten or coerce. She simply makes cooperation more profitable than resistance. Enemy one decade, ally the nextâ€”business is business. The only thing she won't forgive is bad investments.\n\n---",
  "secretKnowledge": "### True Nature\nSaelindra Caemorn is not greedy. Greed is for those who don't have enough. She has more gold than she could spend in ten elven lifetimes. What she wants is influenceâ€”the ability to shape the Empire's future through economic power rather than military force or political office.\n\nShe believes the Pillars are obsolete. Military strength means nothing when you can bankrupt armies. Law means nothing when you can buy judges. Magic and diplomacy mean nothing when you control the resources everyone needs. The real power has always been economic. She simply makes it obvious.\n\n### The Veraheim Investment\nShe has secretly invested in Veraheim.\n\nNot directlyâ€”that would be treason. But through intermediaries, shell companies, and deniable assets, House Caemorn profits from tunnel tolls, Veraheim trade, and the sanctuary's success. She doesn't care about politics. She cares about returns.\n\nIf this became public, House Caemorn would fall. But Saelindra didn't become the wealthiest elf alive by taking stupid risks. The trail is buried under 80 years of careful accounting.\n\n### What She Knows About the Empire\n- The drow policy costs the Empire millions in potential trade annually\n- The Aloria's debt crisis makes them vulnerable to economic warfare\n- Faendril agrees with her reforms but lacks the courage to implement them\n- At least three Great Houses would collapse without Caemorn loans\n\n### Her Real Opinion on Elven Supremacy\nShe finds it economically inconvenient. Racism limits trading partners, wastes non-elven talent, and creates unnecessary enemies. She doesn't care about moral argumentsâ€”equality would simply be more profitable.\n\nShe'll never say this publicly. But she invests accordingly.\n\n### The Succession Problem\nShe has three children:\n- **Vaelindis Caemorn** (son, 350): Competent but cautious, would maintain wealth\n- **Aelindra Caemorn** (daughter, 280): Brilliant but reckless, would gamble everything on expansion\n- **Thelindor Caemorn** (son, 200): No interest in business, wants to be an artist\n\nNone of them are her. She has 200+ years left to live, but she worries about what happens after.\n\n### What She Wants\n- House Caemorn to remain dominant (legacy)\n- Economic reform in the Empire (it would make everyone richer, including her)\n- A worthy successor (none of her children qualify yet)\n- Perhaps: to see the Empire become what it could be, not what tradition demands\n\n### What She Fears\n- Economic collapse (destroys her work, not her personally)\n- Her Veraheim investments exposed (ruin)\n- A successor who squanders the fortune (legacy destroyed)\n- Dying before the Empire modernizes (unfinished work)\n\n### Story Hooks\n\n| Hook | Description |\n|------|-------------|\n| **The Investment** | She hires PCs for a sensitive task related to Veraheim. Discretion is essential. |\n| **The Loan** | PCs need resources. She offersâ€”but what does she want in return? |\n| **The Exposure** | Someone discovers her Veraheim connections. She needs the evidence destroyed. |\n| **The Heir** | She tests PCs as potential advisors for her succession planning. |\n| **The Reform** | She's ready to push for economic change. She needs allies outside traditional power structures. |\n| **The Crisis** | Economic disaster threatens the Empire. She's the only one who can fix itâ€”at a price. |\n\n---",
  "seeAlso": [],
  "rawContent": "# Lady Saelindra Caemorn\n\n## At a Glance\n> **What anyone in elven high society would know**\n\n**Lady Saelindra Caemorn** - Head of House Caemorn, \"The Golden Hand\"\n\n- Matriarch of the wealthiest noble house in the Thelassian\n- Controls more trade routes and commercial interests than anyone except the Empire itself\n- Has led House Caemorn for 400 years, tripling their fortune\n- The power behind the Granite Towerâ€”Faendril relies on her economic expertise\n- *Common saying: \"Gold flows where Caemorn points. It has for four centuries.\"*\n\n| | |\n|---|---|\n| **Age** | 620 years |\n| **Race** | High Elf, Female |\n| **Title** | Lady of House Caemorn |\n| **Aligned Pillar** | Granite Tower (Circle of Stewards) |\n| **Location** | Caemorn Estate (Inner City, Granite Quadrant) |\n\n---\n\n## Common Knowledge\n> **What merchants, nobles, or economically aware would know**\n\n### Appearance & Manner\nElegant without ostentationâ€”her clothes are perfectly tailored but never flashy, her jewelry valuable but subtle. Silver hair arranged in elaborate traditional styles. Eyes the color of aged amber, always calculating. Moves with the confidence of someone who has never worried about money and never will. Her smile is warm; her accountants are not.\n\n### Personality (Public)\nGracious, cultured, charming. Hosts the most sought-after salons in the Inner City. Speaks multiple languages, knows everyone's business, remembers everyone's names. Appears friendly but every interaction is assessed for value. She's not cruelâ€”she's efficient. Friendship and profit aren't mutually exclusive.\n\n### House Caemorn's Wealth\nThe family fortune comes from:\n- **Trade networks**: Routes connecting all ten enclaves\n- **Banking**: Loans to lesser houses, guilds, even the Imperial treasury\n- **Property**: Holdings in every enclave, managed forests, mines\n- **Information**: Knowing what's worth buying before others do\n\nHouse Caemorn doesn't produce goodsâ€”they move them, finance them, and take a percentage of everything.\n\n### Political Influence\n- **Granite Tower**: Faendril consults her on major economic decisions\n- **Other Houses**: Most owe Caemorn money or favors\n- **Guilds**: Many are partially financed by Caemorn investments\n- **The Emperor**: She's been summoned to advise on economic matters\n\n### Her Methods\nShe doesn't threaten or coerce. She simply makes cooperation more profitable than resistance. Enemy one decade, ally the nextâ€”business is business. The only thing she won't forgive is bad investments.\n\n---\n\n## Secret Knowledge\n> **DM-only information**\n\n### True Nature\nSaelindra Caemorn is not greedy. Greed is for those who don't have enough. She has more gold than she could spend in ten elven lifetimes. What she wants is influenceâ€”the ability to shape the Empire's future through economic power rather than military force or political office.\n\nShe believes the Pillars are obsolete. Military strength means nothing when you can bankrupt armies. Law means nothing when you can buy judges. Magic and diplomacy mean nothing when you control the resources everyone needs. The real power has always been economic. She simply makes it obvious.\n\n### The Veraheim Investment\nShe has secretly invested in Veraheim.\n\nNot directlyâ€”that would be treason. But through intermediaries, shell companies, and deniable assets, House Caemorn profits from tunnel tolls, Veraheim trade, and the sanctuary's success. She doesn't care about politics. She cares about returns.\n\nIf this became public, House Caemorn would fall. But Saelindra didn't become the wealthiest elf alive by taking stupid risks. The trail is buried under 80 years of careful accounting.\n\n### What She Knows About the Empire\n- The drow policy costs the Empire millions in potential trade annually\n- The Aloria's debt crisis makes them vulnerable to economic warfare\n- Faendril agrees with her reforms but lacks the courage to implement them\n- At least three Great Houses would collapse without Caemorn loans\n\n### Her Real Opinion on Elven Supremacy\nShe finds it economically inconvenient. Racism limits trading partners, wastes non-elven talent, and creates unnecessary enemies. She doesn't care about moral argumentsâ€”equality would simply be more profitable.\n\nShe'll never say this publicly. But she invests accordingly.\n\n### The Succession Problem\nShe has three children:\n- **Vaelindis Caemorn** (son, 350): Competent but cautious, would maintain wealth\n- **Aelindra Caemorn** (daughter, 280): Brilliant but reckless, would gamble everything on expansion\n- **Thelindor Caemorn** (son, 200): No interest in business, wants to be an artist\n\nNone of them are her. She has 200+ years left to live, but she worries about what happens after.\n\n### What She Wants\n- House Caemorn to remain dominant (legacy)\n- Economic reform in the Empire (it would make everyone richer, including her)\n- A worthy successor (none of her children qualify yet)\n- Perhaps: to see the Empire become what it could be, not what tradition demands\n\n### What She Fears\n- Economic collapse (destroys her work, not her personally)\n- Her Veraheim investments exposed (ruin)\n- A successor who squanders the fortune (legacy destroyed)\n- Dying before the Empire modernizes (unfinished work)\n\n### Story Hooks\n\n| Hook | Description |\n|------|-------------|\n| **The Investment** | She hires PCs for a sensitive task related to Veraheim. Discretion is essential. |\n| **The Loan** | PCs need resources. She offersâ€”but what does she want in return? |\n| **The Exposure** | Someone discovers her Veraheim connections. She needs the evidence destroyed. |\n| **The Heir** | She tests PCs as potential advisors for her succession planning. |\n| **The Reform** | She's ready to push for economic change. She needs allies outside traditional power structures. |\n| **The Crisis** | Economic disaster threatens the Empire. She's the only one who can fix itâ€”at a price. |\n\n---\n\n## Connections Map\n\n```mermaid\nflowchart TD\n    subgraph House[\"ðŸ’° House Caemorn\"]\n        Saelindra[\"<b>Lady Saelindra Caemorn</b><br/>The Golden Hand<br/>620 years old\"]\n        Heirs[\"Three Children<br/>(none ready)\"]\n    end\n    \n    Saelindra -->|\"advises\"| Faendril[\"First Steward Faendril\"]\n    Saelindra -->|\"loans to\"| Houses[\"Other Great Houses\"]\n    Saelindra -->|\"finances\"| Guilds[\"Major Guilds\"]\n    \n    Saelindra -.->|\"secretly invests in\"| Veraheim[\"Veraheim<br/>âš ï¸ Treason if discovered\"]\n    \n    subgraph Wealth[\"The Caemorn Empire\"]\n        Trade[\"Trade Networks\"]\n        Banking[\"Banking & Loans\"]\n        Property[\"Property Holdings\"]\n        Info[\"Information Network\"]\n    end\n    \n    Saelindra --> Wealth\n    \n    subgraph Children[\"Succession Question\"]\n        Son1[\"Vaelindis (competent)\"]\n        Daughter[\"Aelindra (brilliant/reckless)\"]\n        Son2[\"Thelindor (artist)\"]\n    end\n    \n    Saelindra -.-> Children\n    \n    style Saelindra fill:#f9cb9c,color:#000\n    style Veraheim fill:#f4cccc,color:#000\n    style Wealth fill:#d9ead3,color:#000\n```\n\n---\n\n## Notes\n- The economic power playerâ€”wealth as political force\n- Her Veraheim secret is major campaign ammunition\n- Not evil, just profit-driven (morality is for those who can't afford pragmatism)\n- Can be patron, obstacle, or information source\n- Her succession problem mirrors the Empire's larger issues\n- Represents the argument that reform serves self-interest, not just idealism\n",
  "sourcePath": "06-NPCs/Thelassian/Lady Saelindra Caemorn.md",
  "slug": "lady-saelindra-caemorn",
  "category": "npcs"
}