{
  "title": "Lord Charles de Belmont",
  "metadata": {
    "Age": "55",
    "Seat": "Ch√¢teau Belmont",
    "Region": "Central fertile valleys",
    "Allegiance": "Money",
    "Threat Level": "High"
  },
  "atAGlance": "**Lord Charles de Belmont** - Lord of the Fair Valley, \"The Vintner\"\n\n- Wealthiest noble after the Crown, controls wine, banking, and luxury trade\n- Known for sophistication, culture, and dangerous political games\n- Host of the grandest feasts‚Äîan invitation to Ch√¢teau Belmont is a mark of status\n- Many Lords owe him money; he uses debt as leverage\n- *Common saying: \"Belmont wine is sweet. Belmont gold is sweeter. Belmont loans are poison.\"*\n\n| | |\n|---|---|\n| **Age** | 55 |\n| **Seat** | Ch√¢teau Belmont |\n| **Region** | Central fertile valleys |\n| **Allegiance** | Money |\n| **Threat Level** | High |\n\n---",
  "commonKnowledge": "### Appearance & Manner\nSoft body, clearly lives well. Silver hair, perfectly styled. Warm brown eyes that calculate while smiling. Impeccably dressed, always the finest fabrics. Manicured hands that have never held a sword. Pleasant expression that never quite reaches his eyes.\n\n### Personality\nCharming, cultured, sophisticated. Every word is chosen, every gesture planned. Genuinely loves art, wine, and music. Views politics as the highest art form. Patient‚Äîplays the long game. Never forgets a debt or an insult. Appears harmless, which is exactly what he wants.\n\n### Family\n- **Wife:** Lady Vivienne (n√©e Graustein, 52) - Lord Graustein's niece. Unhappy marriage, she focuses on children and gardens.\n- **Heir:** Philippe (29) - Drunk, gambler, womanizer. Entirely unfit. Father's despair.\n- **Second Son:** Lucien (26) - Intelligent, patient, dangerous. Should inherit but won't.\n- **Daughter:** Marian (21) - Betrothed to Edmund Ravenscar. Will dominate that marriage.\n- **Youngest:** Antoine (18) - Artist, no political interest, the only happy Belmont.\n\n### Domain & Wealth\nRules ~22,000 people in the fertile heartland. Produces famous wines, luxury goods, and most importantly‚Äîruns the Kingdom's banking. The Belmont Bank holds debts from multiple Lords. This is his true power.\n\n### Known Debtors\nEveryone knows Belmont holds major debts:\n- Lord Graustein: significant (declining house)\n- Lord Blackthorne: substantial (military expansion)\n- Lord Ashfeld: moderate (Veraheim dreams)\n- Even the Crown borrows occasionally (always repaid)\n\n---",
  "secretKnowledge": "### True Nature\nCharles is exactly the manipulator he appears to be‚Äîbut he's not evil in a dramatic sense. He's a businessman who treats nobility like commerce. He doesn't want power for its own sake; he wants security, influence, and legacy. He'd deal with anyone, support any cause, if the price was right.\n\n### The Debt Numbers\nActual amounts owed to Belmont Bank:\n- **Graustein:** 20,000 gold (crushing, could call anytime)\n- **Blackthorne:** 15,000 gold (dangerous debtor)\n- **Ashfeld:** 8,000 gold (manageable leverage)\n- **Crown:** 5,000 gold (short-term, always repaid)\n- Various minor nobles: 10,000+ gold total\n\nCharles rarely calls debts. The threat is more valuable than the gold.\n\n### The Secret Ledger\nCharles keeps a hidden ledger recording:\n- Every favor owed\n- Every debt unpaid\n- Every secret discovered\n- Every leverage point identified\n\nThis ledger is hidden somewhere in Ch√¢teau Belmont. It would be worth killing for.\n\n### The Succession Crisis\nCharles faces a terrible choice:\n- **Philippe** will inherit and destroy everything\n- **Lucien** should inherit but is second-born\n- Disinheriting Philippe would cause scandal\n- But Philippe inheriting would be catastrophe\n\nCharles is quietly considering \"options.\" Nothing decided yet. Lucien is almost certainly considering the same.\n\n### Vivienne's Betrayal\nHis wife corresponds with her Graustein relatives:\n- Provides intelligence about Belmont activities\n- Charles doesn't know (or pretends not to)\n- Not malicious‚Äîjust maintaining family ties\n- Could be exploited by enemies\n\n### What He Wants\n- Influence without responsibility\n- His family permanently powerful\n- The finest things in life\n- To be remembered as a great man\n\n### What He Fears\n- Losing his wealth\n- Being outmaneuvered at his own game\n- Philippe inheriting\n- Open warfare (gold means less when swords are drawn)\n\n### Story Hooks\n\n| Hook | Description |\n|------|-------------|\n| **The Ledger** | Someone wants the secret ledger. Protecting or stealing it is a major quest. |\n| **Debt Collection** | Charles calls in a debt. The consequences ripple through the Kingdom. |\n| **Brother vs Brother** | Lucien makes his move against Philippe. Which side do the PCs take? |\n| **The Golden Cage** | Charles offers patronage. The pay is excellent. The strings are invisible‚Äîat first. |\n| **Antoine's Trouble** | The innocent youngest son witnesses something he shouldn't. Now he's in danger. |\n\n---",
  "seeAlso": [],
  "rawContent": "# Lord Charles de Belmont\n\n## At a Glance\n> **What anyone in the Kingdom would know**\n\n**Lord Charles de Belmont** - Lord of the Fair Valley, \"The Vintner\"\n\n- Wealthiest noble after the Crown, controls wine, banking, and luxury trade\n- Known for sophistication, culture, and dangerous political games\n- Host of the grandest feasts‚Äîan invitation to Ch√¢teau Belmont is a mark of status\n- Many Lords owe him money; he uses debt as leverage\n- *Common saying: \"Belmont wine is sweet. Belmont gold is sweeter. Belmont loans are poison.\"*\n\n| | |\n|---|---|\n| **Age** | 55 |\n| **Seat** | Ch√¢teau Belmont |\n| **Region** | Central fertile valleys |\n| **Allegiance** | Money |\n| **Threat Level** | High |\n\n---\n\n## Common Knowledge\n> **What nobles, merchants, or acquaintances would know**\n\n### Appearance & Manner\nSoft body, clearly lives well. Silver hair, perfectly styled. Warm brown eyes that calculate while smiling. Impeccably dressed, always the finest fabrics. Manicured hands that have never held a sword. Pleasant expression that never quite reaches his eyes.\n\n### Personality\nCharming, cultured, sophisticated. Every word is chosen, every gesture planned. Genuinely loves art, wine, and music. Views politics as the highest art form. Patient‚Äîplays the long game. Never forgets a debt or an insult. Appears harmless, which is exactly what he wants.\n\n### Family\n- **Wife:** Lady Vivienne (n√©e Graustein, 52) - Lord Graustein's niece. Unhappy marriage, she focuses on children and gardens.\n- **Heir:** Philippe (29) - Drunk, gambler, womanizer. Entirely unfit. Father's despair.\n- **Second Son:** Lucien (26) - Intelligent, patient, dangerous. Should inherit but won't.\n- **Daughter:** Marian (21) - Betrothed to Edmund Ravenscar. Will dominate that marriage.\n- **Youngest:** Antoine (18) - Artist, no political interest, the only happy Belmont.\n\n### Domain & Wealth\nRules ~22,000 people in the fertile heartland. Produces famous wines, luxury goods, and most importantly‚Äîruns the Kingdom's banking. The Belmont Bank holds debts from multiple Lords. This is his true power.\n\n### Known Debtors\nEveryone knows Belmont holds major debts:\n- Lord Graustein: significant (declining house)\n- Lord Blackthorne: substantial (military expansion)\n- Lord Ashfeld: moderate (Veraheim dreams)\n- Even the Crown borrows occasionally (always repaid)\n\n---\n\n## Secret Knowledge\n> **DM-only information**\n\n### True Nature\nCharles is exactly the manipulator he appears to be‚Äîbut he's not evil in a dramatic sense. He's a businessman who treats nobility like commerce. He doesn't want power for its own sake; he wants security, influence, and legacy. He'd deal with anyone, support any cause, if the price was right.\n\n### The Debt Numbers\nActual amounts owed to Belmont Bank:\n- **Graustein:** 20,000 gold (crushing, could call anytime)\n- **Blackthorne:** 15,000 gold (dangerous debtor)\n- **Ashfeld:** 8,000 gold (manageable leverage)\n- **Crown:** 5,000 gold (short-term, always repaid)\n- Various minor nobles: 10,000+ gold total\n\nCharles rarely calls debts. The threat is more valuable than the gold.\n\n### The Secret Ledger\nCharles keeps a hidden ledger recording:\n- Every favor owed\n- Every debt unpaid\n- Every secret discovered\n- Every leverage point identified\n\nThis ledger is hidden somewhere in Ch√¢teau Belmont. It would be worth killing for.\n\n### The Succession Crisis\nCharles faces a terrible choice:\n- **Philippe** will inherit and destroy everything\n- **Lucien** should inherit but is second-born\n- Disinheriting Philippe would cause scandal\n- But Philippe inheriting would be catastrophe\n\nCharles is quietly considering \"options.\" Nothing decided yet. Lucien is almost certainly considering the same.\n\n### Vivienne's Betrayal\nHis wife corresponds with her Graustein relatives:\n- Provides intelligence about Belmont activities\n- Charles doesn't know (or pretends not to)\n- Not malicious‚Äîjust maintaining family ties\n- Could be exploited by enemies\n\n### What He Wants\n- Influence without responsibility\n- His family permanently powerful\n- The finest things in life\n- To be remembered as a great man\n\n### What He Fears\n- Losing his wealth\n- Being outmaneuvered at his own game\n- Philippe inheriting\n- Open warfare (gold means less when swords are drawn)\n\n### Story Hooks\n\n| Hook | Description |\n|------|-------------|\n| **The Ledger** | Someone wants the secret ledger. Protecting or stealing it is a major quest. |\n| **Debt Collection** | Charles calls in a debt. The consequences ripple through the Kingdom. |\n| **Brother vs Brother** | Lucien makes his move against Philippe. Which side do the PCs take? |\n| **The Golden Cage** | Charles offers patronage. The pay is excellent. The strings are invisible‚Äîat first. |\n| **Antoine's Trouble** | The innocent youngest son witnesses something he shouldn't. Now he's in danger. |\n\n---\n\n## Connections Map\n\n```mermaid\nflowchart TD\n    subgraph Belmont[\"üç∑ House Belmont\"]\n        Charles[\"<b>Lord Charles</b><br/>The Vintner\"]\n        Vivienne[\"Lady Vivienne<br/>n√©e Graustein\"]\n        Philippe[\"Philippe (heir)<br/>üî¥ The Disappointment\"]\n        Lucien[\"Lucien<br/>‚ö†Ô∏è The Shadow\"]\n        Marian[\"Marian<br/>Betrothed to Ravenscar\"]\n        Antoine[\"Antoine<br/>The Artist\"]\n    end\n    \n    Charles ---|\"cold marriage\"| Vivienne\n    Charles -->|\"despairs of\"| Philippe\n    Charles -->|\"watching\"| Lucien\n    \n    Marian -->|\"betrothed\"| Edmund_R[\"Edmund Ravenscar\"]\n    Vivienne -.->|\"reports to\"| Graustein[\"House Graustein\"]\n    \n    Charles -->|\"owns debt\"| Graustein_D[\"Lord Graustein<br/>20,000 gold\"]\n    Charles -->|\"owns debt\"| Blackthorne[\"Lord Blackthorne<br/>15,000 gold\"]\n    Charles -->|\"owns debt\"| Ashfeld[\"Lord Ashfeld<br/>8,000 gold\"]\n    \n    Lucien -.->|\"planning against\"| Philippe\n    \n    style Charles fill:#fce5cd,color:#000\n    style Philippe fill:#f4cccc,color:#000\n    style Lucien fill:#d5a6bd,color:#000\n```\n\n---\n\n## Notes\n- Not a villain, but utterly amoral\n- Major economic power‚Äîopposing him has consequences\n- Succession crisis will reshape Kingdom finances\n- The ledger is a campaign-changing MacGuffin\n",
  "sourcePath": "06-NPCs/Aloria/Lord Charles de Belmont.md",
  "slug": "lord-charles-de-belmont",
  "category": "npcs"
}