{
  "title": "Lord Wilhelm von K√∂nigsford",
  "metadata": {
    "Age": "53",
    "Seat": "K√∂nigsford Castle",
    "Region": "Central heartland, surrounding Thornreich",
    "Allegiance": "Whoever benefits him",
    "Threat Level": "Low"
  },
  "atAGlance": "**Lord Wilhelm von K√∂nigsford** - Lord of the King's Ford, \"The King's Shadow\"\n\n- Controls the region immediately surrounding the capital Thornreich\n- Professional courtier‚Äîborn to politics, thrives in the shadow of the throne\n- Always smiling, always agreeable, never commits to anything directly\n- Competes with Ravenscar for position as the King's closest Lord\n- *Common saying: \"K√∂nigsford agrees with everyone and means nothing.\"*\n\n| | |\n|---|---|\n| **Age** | 53 |\n| **Seat** | K√∂nigsford Castle |\n| **Region** | Central heartland, surrounding Thornreich |\n| **Allegiance** | Whoever benefits him |\n| **Threat Level** | Low |\n\n---",
  "commonKnowledge": "### Appearance & Manner\nPortly, comfortable build. Balding, compensates with elaborate hats. Shrewd brown eyes. Always smiling‚Äîit means nothing. Dresses in royal colors as subtle signal. Moves through court like water. Remembers everyone's name and preferences.\n\n### Personality\nProfessional courtier to his core. Says what people want to hear. Genuinely enjoys political games. Loyal to whoever benefits him most. Never commits to anything directly. Appears harmless‚Äîthis is intentional and misleading.\n\n### Family\n- **Wife:** Lady Mathilde (n√©e Belmont, 50) - Lord Belmont's sister. Smarter than Wilhelm, controls finances.\n- **Heir:** Friedrich (27) - Bland, follows rules, lacks initiative. Married to Princess Eleanora Greymont.\n- **Second Son:** Albrecht (24) - Has father's talents, resents being second. Building own power network.\n- **Daughter:** Liesel (20) - Socialite, expert at gathering information. Being positioned for advantageous marriage.\n\n### Domain & Position\nRules ~18,000 people around the capital. Primary value is location‚Äîevery visitor to Thornreich passes through K√∂nigsford land. Commands 1,600 soldiers (parade-ready, untested). Real power is proximity and information.\n\n### Political Position\nPart of the Loyalist faction alongside Ravenscar, but they're rivals for royal favor. Has Prince Friedrich married to Princess Eleanora‚Äîa major coup (though Eleanora actually dominates that household).\n\n---",
  "secretKnowledge": "### True Nature\nWilhelm is exactly the political creature he appears to be. He has no ideology, no deep loyalties, no moral compass beyond self-interest. But he's not evil‚Äîhe's a survivor. He's served three kings and countless political shifts by always being useful and never being threatening.\n\n### The Real Value\nWilhelm's true worth is information:\n- Knows everyone's secrets (and trades them carefully)\n- Controls who gets access to the capital\n- Observes everyone who passes through his lands\n- Has been doing this for 28 years\n\n### The Eleanora Situation\nThe marriage of Friedrich to Princess Eleanora was supposed to be a K√∂nigsford triumph. In reality:\n- Eleanora is far more capable than Friedrich\n- She runs the household\n- She reports everything to her mother\n- The Greymonts effectively have an agent inside K√∂nigsford\n\nWilhelm has slowly realized this but can't do anything about it without offending the crown.\n\n### Albrecht's Ambition\nThe second son has his father's talents and none of his patience:\n- Building his own network of contacts\n- May try to supplant Friedrich somehow\n- Father watches him carefully\n- Could be useful or dangerous\n\n### Relationship with Belmont\nThrough Mathilde (his wife, Belmont's sister):\n- Financial connection to Belmont wealth\n- Information sharing between houses\n- Mathilde is actually the smarter political player\n- Wilhelm relies on her more than he admits\n\n### What He Wants\n- Permanent influence near the throne\n- His family essential to any ruler\n- Comfort, status, security\n- To die peacefully in bed\n\n### What He Fears\n- A king who doesn't need him\n- Military conflict (where he's useless)\n- Ravenscar replacing him as royal favorite\n- Being exposed as having no real convictions\n\n### Story Hooks\n\n| Hook | Description |\n|------|-------------|\n| **The Information Broker** | Wilhelm knows something valuable. What's his price? |\n| **Access Granted** | PCs need to reach someone in the capital. K√∂nigsford controls who gets through. |\n| **Albrecht's Play** | The second son makes a move. Does it help or hurt the family? |\n| **The Empty Suit** | Friedrich is needed for something important. Can he rise to the occasion? |\n| **Survival Mode** | The political situation shifts. Watch Wilhelm adapt in real-time. |\n\n---",
  "seeAlso": [],
  "rawContent": "# Lord Wilhelm von K√∂nigsford\n\n## At a Glance\n> **What anyone in the Kingdom would know**\n\n**Lord Wilhelm von K√∂nigsford** - Lord of the King's Ford, \"The King's Shadow\"\n\n- Controls the region immediately surrounding the capital Thornreich\n- Professional courtier‚Äîborn to politics, thrives in the shadow of the throne\n- Always smiling, always agreeable, never commits to anything directly\n- Competes with Ravenscar for position as the King's closest Lord\n- *Common saying: \"K√∂nigsford agrees with everyone and means nothing.\"*\n\n| | |\n|---|---|\n| **Age** | 53 |\n| **Seat** | K√∂nigsford Castle |\n| **Region** | Central heartland, surrounding Thornreich |\n| **Allegiance** | Whoever benefits him |\n| **Threat Level** | Low |\n\n---\n\n## Common Knowledge\n> **What nobles, merchants, or acquaintances would know**\n\n### Appearance & Manner\nPortly, comfortable build. Balding, compensates with elaborate hats. Shrewd brown eyes. Always smiling‚Äîit means nothing. Dresses in royal colors as subtle signal. Moves through court like water. Remembers everyone's name and preferences.\n\n### Personality\nProfessional courtier to his core. Says what people want to hear. Genuinely enjoys political games. Loyal to whoever benefits him most. Never commits to anything directly. Appears harmless‚Äîthis is intentional and misleading.\n\n### Family\n- **Wife:** Lady Mathilde (n√©e Belmont, 50) - Lord Belmont's sister. Smarter than Wilhelm, controls finances.\n- **Heir:** Friedrich (27) - Bland, follows rules, lacks initiative. Married to Princess Eleanora Greymont.\n- **Second Son:** Albrecht (24) - Has father's talents, resents being second. Building own power network.\n- **Daughter:** Liesel (20) - Socialite, expert at gathering information. Being positioned for advantageous marriage.\n\n### Domain & Position\nRules ~18,000 people around the capital. Primary value is location‚Äîevery visitor to Thornreich passes through K√∂nigsford land. Commands 1,600 soldiers (parade-ready, untested). Real power is proximity and information.\n\n### Political Position\nPart of the Loyalist faction alongside Ravenscar, but they're rivals for royal favor. Has Prince Friedrich married to Princess Eleanora‚Äîa major coup (though Eleanora actually dominates that household).\n\n---\n\n## Secret Knowledge\n> **DM-only information**\n\n### True Nature\nWilhelm is exactly the political creature he appears to be. He has no ideology, no deep loyalties, no moral compass beyond self-interest. But he's not evil‚Äîhe's a survivor. He's served three kings and countless political shifts by always being useful and never being threatening.\n\n### The Real Value\nWilhelm's true worth is information:\n- Knows everyone's secrets (and trades them carefully)\n- Controls who gets access to the capital\n- Observes everyone who passes through his lands\n- Has been doing this for 28 years\n\n### The Eleanora Situation\nThe marriage of Friedrich to Princess Eleanora was supposed to be a K√∂nigsford triumph. In reality:\n- Eleanora is far more capable than Friedrich\n- She runs the household\n- She reports everything to her mother\n- The Greymonts effectively have an agent inside K√∂nigsford\n\nWilhelm has slowly realized this but can't do anything about it without offending the crown.\n\n### Albrecht's Ambition\nThe second son has his father's talents and none of his patience:\n- Building his own network of contacts\n- May try to supplant Friedrich somehow\n- Father watches him carefully\n- Could be useful or dangerous\n\n### Relationship with Belmont\nThrough Mathilde (his wife, Belmont's sister):\n- Financial connection to Belmont wealth\n- Information sharing between houses\n- Mathilde is actually the smarter political player\n- Wilhelm relies on her more than he admits\n\n### What He Wants\n- Permanent influence near the throne\n- His family essential to any ruler\n- Comfort, status, security\n- To die peacefully in bed\n\n### What He Fears\n- A king who doesn't need him\n- Military conflict (where he's useless)\n- Ravenscar replacing him as royal favorite\n- Being exposed as having no real convictions\n\n### Story Hooks\n\n| Hook | Description |\n|------|-------------|\n| **The Information Broker** | Wilhelm knows something valuable. What's his price? |\n| **Access Granted** | PCs need to reach someone in the capital. K√∂nigsford controls who gets through. |\n| **Albrecht's Play** | The second son makes a move. Does it help or hurt the family? |\n| **The Empty Suit** | Friedrich is needed for something important. Can he rise to the occasion? |\n| **Survival Mode** | The political situation shifts. Watch Wilhelm adapt in real-time. |\n\n---\n\n## Connections Map\n\n```mermaid\nflowchart TD\n    subgraph Konigsford[\"üèõÔ∏è House K√∂nigsford\"]\n        Wilhelm[\"<b>Lord Wilhelm</b><br/>The King's Shadow\"]\n        Mathilde[\"Lady Mathilde<br/>n√©e Belmont\"]\n        Friedrich[\"Friedrich (heir)<br/>The Empty Suit\"]\n        Albrecht[\"Albrecht<br/>The Schemer\"]\n        Liesel[\"Liesel<br/>The Socialite\"]\n    end\n    \n    Wilhelm ---|\"relies on\"| Mathilde\n    Wilhelm -->|\"will inherit\"| Friedrich\n    Wilhelm -->|\"watching\"| Albrecht\n    \n    Friedrich ---|\"married to\"| Eleanora[\"Princess Eleanora<br/>üëë Actually in charge\"]\n    Mathilde -.->|\"sister\"| Belmont[\"Lord Belmont\"]\n    \n    Wilhelm -->|\"serves\"| Crown[\"Crown\"]\n    Wilhelm <-->|\"rivals\"| Ravenscar[\"Lord Ravenscar\"]\n    \n    Eleanora -.->|\"reports to\"| Margarethe[\"Queen Margarethe\"]\n    \n    style Wilhelm fill:#d9d2e9,color:#000\n    style Eleanora fill:#fff2cc,color:#000\n    style Albrecht fill:#fce5cd,color:#000\n```\n\n---\n\n## Notes\n- Not a villain or hero‚Äîpure political animal\n- Useful contact for information-gathering\n- The Eleanora situation shows Greymont cleverness\n- Survives by being useful, never threatening\n",
  "sourcePath": "06-NPCs/Aloria/Lord Wilhelm von K√∂nigsford.md",
  "slug": "lord-wilhelm-von-knigsford",
  "category": "npcs"
}