{
  "title": "Lord Alaric Thornwood",
  "metadata": {
    "Age": "42",
    "Seat": "Thornwood Hall",
    "Region": "Western forests",
    "Allegiance": "Honor and his people",
    "Threat Level": "Low"
  },
  "atAGlance": "**Lord Alaric Thornwood** - Master of the Green Wood, \"The Honest Lord\"\n\n- Rules the great western forestsâ€”timber, hunting, and practical folk\n- Known as the one honest Lord in a court of schemers\n- Says what he means, keeps his word, judges by actions not birth\n- Produces the finest bows and archers in the Kingdom\n- *Common saying: \"A Thornwood promise is worth more than a Belmont contract.\"*\n\n| | |\n|---|---|\n| **Age** | 42 |\n| **Seat** | Thornwood Hall |\n| **Region** | Western forests |\n| **Allegiance** | Honor and his people |\n| **Threat Level** | Low |\n\n---",
  "commonKnowledge": "### Appearance & Manner\nTall, rangy build of a woodsman. Weather-beaten face with laugh lines. Brown hair, green eyes. Simple dressâ€”quality but not showy. Calloused hands because he actually works. Moves like a hunter. Speaks directly, sometimes to his political detriment.\n\n### Personality\nGenuinely honestâ€”almost a disability at court. Values competence over birth. Uncomfortable with politics. Loyal friend, terrible enemy. Protective of his people and family. Prefers forests to castles. Keeps being surprised by political betrayals.\n\n### Family\n- **Wife:** Lady Marian (nÃ©e Valcourt, 40) - Lord Valcourt's sister. Marriage became genuine love. More politically aware than Alaric.\n- **Heir:** Roland (20) - Honest like father, better at reading people. Capable ranger. Unmarried.\n- **Second Son:** Garrett (17) - Different from fatherâ€”enjoys court games. Studies politics. Alaric doesn't know what to make of him.\n- **Sisters:** Helena (married to Lord Ashfeld), Greta (married to Lord Wolfstein).\n\n### Domain & Resources\nRules ~12,000 people in the ancient forests. Produces timber, famous Thornwood longbows, furs, and game. Commands 1,400 soldiers including 200 elite rangersâ€”best archers in the Kingdom. The forests themselves are natural defense.\n\n### Political Position\nLoosely part of the Military Bloc through family connections (Greta married to Wolfstein). Friendly with the crown but not politically active. Other Lords respect his honesty even when they can't understand it.\n\n---",
  "secretKnowledge": "### True Nature\nAlaric is genuinely what he appearsâ€”honest, honorable, and uncomfortable with the games other Lords play. But he has secrets even his family doesn't know. His ideology is softer than most Lords, and he's quietly done things that would scandalize the Kingdom.\n\n### The Veraheim Sympathy\nAlaric doesn't fully embrace human supremacy:\n- Respects what Vera Wyrdweaver built\n- Has quietly helped refugees reach Veraheim\n- Doesn't hate non-humans the way other Lords do\n- Keeps this VERY quiet\n\nIf this were known, his reputation and position would be destroyed.\n\n### The Timber Trade Secret\nThornwood timber is exported through Veraheim's tunnel:\n- Ends up in the Broken Isles\n- Becomes pirate ships\n- Alaric knows (though he pretends not to)\n- The gold is good, and he doesn't actually mind\n\nThis could be considered treasonâ€”trading with pirates through the neutral city.\n\n### Garrett's Concerning Development\nThe second son is learning politics:\n- Has been meeting with... people\n- Learning the game his father despises\n- Might be exactly what the family needs\n- Or might become something Alaric would hate\n- Has been approached by Blackthorne agents (hasn't committed)\n\n### The Accidental Alliance Network\nThrough his sisters' marriages, Alaric is connected to:\n- **Wolfstein** (Greta) - Military power\n- **Ashfeld** (Helena) - Eastern frontier\n- **Valcourt** (wife Marian) - Trade networks\n- **Eisenwald** (through Wolfstein) - Iron production\n\nThis network could be powerful if activated. Alaric has never tried.\n\n### What He Wants\n- His domain peaceful and prosperous\n- His family happy and safe\n- To be left alone by court politics\n- His values passed to his children\n\n### What He Fears\n- Being forced to compromise his principles\n- His family used as political pawns\n- The Kingdom's corruption spreading to his domain\n- His secrets being exposed\n\n### Story Hooks\n\n| Hook | Description |\n|------|-------------|\n| **The Honest Broker** | Alaric is asked to mediate a Lord dispute. His honesty is valuableâ€”but someone wants him to fail. |\n| **The Timber Trail** | Evidence of Thornwood timber on pirate ships. Cover-up or face the consequences? |\n| **The Good Lord** | Refugees fleeing to Veraheim pass through Thornwood. Does Alaric help them openly? |\n| **Garrett's Choice** | The second son has been offered something by Blackthorne. Does he take it? |\n| **The Network Awakens** | Crisis requires Alaric to leverage his family connections. Can he play politics without becoming what he hates? |\n\n---",
  "seeAlso": [],
  "rawContent": "# Lord Alaric Thornwood\n\n## At a Glance\n> **What anyone in the Kingdom would know**\n\n**Lord Alaric Thornwood** - Master of the Green Wood, \"The Honest Lord\"\n\n- Rules the great western forestsâ€”timber, hunting, and practical folk\n- Known as the one honest Lord in a court of schemers\n- Says what he means, keeps his word, judges by actions not birth\n- Produces the finest bows and archers in the Kingdom\n- *Common saying: \"A Thornwood promise is worth more than a Belmont contract.\"*\n\n| | |\n|---|---|\n| **Age** | 42 |\n| **Seat** | Thornwood Hall |\n| **Region** | Western forests |\n| **Allegiance** | Honor and his people |\n| **Threat Level** | Low |\n\n---\n\n## Common Knowledge\n> **What nobles, merchants, or acquaintances would know**\n\n### Appearance & Manner\nTall, rangy build of a woodsman. Weather-beaten face with laugh lines. Brown hair, green eyes. Simple dressâ€”quality but not showy. Calloused hands because he actually works. Moves like a hunter. Speaks directly, sometimes to his political detriment.\n\n### Personality\nGenuinely honestâ€”almost a disability at court. Values competence over birth. Uncomfortable with politics. Loyal friend, terrible enemy. Protective of his people and family. Prefers forests to castles. Keeps being surprised by political betrayals.\n\n### Family\n- **Wife:** Lady Marian (nÃ©e Valcourt, 40) - Lord Valcourt's sister. Marriage became genuine love. More politically aware than Alaric.\n- **Heir:** Roland (20) - Honest like father, better at reading people. Capable ranger. Unmarried.\n- **Second Son:** Garrett (17) - Different from fatherâ€”enjoys court games. Studies politics. Alaric doesn't know what to make of him.\n- **Sisters:** Helena (married to Lord Ashfeld), Greta (married to Lord Wolfstein).\n\n### Domain & Resources\nRules ~12,000 people in the ancient forests. Produces timber, famous Thornwood longbows, furs, and game. Commands 1,400 soldiers including 200 elite rangersâ€”best archers in the Kingdom. The forests themselves are natural defense.\n\n### Political Position\nLoosely part of the Military Bloc through family connections (Greta married to Wolfstein). Friendly with the crown but not politically active. Other Lords respect his honesty even when they can't understand it.\n\n---\n\n## Secret Knowledge\n> **DM-only information**\n\n### True Nature\nAlaric is genuinely what he appearsâ€”honest, honorable, and uncomfortable with the games other Lords play. But he has secrets even his family doesn't know. His ideology is softer than most Lords, and he's quietly done things that would scandalize the Kingdom.\n\n### The Veraheim Sympathy\nAlaric doesn't fully embrace human supremacy:\n- Respects what Vera Wyrdweaver built\n- Has quietly helped refugees reach Veraheim\n- Doesn't hate non-humans the way other Lords do\n- Keeps this VERY quiet\n\nIf this were known, his reputation and position would be destroyed.\n\n### The Timber Trade Secret\nThornwood timber is exported through Veraheim's tunnel:\n- Ends up in the Broken Isles\n- Becomes pirate ships\n- Alaric knows (though he pretends not to)\n- The gold is good, and he doesn't actually mind\n\nThis could be considered treasonâ€”trading with pirates through the neutral city.\n\n### Garrett's Concerning Development\nThe second son is learning politics:\n- Has been meeting with... people\n- Learning the game his father despises\n- Might be exactly what the family needs\n- Or might become something Alaric would hate\n- Has been approached by Blackthorne agents (hasn't committed)\n\n### The Accidental Alliance Network\nThrough his sisters' marriages, Alaric is connected to:\n- **Wolfstein** (Greta) - Military power\n- **Ashfeld** (Helena) - Eastern frontier\n- **Valcourt** (wife Marian) - Trade networks\n- **Eisenwald** (through Wolfstein) - Iron production\n\nThis network could be powerful if activated. Alaric has never tried.\n\n### What He Wants\n- His domain peaceful and prosperous\n- His family happy and safe\n- To be left alone by court politics\n- His values passed to his children\n\n### What He Fears\n- Being forced to compromise his principles\n- His family used as political pawns\n- The Kingdom's corruption spreading to his domain\n- His secrets being exposed\n\n### Story Hooks\n\n| Hook | Description |\n|------|-------------|\n| **The Honest Broker** | Alaric is asked to mediate a Lord dispute. His honesty is valuableâ€”but someone wants him to fail. |\n| **The Timber Trail** | Evidence of Thornwood timber on pirate ships. Cover-up or face the consequences? |\n| **The Good Lord** | Refugees fleeing to Veraheim pass through Thornwood. Does Alaric help them openly? |\n| **Garrett's Choice** | The second son has been offered something by Blackthorne. Does he take it? |\n| **The Network Awakens** | Crisis requires Alaric to leverage his family connections. Can he play politics without becoming what he hates? |\n\n---\n\n## Connections Map\n\n```mermaid\nflowchart TD\n    subgraph Thornwood[\"ðŸŒ² House Thornwood\"]\n        Alaric[\"<b>Lord Alaric</b><br/>The Honest Lord\"]\n        Marian[\"Lady Marian<br/>nÃ©e Valcourt\"]\n        Roland[\"Roland (heir)<br/>The Young Oak\"]\n        Garrett[\"Garrett<br/>âš ï¸ The Shadow\"]\n    end\n    \n    Alaric ---|\"loves\"| Marian\n    Alaric -->|\"raising\"| Roland\n    Alaric -->|\"confused by\"| Garrett\n    \n    Marian -.->|\"sister\"| Valcourt[\"Lord Valcourt\"]\n    \n    subgraph Sisters[\"Sisters' Marriages\"]\n        Helena[\"Helena<br/>â†’ Lord Ashfeld\"]\n        Greta[\"Greta<br/>â†’ Lord Wolfstein\"]\n    end\n    \n    Alaric -.->|\"sister\"| Helena\n    Alaric -.->|\"sister\"| Greta\n    \n    Alaric -.->|\"secret sympathy\"| Veraheim[\"Veraheim\"]\n    Alaric -.->|\"timber trade\"| Pirates[\"Broken Isles\"]\n    \n    Garrett -.->|\"approached by\"| Blackthorne[\"Blackthorne Agents\"]\n    \n    style Alaric fill:#d9ead3,color:#000\n    style Garrett fill:#fce5cd,color:#000\n    style Veraheim fill:#d9d2e9,color:#000\n```\n\n---\n\n## Notes\n- One of the few genuinely good nobles\n- His secrets add depth without making him villainous\n- Garrett could go either wayâ€”story potential\n- The alliance network is a campaign resource\n- Natural ally for parties with moral compass\n",
  "sourcePath": "06-NPCs/Aloria/Lord Alaric Thornwood.md",
  "slug": "lord-alaric-thornwood",
  "category": "npcs"
}