{
  "title": "Lord Heinrich von Eisenwald",
  "metadata": {
    "Age": "38",
    "Seat": "Eisenhalt (The Iron Hold)",
    "Region": "Northern mountains",
    "Allegiance": "Military strength",
    "Threat Level": "High"
  },
  "atAGlance": "**Lord Heinrich von Eisenwald** - Lord of the Iron Forest, \"The Iron Lord\"\n\n- Controls the northern mountains and the Kingdom's richest iron mines\n- Produces the weapons and armor that equip every army, including the King's\n- Warrior first, politician never‚Äîdespises court intrigue\n- Commands the best-equipped military force after the Royal Army\n- *Common saying: \"Eisenwald iron in your hand, Eisenwald steel at your throat.\"*\n\n| | |\n|---|---|\n| **Age** | 38 |\n| **Seat** | Eisenhalt (The Iron Hold) |\n| **Region** | Northern mountains |\n| **Allegiance** | Military strength |\n| **Threat Level** | High |\n\n---",
  "commonKnowledge": "### Appearance & Manner\nPowerfully built, arms like tree trunks. Short-cropped black hair, military cut. Cold blue eyes that evaluate everyone as threat or tool. Scarred hands from years of smithing and fighting. Wears functional armor even at court. Short beard, kept trimmed. Speaks directly, almost rudely.\n\n### Personality\nDirect to the point of insult. Despises politics and scheming but participates when necessary. Values strength, courage, and loyalty above all. Believes humans should dominate through power, not diplomacy. Respects warriors regardless of birth. Impatient with weakness, soft words, and excuses.\n\n### Family\n- **Wife:** Lady Brunhilde (n√©e Wolfstein, 35) - Lord Wolfstein's sister. Warrior herself, genuine partnership.\n- **Heir:** Konrad (17) - Talented fighter under immense pressure. Marriage discussions starting.\n- **Second Son:** Friedrich (15) - \"Disappointment,\" prefers books to swords. Father is oblivious to his value.\n- **Daughter:** Sigrid (12) - Wants to be a knight, trains secretly.\n\n### Domain & Strength\nRules ~12,000 people in the northern mountains. Controls the best iron mines in the Kingdom. Commands 3,000 soldiers‚Äîthe best equipped in the Kingdom. Supplies weapons to the Royal Army (major leverage). Could theoretically embargo the Kingdom's arms supply.\n\n### Political Position\nLeads the Military Bloc alongside Wolfstein and (loosely) Thornwood. Thinks King Aldric is weak. Has been cultivating Prince Roderick‚Äîthey share views on strength and glory. Married into Wolfstein, cementing the military alliance.\n\n---",
  "secretKnowledge": "### True Nature\nHeinrich is exactly as martial as he appears, but he's not stupid‚Äîjust focused. He genuinely believes a warrior-king would be better for the Kingdom. He's not plotting treason, but he is positioning himself to benefit when Roderick takes power. If the opportunity arose to accelerate that... he might consider it.\n\n### The Prince Connection\nHeinrich has been cultivating Roderick for years:\n- Invites him to Eisenhalt for \"training\"\n- Teaches him that military strength is true power\n- Shares his views on elves, Veraheim, and human supremacy\n- Building a relationship for when Roderick is King\n\nAldric knows and is worried. He can't forbid it without making Roderick rebel.\n\n### The Secret Forge\nDeep in Eisenhalt, Heinrich maintains a hidden facility:\n- Experimental weapons, new alloys, new designs\n- Preparing for... something\n- Only his most trusted know\n- Could be for legitimate defense, or for something else\n\n### Friedrich's Hidden Value\nThe \"disappointment\" son is actually an engineering genius:\n- Has improved forge designs secretly\n- Understands metallurgy better than the master smiths\n- Could revolutionize Eisenwald production\n- Heinrich is completely oblivious\n- Brunhilde knows and quietly protects him\n\n### The Arms Leverage\nHeinrich controls the Kingdom's weapons supply:\n- Lords who displease him find orders \"delayed\"\n- Quality varies based on relationship\n- Could theoretically embargo anyone\n- This is why even enemies stay polite\n\n### What He Wants\n- Military glory and recognition\n- A Kingdom strong enough to crush the elves\n- Roderick on the throne (eventually)\n- Proof that strength matters more than scheming\n\n### What He Fears\n- Being seen as weak\n- His children failing his standards\n- Being outmaneuvered by politicians\n- Dying without accomplishing something great\n\n### Story Hooks\n\n| Hook | Description |\n|------|-------------|\n| **The Secret Forge** | Someone discovers Heinrich's hidden weapons program. What is he building‚Äîand for whom? |\n| **Iron Embargo** | Heinrich cuts off a Lord's weapons. The PCs are caught in the economic warfare. |\n| **The Prince's Loyalty** | Roderick must choose between father and Heinrich. PCs might influence the choice. |\n| **Friedrich's Genius** | The overlooked son invents something important. Does his father finally notice? |\n| **Military Alliance** | Heinrich proposes a joint campaign. Is it strategy or the first step toward something darker? |\n\n---",
  "seeAlso": [],
  "rawContent": "# Lord Heinrich von Eisenwald\n\n## At a Glance\n> **What anyone in the Kingdom would know**\n\n**Lord Heinrich von Eisenwald** - Lord of the Iron Forest, \"The Iron Lord\"\n\n- Controls the northern mountains and the Kingdom's richest iron mines\n- Produces the weapons and armor that equip every army, including the King's\n- Warrior first, politician never‚Äîdespises court intrigue\n- Commands the best-equipped military force after the Royal Army\n- *Common saying: \"Eisenwald iron in your hand, Eisenwald steel at your throat.\"*\n\n| | |\n|---|---|\n| **Age** | 38 |\n| **Seat** | Eisenhalt (The Iron Hold) |\n| **Region** | Northern mountains |\n| **Allegiance** | Military strength |\n| **Threat Level** | High |\n\n---\n\n## Common Knowledge\n> **What nobles, merchants, or acquaintances would know**\n\n### Appearance & Manner\nPowerfully built, arms like tree trunks. Short-cropped black hair, military cut. Cold blue eyes that evaluate everyone as threat or tool. Scarred hands from years of smithing and fighting. Wears functional armor even at court. Short beard, kept trimmed. Speaks directly, almost rudely.\n\n### Personality\nDirect to the point of insult. Despises politics and scheming but participates when necessary. Values strength, courage, and loyalty above all. Believes humans should dominate through power, not diplomacy. Respects warriors regardless of birth. Impatient with weakness, soft words, and excuses.\n\n### Family\n- **Wife:** Lady Brunhilde (n√©e Wolfstein, 35) - Lord Wolfstein's sister. Warrior herself, genuine partnership.\n- **Heir:** Konrad (17) - Talented fighter under immense pressure. Marriage discussions starting.\n- **Second Son:** Friedrich (15) - \"Disappointment,\" prefers books to swords. Father is oblivious to his value.\n- **Daughter:** Sigrid (12) - Wants to be a knight, trains secretly.\n\n### Domain & Strength\nRules ~12,000 people in the northern mountains. Controls the best iron mines in the Kingdom. Commands 3,000 soldiers‚Äîthe best equipped in the Kingdom. Supplies weapons to the Royal Army (major leverage). Could theoretically embargo the Kingdom's arms supply.\n\n### Political Position\nLeads the Military Bloc alongside Wolfstein and (loosely) Thornwood. Thinks King Aldric is weak. Has been cultivating Prince Roderick‚Äîthey share views on strength and glory. Married into Wolfstein, cementing the military alliance.\n\n---\n\n## Secret Knowledge\n> **DM-only information**\n\n### True Nature\nHeinrich is exactly as martial as he appears, but he's not stupid‚Äîjust focused. He genuinely believes a warrior-king would be better for the Kingdom. He's not plotting treason, but he is positioning himself to benefit when Roderick takes power. If the opportunity arose to accelerate that... he might consider it.\n\n### The Prince Connection\nHeinrich has been cultivating Roderick for years:\n- Invites him to Eisenhalt for \"training\"\n- Teaches him that military strength is true power\n- Shares his views on elves, Veraheim, and human supremacy\n- Building a relationship for when Roderick is King\n\nAldric knows and is worried. He can't forbid it without making Roderick rebel.\n\n### The Secret Forge\nDeep in Eisenhalt, Heinrich maintains a hidden facility:\n- Experimental weapons, new alloys, new designs\n- Preparing for... something\n- Only his most trusted know\n- Could be for legitimate defense, or for something else\n\n### Friedrich's Hidden Value\nThe \"disappointment\" son is actually an engineering genius:\n- Has improved forge designs secretly\n- Understands metallurgy better than the master smiths\n- Could revolutionize Eisenwald production\n- Heinrich is completely oblivious\n- Brunhilde knows and quietly protects him\n\n### The Arms Leverage\nHeinrich controls the Kingdom's weapons supply:\n- Lords who displease him find orders \"delayed\"\n- Quality varies based on relationship\n- Could theoretically embargo anyone\n- This is why even enemies stay polite\n\n### What He Wants\n- Military glory and recognition\n- A Kingdom strong enough to crush the elves\n- Roderick on the throne (eventually)\n- Proof that strength matters more than scheming\n\n### What He Fears\n- Being seen as weak\n- His children failing his standards\n- Being outmaneuvered by politicians\n- Dying without accomplishing something great\n\n### Story Hooks\n\n| Hook | Description |\n|------|-------------|\n| **The Secret Forge** | Someone discovers Heinrich's hidden weapons program. What is he building‚Äîand for whom? |\n| **Iron Embargo** | Heinrich cuts off a Lord's weapons. The PCs are caught in the economic warfare. |\n| **The Prince's Loyalty** | Roderick must choose between father and Heinrich. PCs might influence the choice. |\n| **Friedrich's Genius** | The overlooked son invents something important. Does his father finally notice? |\n| **Military Alliance** | Heinrich proposes a joint campaign. Is it strategy or the first step toward something darker? |\n\n---\n\n## Connections Map\n\n```mermaid\nflowchart TD\n    subgraph Eisenwald[\"‚öîÔ∏è House Eisenwald\"]\n        Heinrich[\"<b>Lord Heinrich</b><br/>The Iron Lord\"]\n        Brunhilde[\"Lady Brunhilde<br/>n√©e Wolfstein\"]\n        Konrad[\"Konrad (heir)<br/>The Young Hammer\"]\n        Friedrich[\"Friedrich<br/>üîß Hidden Genius\"]\n        Sigrid[\"Sigrid<br/>Secret Warrior\"]\n    end\n    \n    Heinrich ---|\"partnership\"| Brunhilde\n    Heinrich -->|\"pressures\"| Konrad\n    Heinrich -->|\"ignores\"| Friedrich\n    \n    Heinrich -->|\"cultivating\"| Roderick[\"Prince Roderick\"]\n    Heinrich ---|\"allied\"| Wolfstein[\"Lord Wolfstein<br/>(brother-in-law)\"]\n    Heinrich -->|\"supplies weapons\"| RoyalArmy[\"Royal Army\"]\n    \n    Heinrich -->|\"contempt for\"| Belmont[\"Lord Belmont\"]\n    Heinrich -->|\"dislikes\"| Aldric[\"King Aldric\"]\n    \n    Brunhilde -.->|\"protects\"| Friedrich\n    \n    style Heinrich fill:#f4cccc,color:#000\n    style Roderick fill:#fce5cd,color:#000\n    style Friedrich fill:#d9ead3,color:#000\n```\n\n---\n\n## Notes\n- Not evil, but dangerous‚Äîbelieves in his worldview completely\n- Key military power in any conflict\n- The Roderick connection could destabilize everything\n- Friedrich is a hidden asset waiting to be discovered\n",
  "sourcePath": "06-NPCs/Aloria/Lord Heinrich von Eisenwald.md",
  "slug": "lord-heinrich-von-eisenwald",
  "category": "npcs"
}