{
  "title": "Lord Godfrey Ravenscar",
  "metadata": {
    "Age": "45",
    "Seat": "Ravenscar Keep",
    "Region": "Northeast marshlands",
    "Allegiance": "Crown (absolute)",
    "Threat Level": "Medium"
  },
  "atAGlance": "**Lord Godfrey Ravenscar** - Lord of Ravenmarch, \"The King's Shield\"\n\n- Rules the oldest noble house in the Kingdom from Ravenscar Keep\n- Queen Margarethe's nephew‚Äîmakes him royal family by blood\n- Utterly loyal to the crown, traditional and conservative\n- Known for rigid honor and looking down on \"newer\" families\n- *Common saying: \"A Ravenscar's word is iron‚Äîcold, hard, and unbending.\"*\n\n| | |\n|---|---|\n| **Age** | 45 |\n| **Seat** | Ravenscar Keep |\n| **Region** | Northeast marshlands |\n| **Allegiance** | Crown (absolute) |\n| **Threat Level** | Medium |\n\n---",
  "commonKnowledge": "### Appearance & Manner\nTall, lean, aristocratic bearing. Sharp green eyes (family trait, shared with Queen Margarethe). Greying dark hair, receding slightly. Clean-shaven, strong jaw. Dresses in conservative dark colors. Carries himself with rigid formality. Follows protocol religiously.\n\n### Personality\nUtterly proper‚Äîtradition matters. Conservative, suspicious of change. Proud of his lineage to the point of arrogance. Looks down on \"newer\" noble families (Ashfeld, Blackthorne). Privately warmer than his public facade suggests, but few see that side.\n\n### Family\n- **Wife:** Lady Cordelia (n√©e Valcourt, 42) - Lord Valcourt's sister. Practical, manages household efficiently.\n- **Heir:** Edmund (22) - Scholarly, dutiful, not the warrior father wanted. Betrothed to Marian Belmont.\n- **Second Son:** Marcus (19) - Natural warrior, serves in Royal Army. Everything Edmund isn't.\n- **Daughter:** Rowena (17) - Quiet, observant, close to Queen Margarethe.\n\n### Domain & Strength\nRules ~15,000 people in the northeast marshlands. Commands 2,500 quality soldiers‚Äînot the largest army but disciplined and reliable. The marshes themselves are natural defenses. Traditional shield between the capital and frontier threats.\n\n### Political Position\nLeader of the Loyalist faction alongside K√∂nigsford. His loyalty to the crown is absolute‚Äînot from love of Aldric personally, but from family honor and tradition. Competes with K√∂nigsford for royal favor.\n\n---",
  "secretKnowledge": "### True Nature\nGodfrey is exactly what he appears to be‚Äîhonorable, traditional, loyal. His rigidity isn't a mask; it's who he is. But this makes him predictable and sometimes blind. He can't imagine betrayal from within his own family, which makes Marcus's situation dangerous.\n\n### The Edmund Problem\nGodfrey wanted a warrior heir. He got a scholar. Edmund is intelligent, capable, and kind‚Äînone of which Godfrey values properly. His obvious disappointment has created a rift. Edmund tries desperately to please; Godfrey barely notices.\n\n### The Marcus Danger\nThe second son is what Godfrey wanted Edmund to be‚Äîbold, martial, confident. This creates terrible family dynamics:\n- Marcus secretly believes he'd be a better heir\n- Edmund knows their father prefers Marcus\n- **Lord Blackthorne's agents are recruiting Marcus**\n- Godfrey doesn't know (or won't see it)\n\nIf Marcus is turned, he could betray the entire Loyalist faction.\n\n### The Chronicle Room\nRavenscar Keep contains records going back centuries. Hidden among them:\n- Evidence of Graustein legitimacy questions (three generations back)\n- Documentation of Blackthorne atrocities\n- Old debts and broken promises\n- Godfrey hasn't used these‚Äîconsiders it beneath his honor\n- Someone less honorable could weaponize them\n\n### Hidden Concerns\n- Worried about Edmund's betrothal to Marian Belmont (she's too clever)\n- Suspects Blackthorne is dangerous but can't prove anything\n- Fears Prince Roderick's aggression will destabilize everything\n- Queen Margarethe asks him for things he doesn't fully understand\n\n### What He Wants\n- The Kingdom stable and orderly\n- His family's prestige maintained\n- Edmund to somehow become worthy\n- Traditional values preserved\n\n### What He Fears\n- Civil war\n- Being seen as \"just\" the Queen's nephew\n- His family's legacy ending\n- Change that undermines tradition\n\n### Story Hooks\n\n| Hook | Description |\n|------|-------------|\n| **The Second Son** | Marcus is being turned by Blackthorne. Can the PCs intervene before it's too late? |\n| **The Chronicles** | Someone wants the secrets in Ravenscar Keep. Theft, intrigue, or legitimate request? |\n| **Honor vs. Necessity** | Godfrey must do something dishonorable to save the Kingdom. Can he? |\n| **The Wedding** | Edmund's marriage to Marian. Something goes wrong. Political crisis ensues. |\n| **Shield Against Shadow** | Godfrey finally moves against Blackthorne. He needs help‚Äîand evidence. |\n\n---",
  "seeAlso": [],
  "rawContent": "# Lord Godfrey Ravenscar\n\n## At a Glance\n> **What anyone in the Kingdom would know**\n\n**Lord Godfrey Ravenscar** - Lord of Ravenmarch, \"The King's Shield\"\n\n- Rules the oldest noble house in the Kingdom from Ravenscar Keep\n- Queen Margarethe's nephew‚Äîmakes him royal family by blood\n- Utterly loyal to the crown, traditional and conservative\n- Known for rigid honor and looking down on \"newer\" families\n- *Common saying: \"A Ravenscar's word is iron‚Äîcold, hard, and unbending.\"*\n\n| | |\n|---|---|\n| **Age** | 45 |\n| **Seat** | Ravenscar Keep |\n| **Region** | Northeast marshlands |\n| **Allegiance** | Crown (absolute) |\n| **Threat Level** | Medium |\n\n---\n\n## Common Knowledge\n> **What nobles, merchants, or acquaintances would know**\n\n### Appearance & Manner\nTall, lean, aristocratic bearing. Sharp green eyes (family trait, shared with Queen Margarethe). Greying dark hair, receding slightly. Clean-shaven, strong jaw. Dresses in conservative dark colors. Carries himself with rigid formality. Follows protocol religiously.\n\n### Personality\nUtterly proper‚Äîtradition matters. Conservative, suspicious of change. Proud of his lineage to the point of arrogance. Looks down on \"newer\" noble families (Ashfeld, Blackthorne). Privately warmer than his public facade suggests, but few see that side.\n\n### Family\n- **Wife:** Lady Cordelia (n√©e Valcourt, 42) - Lord Valcourt's sister. Practical, manages household efficiently.\n- **Heir:** Edmund (22) - Scholarly, dutiful, not the warrior father wanted. Betrothed to Marian Belmont.\n- **Second Son:** Marcus (19) - Natural warrior, serves in Royal Army. Everything Edmund isn't.\n- **Daughter:** Rowena (17) - Quiet, observant, close to Queen Margarethe.\n\n### Domain & Strength\nRules ~15,000 people in the northeast marshlands. Commands 2,500 quality soldiers‚Äînot the largest army but disciplined and reliable. The marshes themselves are natural defenses. Traditional shield between the capital and frontier threats.\n\n### Political Position\nLeader of the Loyalist faction alongside K√∂nigsford. His loyalty to the crown is absolute‚Äînot from love of Aldric personally, but from family honor and tradition. Competes with K√∂nigsford for royal favor.\n\n---\n\n## Secret Knowledge\n> **DM-only information**\n\n### True Nature\nGodfrey is exactly what he appears to be‚Äîhonorable, traditional, loyal. His rigidity isn't a mask; it's who he is. But this makes him predictable and sometimes blind. He can't imagine betrayal from within his own family, which makes Marcus's situation dangerous.\n\n### The Edmund Problem\nGodfrey wanted a warrior heir. He got a scholar. Edmund is intelligent, capable, and kind‚Äînone of which Godfrey values properly. His obvious disappointment has created a rift. Edmund tries desperately to please; Godfrey barely notices.\n\n### The Marcus Danger\nThe second son is what Godfrey wanted Edmund to be‚Äîbold, martial, confident. This creates terrible family dynamics:\n- Marcus secretly believes he'd be a better heir\n- Edmund knows their father prefers Marcus\n- **Lord Blackthorne's agents are recruiting Marcus**\n- Godfrey doesn't know (or won't see it)\n\nIf Marcus is turned, he could betray the entire Loyalist faction.\n\n### The Chronicle Room\nRavenscar Keep contains records going back centuries. Hidden among them:\n- Evidence of Graustein legitimacy questions (three generations back)\n- Documentation of Blackthorne atrocities\n- Old debts and broken promises\n- Godfrey hasn't used these‚Äîconsiders it beneath his honor\n- Someone less honorable could weaponize them\n\n### Hidden Concerns\n- Worried about Edmund's betrothal to Marian Belmont (she's too clever)\n- Suspects Blackthorne is dangerous but can't prove anything\n- Fears Prince Roderick's aggression will destabilize everything\n- Queen Margarethe asks him for things he doesn't fully understand\n\n### What He Wants\n- The Kingdom stable and orderly\n- His family's prestige maintained\n- Edmund to somehow become worthy\n- Traditional values preserved\n\n### What He Fears\n- Civil war\n- Being seen as \"just\" the Queen's nephew\n- His family's legacy ending\n- Change that undermines tradition\n\n### Story Hooks\n\n| Hook | Description |\n|------|-------------|\n| **The Second Son** | Marcus is being turned by Blackthorne. Can the PCs intervene before it's too late? |\n| **The Chronicles** | Someone wants the secrets in Ravenscar Keep. Theft, intrigue, or legitimate request? |\n| **Honor vs. Necessity** | Godfrey must do something dishonorable to save the Kingdom. Can he? |\n| **The Wedding** | Edmund's marriage to Marian. Something goes wrong. Political crisis ensues. |\n| **Shield Against Shadow** | Godfrey finally moves against Blackthorne. He needs help‚Äîand evidence. |\n\n---\n\n## Connections Map\n\n```mermaid\nflowchart TD\n    subgraph Ravenscar[\"ü¶Ö House Ravenscar\"]\n        Godfrey[\"<b>Lord Godfrey</b><br/>The King's Shield\"]\n        Cordelia[\"Lady Cordelia<br/>n√©e Valcourt\"]\n        Edmund_R[\"Edmund (heir)<br/>The Dutiful Son\"]\n        Marcus[\"Marcus<br/>‚ö†Ô∏è The Sword\"]\n        Rowena[\"Rowena<br/>The Little Raven\"]\n    end\n    \n    Godfrey ---|\"married\"| Cordelia\n    Godfrey -->|\"disappointed in\"| Edmund_R\n    Godfrey -->|\"proud of\"| Marcus\n    \n    Edmund_R -->|\"betrothed\"| Marian[\"Marian Belmont\"]\n    Cordelia -.->|\"sister\"| Valcourt[\"Lord Valcourt\"]\n    Rowena -->|\"close to\"| Margarethe[\"Queen Margarethe\"]\n    \n    Marcus -.->|\"being recruited\"| Blackthorne[\"Lord Blackthorne<br/>‚ö†Ô∏è DANGER\"]\n    \n    Godfrey -->|\"loyal to\"| Crown[\"Crown\"]\n    Godfrey <-->|\"rivals\"| Konigsford[\"Lord K√∂nigsford\"]\n    \n    style Godfrey fill:#cfe2f3,color:#000\n    style Marcus fill:#f4cccc,color:#000\n    style Blackthorne fill:#d5a6bd,color:#000\n```\n\n---\n\n## Notes\n- Reliable ally for crown-aligned parties\n- His rigidity can be obstacle or asset\n- Marcus situation is ticking time bomb\n- The Chronicle Room is a plot device waiting to happen\n",
  "sourcePath": "06-NPCs/Aloria/Lord Godfrey Ravenscar.md",
  "slug": "lord-godfrey-ravenscar",
  "category": "npcs"
}