{
  "title": "Lord Caelindor Aeravel",
  "metadata": {
    "Age": "550 years",
    "Race": "High Elf, Male",
    "Role": "Great House Lord, Military Patriarch",
    "Aligned Pillar": "Iron Tower (Wardens of the Realm)",
    "Location": "Aeravel Estate, Inner City"
  },
  "epigraph": "Aeravel has served in every war. We will serve in the next.",
  "atAGlance": "House Aeravel has provided warriors to the Empire for 1,200 years. Lord Caelindor continues this tradition—his house has more active military officers than any other noble family. He represents the old warrior aristocracy: honor, duty, sacrifice for the Empire.\n\n---",
  "commonKnowledge": "- Three sons currently serve as military officers\n- Personally fought in the last major border conflict (200 years ago)\n- Close ally of High Warden Caerwyn—houses have been aligned for 800 years\n- Has proposed reinstating conscription for noble houses (rejected)\n\n---\n\nFormal, traditional, honor-bound. Judges others by their service and sacrifice. Treats warriors with respect regardless of birth; treats cowards with contempt regardless of status. Considers military service the highest calling. Old-fashioned but genuinely believes in what he represents.\n\n---",
  "secretKnowledge": "His youngest son died in a minor skirmish 50 years ago—a death that could have been prevented with better intelligence. He blames Velindor Shadowmere for prioritizing other operations. He's never confronted this, but the resentment festers.\n\n---",
  "seeAlso": [],
  "rawContent": "# Lord Caelindor Aeravel\n\n**Head of House Aeravel** | Iron Quadrant (Military Nobility)\n\n> *\"Aeravel has served in every war. We will serve in the next.\"*\n\n| | |\n|---|---|\n| **Age** | 550 years |\n| **Race** | High Elf, Male |\n| **Role** | Great House Lord, Military Patriarch |\n| **Aligned Pillar** | Iron Tower (Wardens of the Realm) |\n| **Location** | Aeravel Estate, Inner City |\n\n---\n\n## Overview\n\nHouse Aeravel has provided warriors to the Empire for 1,200 years. Lord Caelindor continues this tradition—his house has more active military officers than any other noble family. He represents the old warrior aristocracy: honor, duty, sacrifice for the Empire.\n\n---\n\n## Personality & Approach\n\nFormal, traditional, honor-bound. Judges others by their service and sacrifice. Treats warriors with respect regardless of birth; treats cowards with contempt regardless of status. Considers military service the highest calling. Old-fashioned but genuinely believes in what he represents.\n\n---\n\n## Key Facts\n\n- Three sons currently serve as military officers\n- Personally fought in the last major border conflict (200 years ago)\n- Close ally of High Warden Caerwyn—houses have been aligned for 800 years\n- Has proposed reinstating conscription for noble houses (rejected)\n\n---\n\n## Secret (DM Only)\n\nHis youngest son died in a minor skirmish 50 years ago—a death that could have been prevented with better intelligence. He blames Velindor Shadowmere for prioritizing other operations. He's never confronted this, but the resentment festers.\n\n---\n\n## Connections\n\n- **Caerwyn**: Political ally - Houses aligned for centuries\n- **Seraphel Dawnblade**: Respect - Traditional military bonds\n- **House Thelindor**: Rivalry - Legal family, different values\n",
  "sourcePath": "06-NPCs/Thelassian/Lord Caelindor Aeravel.md",
  "slug": "lord-caelindor-aeravel",
  "category": "npcs"
}