{
  "title": "Lord Ludwig von Graustein",
  "metadata": {
    "Age": "61",
    "Seat": "Graustein Castle",
    "Region": "Eastern highlands",
    "Allegiance": "The past",
    "Threat Level": "Low (but succession is dangerous)"
  },
  "atAGlance": "**Lord Ludwig von Graustein** - Lord of the Grey Stone, \"The Stone Lord\"\n\n- Ancient family in terminal decline, clinging to a crumbling domain\n- Stubborn old man who refuses to accept his house is dying\n- Sons fighting over who will inherit the ruins\n- Drowning in debt to Lord Belmont\n- *Common saying: \"Graustein endures like stoneâ€”cold, cracking, and soon to crumble.\"*\n\n| | |\n|---|---|\n| **Age** | 61 |\n| **Seat** | Graustein Castle |\n| **Region** | Eastern highlands |\n| **Allegiance** | The past |\n| **Threat Level** | Low (but succession is dangerous) |\n\n---",
  "commonKnowledge": "### Appearance & Manner\nAged, shrinking, still tries to stand tall. White hair, rheumy grey eyes. Trembling hands he tries to hide. Dresses in outdated finery. Looks like a man fighting time and losing. Speaks of past glories that fewer remember each year.\n\n### Personality\nStubborn to the point of self-destruction. Refuses to accept family's decline. Lives in the past. Cruel to his sons (blames them for everything). Proud beyond reason. Will die before admitting failure.\n\n### Family\n- **Wife:** Lady Margrit (deceased 10 years) - Her death accelerated the decline.\n- **Heir:** Aldric (38) - Believes he's owed the lordship. Bitter, scheming, would sell the domain to fund his lifestyle.\n- **Second Son:** Berthold (35) - Actually competent. Works in the mines himself. Father dismisses him.\n- **Sisters:** Vivienne (52, married to Lord Belmont), Helene (47, married to Lord Rotfels).\n\n### Domain & Decline\nRules ~8,000 people (emigrating to better domains). Eastern highlands with exhausted silver mines. Commands 1,000 poorly equipped, demoralized soldiers. Owes Belmont enormous debt. Domain is visibly collapsing.\n\n### Political Position\nToo weak to matter, too proud to ask for help. Other Lords watch the succession with interestâ€”or predatory intent. King prefers stability but won't intervene.\n\n---",
  "secretKnowledge": "### True Nature\nLudwig is exactly the stubborn, proud, failing patriarch he appears. There's no hidden depthâ€”just a man who inherited a weakened house, made poor decisions that accelerated the fall, and now refuses to admit the truth. His cruelty to his sons comes from displaced self-hatred.\n\n### The Real Numbers\n- **Debt to Belmont:** 20,000 gold (crushing, unpayable)\n- **Population:** Declining yearly as people flee\n- **Mines:** Silver nearly exhausted, some iron remains\n- **Military:** Would struggle against any serious threat\n- Charles Belmont effectively owns Graustein already\n\n### The Empty Vaults\nFamily treasures have been sold over decades:\n- The famous \"Graustein Jewels\" are paste copies\n- Artwork replaced with reproductions\n- Only Ludwig knows the full extent\n- He refuses to admit it even to himself\n\n### The Succession Crisis\nTwo sons, both with claims, both with plans:\n\n**Aldric (Heir):**\n- Corrupt, incompetent, in personal debt\n- Has promised Blackthorne the eastern passes in exchange for support\n- Would strip the domain to pay his debts\n- Might accelerate father's death\n\n**Berthold (Second Son):**\n- Actually competent, works the mines\n- Has found a new silver vein (secret)\n- Could save the domain if he inherited\n- Legally cannot inherit over living elder brother\n\n### The Blackthorne Deal\nAldric has promised Edmund Blackthorne:\n- Alliance and support when Aldric becomes Lord\n- Control of the strategic eastern passes\n- Would functionally surrender the domain\n\nBerthold suspects but can't prove. This deal could shift Kingdom power balance.\n\n### The Last Vein\nBerthold has found a new silver deposit:\n- Hasn't told father or brother\n- Could save the domain if properly exploited\n- Waiting for the right moment\n- If Aldric learns, he'll sell the information to Blackthorne\n\n### Vivienne's Intelligence\nLudwig's sister at Belmont sends information:\n- Warns about Aldric's schemes\n- Also feeds Belmont intelligence about Graustein\n- Conflicted loyalties\n- Charles Belmont knows everything about Graustein's situation\n\n### What Ludwig Wants\n- To die before seeing final collapse\n- Family glory restored (impossible)\n- One son to prove worthy\n- His name remembered with honor\n\n### What He Fears\n- Living to see Graustein fall\n- The final humiliation\n- Admitting his failures\n- His sons destroying each other\n\n### Story Hooks\n\n| Hook | Description |\n|------|-------------|\n| **The Succession** | Ludwig dies. Aldric and Berthold both claim lordship. Civil war within the domain. |\n| **The Silver Vein** | Berthold's secret is discovered. Everyone wants control. |\n| **The Blackthorne Deal** | Evidence of Aldric's treason surfaces. Expose it or exploit it? |\n| **The Mercy Kill** | Someone offers to \"help\" Ludwig pass peacefully. Murder or mercy? |\n| **The Debt Auction** | Belmont calls the loans. Graustein lands go on the block. |\n\n---",
  "seeAlso": [],
  "rawContent": "# Lord Ludwig von Graustein\n\n## At a Glance\n> **What anyone in the Kingdom would know**\n\n**Lord Ludwig von Graustein** - Lord of the Grey Stone, \"The Stone Lord\"\n\n- Ancient family in terminal decline, clinging to a crumbling domain\n- Stubborn old man who refuses to accept his house is dying\n- Sons fighting over who will inherit the ruins\n- Drowning in debt to Lord Belmont\n- *Common saying: \"Graustein endures like stoneâ€”cold, cracking, and soon to crumble.\"*\n\n| | |\n|---|---|\n| **Age** | 61 |\n| **Seat** | Graustein Castle |\n| **Region** | Eastern highlands |\n| **Allegiance** | The past |\n| **Threat Level** | Low (but succession is dangerous) |\n\n---\n\n## Common Knowledge\n> **What nobles, merchants, or acquaintances would know**\n\n### Appearance & Manner\nAged, shrinking, still tries to stand tall. White hair, rheumy grey eyes. Trembling hands he tries to hide. Dresses in outdated finery. Looks like a man fighting time and losing. Speaks of past glories that fewer remember each year.\n\n### Personality\nStubborn to the point of self-destruction. Refuses to accept family's decline. Lives in the past. Cruel to his sons (blames them for everything). Proud beyond reason. Will die before admitting failure.\n\n### Family\n- **Wife:** Lady Margrit (deceased 10 years) - Her death accelerated the decline.\n- **Heir:** Aldric (38) - Believes he's owed the lordship. Bitter, scheming, would sell the domain to fund his lifestyle.\n- **Second Son:** Berthold (35) - Actually competent. Works in the mines himself. Father dismisses him.\n- **Sisters:** Vivienne (52, married to Lord Belmont), Helene (47, married to Lord Rotfels).\n\n### Domain & Decline\nRules ~8,000 people (emigrating to better domains). Eastern highlands with exhausted silver mines. Commands 1,000 poorly equipped, demoralized soldiers. Owes Belmont enormous debt. Domain is visibly collapsing.\n\n### Political Position\nToo weak to matter, too proud to ask for help. Other Lords watch the succession with interestâ€”or predatory intent. King prefers stability but won't intervene.\n\n---\n\n## Secret Knowledge\n> **DM-only information**\n\n### True Nature\nLudwig is exactly the stubborn, proud, failing patriarch he appears. There's no hidden depthâ€”just a man who inherited a weakened house, made poor decisions that accelerated the fall, and now refuses to admit the truth. His cruelty to his sons comes from displaced self-hatred.\n\n### The Real Numbers\n- **Debt to Belmont:** 20,000 gold (crushing, unpayable)\n- **Population:** Declining yearly as people flee\n- **Mines:** Silver nearly exhausted, some iron remains\n- **Military:** Would struggle against any serious threat\n- Charles Belmont effectively owns Graustein already\n\n### The Empty Vaults\nFamily treasures have been sold over decades:\n- The famous \"Graustein Jewels\" are paste copies\n- Artwork replaced with reproductions\n- Only Ludwig knows the full extent\n- He refuses to admit it even to himself\n\n### The Succession Crisis\nTwo sons, both with claims, both with plans:\n\n**Aldric (Heir):**\n- Corrupt, incompetent, in personal debt\n- Has promised Blackthorne the eastern passes in exchange for support\n- Would strip the domain to pay his debts\n- Might accelerate father's death\n\n**Berthold (Second Son):**\n- Actually competent, works the mines\n- Has found a new silver vein (secret)\n- Could save the domain if he inherited\n- Legally cannot inherit over living elder brother\n\n### The Blackthorne Deal\nAldric has promised Edmund Blackthorne:\n- Alliance and support when Aldric becomes Lord\n- Control of the strategic eastern passes\n- Would functionally surrender the domain\n\nBerthold suspects but can't prove. This deal could shift Kingdom power balance.\n\n### The Last Vein\nBerthold has found a new silver deposit:\n- Hasn't told father or brother\n- Could save the domain if properly exploited\n- Waiting for the right moment\n- If Aldric learns, he'll sell the information to Blackthorne\n\n### Vivienne's Intelligence\nLudwig's sister at Belmont sends information:\n- Warns about Aldric's schemes\n- Also feeds Belmont intelligence about Graustein\n- Conflicted loyalties\n- Charles Belmont knows everything about Graustein's situation\n\n### What Ludwig Wants\n- To die before seeing final collapse\n- Family glory restored (impossible)\n- One son to prove worthy\n- His name remembered with honor\n\n### What He Fears\n- Living to see Graustein fall\n- The final humiliation\n- Admitting his failures\n- His sons destroying each other\n\n### Story Hooks\n\n| Hook | Description |\n|------|-------------|\n| **The Succession** | Ludwig dies. Aldric and Berthold both claim lordship. Civil war within the domain. |\n| **The Silver Vein** | Berthold's secret is discovered. Everyone wants control. |\n| **The Blackthorne Deal** | Evidence of Aldric's treason surfaces. Expose it or exploit it? |\n| **The Mercy Kill** | Someone offers to \"help\" Ludwig pass peacefully. Murder or mercy? |\n| **The Debt Auction** | Belmont calls the loans. Graustein lands go on the block. |\n\n---\n\n## Connections Map\n\n```mermaid\nflowchart TD\n    subgraph Graustein[\"ðŸ—¿ House Graustein - DECLINING\"]\n        Ludwig[\"<b>Lord Ludwig</b><br/>The Stone Lord<br/>Age 61\"]\n        Aldric_G[\"Aldric (heir)<br/>ðŸ”´ The Pretender\"]\n        Berthold[\"Berthold<br/>âœ“ The Miner\"]\n    end\n    \n    Ludwig -->|\"will inherit\"| Aldric_G\n    Ludwig -->|\"dismisses\"| Berthold\n    Aldric_G <-->|\"CONFLICT\"| Berthold\n    \n    Aldric_G -->|\"promised alliance\"| Blackthorne[\"Lord Blackthorne<br/>âš ï¸ Predator\"]\n    Ludwig -->|\"owes 20,000 gold\"| Belmont[\"Lord Belmont<br/>Creditor\"]\n    \n    Vivienne[\"Vivienne<br/>â†’ Lord Belmont\"] -.->|\"sister, spy\"| Ludwig\n    Helene_G[\"Helene<br/>â†’ Lord Rotfels\"] -.->|\"sister\"| Ludwig\n    \n    Berthold -.->|\"secret\"| Silver[\"New Silver Vein\"]\n    \n    style Ludwig fill:#d9d9d9,color:#000\n    style Aldric_G fill:#f4cccc,color:#000\n    style Berthold fill:#d9ead3,color:#000\n    style Blackthorne fill:#d5a6bd,color:#000\n```\n\n---\n\n## Notes\n- Tragedy in motionâ€”ancient house dying\n- Succession will reshape eastern Kingdom\n- Berthold is sympathetic underdog\n- Aldric-Blackthorne deal is major threat\n- The silver vein is hope (if Berthold survives)\n",
  "sourcePath": "06-NPCs/Aloria/Lord Ludwig von Graustein.md",
  "slug": "lord-ludwig-von-graustein",
  "category": "npcs"
}