{
  "title": "Lord Bertrand de Valcourt",
  "metadata": {
    "Age": "48",
    "Seat": "Valcourt Castle",
    "Region": "Southern river valleys",
    "Allegiance": "Profit",
    "Threat Level": "Low"
  },
  "atAGlance": "**Lord Bertrand de Valcourt** - Lord of the River Keep, \"The Toll Lord\"\n\n- Controls the major river crossings in the southern Kingdom\n- Merchants who became noblesâ€”still thinks like a merchant\n- Everything is a transaction; honor is profitable when it's profitable\n- Wealthy from river tolls, cares about gold more than glory\n- *Common saying: \"Valcourt will trade with anyoneâ€”including his grandmother.\"*\n\n| | |\n|---|---|\n| **Age** | 48 |\n| **Seat** | Valcourt Castle |\n| **Region** | Southern river valleys |\n| **Allegiance** | Profit |\n| **Threat Level** | Low |\n\n---",
  "commonKnowledge": "### Appearance & Manner\nStocky, prosperous build. Thinning brown hair, neat beard. Calculating blue eyes. Dresses expensivelyâ€”quality signals wealth. Ink-stained fingers from handling his own accounts. Comfortable rather than imposing. Speaks in terms of value, cost, and investment.\n\n### Personality\nBusiness-minded above all. Sees everything as transaction. Pragmatic, not ideological. Values predictability and contracts. Will work with anyone profitable. Not driven by ego, which makes him reliable in his own way.\n\n### Family\n- **Wife:** Lady Isabeau (nÃ©e Rotfels, 45) - Lord Rotfels's sister. Homesick for the coast, quietly miserable.\n- **Heir:** Reynard (24) - Lazy wastrel, spends money freely, no head for business. Father's despair.\n- **Second Son:** Gaston (21) - Financial genius, utterly uncharismatic. Should inherit but won't.\n- **Sister:** Cordelia (42) - Married to Lord Godfrey Ravenscar, connecting trade and tradition.\n- **Daughter:** Margaux (18) - Playing the marriage market carefully.\n\n### Domain & Wealth\nRules ~16,000 people in the river valleys. Controls major river crossingsâ€”everyone pays tolls. Runs banking services (smaller than Belmont). Commands 1,200 adequate soldiers and 100 river patrol boats.\n\n### Political Position\nTrade partner with Belmont. Connected to Ravenscar through sister Cordelia, and to Thornwood through Lady Marian (Alaric's wife is Bertrand's sister). Stays out of political conflictsâ€”bad for business.\n\n---",
  "secretKnowledge": "### True Nature\nBertrand is exactly the pragmatic merchant he appears. He has no ideological commitments, no deep loyalties beyond family, and would deal with anyone if profitable. This makes him predictableâ€”and in Kingdom politics, predictability has value.\n\n### The Succession Crisis\nBertrand faces a terrible problem:\n- **Reynard** will inherit and destroy everything through incompetence\n- **Gaston** should inheritâ€”financial genius, perfect for the role\n- Disinheriting Reynard would cause scandal\n- But Reynard inheriting means ruin\n\nBertrand is quietly considering options. \"Options\" might include arranging for Reynard to have an accident. Nothing decided yet.\n\n### Smuggling Knowledge\nValcourt knows about every smuggling operation on his rivers:\n- Takes a cut to look away\n- Officially ignorant\n- Includes goods to/from Veraheim\n- Could be exposed, but won'tâ€”everyone benefits\n\n### Isabeau's Divided Loyalty\nHis wife passes information to her Rotfels family:\n- Not disloyalâ€”just maintaining options\n- Bertrand doesn't know (or pretends not to)\n- Could be exploited by coastal interests\n\n### The Belmont Relationship\nValcourt is junior partner to Belmont in Kingdom finance:\n- Complementary rather than competitive\n- Belmont handles Lords; Valcourt handles merchants\n- Information sharing between houses\n- Profitable but unequal\n\n### What He Wants\n- Wealth, always more wealth\n- Stability for business\n- Good marriages for children\n- Gaston to inherit (somehow)\n\n### What He Fears\n- Trade disruption\n- War (bad for business)\n- Reynard inheriting\n- Being caught between greater powers\n\n### Story Hooks\n\n| Hook | Description |\n|------|-------------|\n| **The Smuggler's Toll** | Evidence of smuggling surfaces. Valcourt involvement suspected. Cover-up or exposure? |\n| **River Pirates** | Someone is raiding Valcourt shipping with suspiciously good information. |\n| **The Heir's Debt** | Reynard owes money to dangerous people. Does Bertrand pay or let him suffer? |\n| **Succession Crisis** | Bertrand makes his move against Reynard. Which brother do PCs support? |\n| **The Toll War** | Another Lord tries to bypass Valcourt's rivers. Economic conflict ensues. |\n\n---",
  "seeAlso": [],
  "rawContent": "# Lord Bertrand de Valcourt\n\n## At a Glance\n> **What anyone in the Kingdom would know**\n\n**Lord Bertrand de Valcourt** - Lord of the River Keep, \"The Toll Lord\"\n\n- Controls the major river crossings in the southern Kingdom\n- Merchants who became noblesâ€”still thinks like a merchant\n- Everything is a transaction; honor is profitable when it's profitable\n- Wealthy from river tolls, cares about gold more than glory\n- *Common saying: \"Valcourt will trade with anyoneâ€”including his grandmother.\"*\n\n| | |\n|---|---|\n| **Age** | 48 |\n| **Seat** | Valcourt Castle |\n| **Region** | Southern river valleys |\n| **Allegiance** | Profit |\n| **Threat Level** | Low |\n\n---\n\n## Common Knowledge\n> **What nobles, merchants, or acquaintances would know**\n\n### Appearance & Manner\nStocky, prosperous build. Thinning brown hair, neat beard. Calculating blue eyes. Dresses expensivelyâ€”quality signals wealth. Ink-stained fingers from handling his own accounts. Comfortable rather than imposing. Speaks in terms of value, cost, and investment.\n\n### Personality\nBusiness-minded above all. Sees everything as transaction. Pragmatic, not ideological. Values predictability and contracts. Will work with anyone profitable. Not driven by ego, which makes him reliable in his own way.\n\n### Family\n- **Wife:** Lady Isabeau (nÃ©e Rotfels, 45) - Lord Rotfels's sister. Homesick for the coast, quietly miserable.\n- **Heir:** Reynard (24) - Lazy wastrel, spends money freely, no head for business. Father's despair.\n- **Second Son:** Gaston (21) - Financial genius, utterly uncharismatic. Should inherit but won't.\n- **Sister:** Cordelia (42) - Married to Lord Godfrey Ravenscar, connecting trade and tradition.\n- **Daughter:** Margaux (18) - Playing the marriage market carefully.\n\n### Domain & Wealth\nRules ~16,000 people in the river valleys. Controls major river crossingsâ€”everyone pays tolls. Runs banking services (smaller than Belmont). Commands 1,200 adequate soldiers and 100 river patrol boats.\n\n### Political Position\nTrade partner with Belmont. Connected to Ravenscar through sister Cordelia, and to Thornwood through Lady Marian (Alaric's wife is Bertrand's sister). Stays out of political conflictsâ€”bad for business.\n\n---\n\n## Secret Knowledge\n> **DM-only information**\n\n### True Nature\nBertrand is exactly the pragmatic merchant he appears. He has no ideological commitments, no deep loyalties beyond family, and would deal with anyone if profitable. This makes him predictableâ€”and in Kingdom politics, predictability has value.\n\n### The Succession Crisis\nBertrand faces a terrible problem:\n- **Reynard** will inherit and destroy everything through incompetence\n- **Gaston** should inheritâ€”financial genius, perfect for the role\n- Disinheriting Reynard would cause scandal\n- But Reynard inheriting means ruin\n\nBertrand is quietly considering options. \"Options\" might include arranging for Reynard to have an accident. Nothing decided yet.\n\n### Smuggling Knowledge\nValcourt knows about every smuggling operation on his rivers:\n- Takes a cut to look away\n- Officially ignorant\n- Includes goods to/from Veraheim\n- Could be exposed, but won'tâ€”everyone benefits\n\n### Isabeau's Divided Loyalty\nHis wife passes information to her Rotfels family:\n- Not disloyalâ€”just maintaining options\n- Bertrand doesn't know (or pretends not to)\n- Could be exploited by coastal interests\n\n### The Belmont Relationship\nValcourt is junior partner to Belmont in Kingdom finance:\n- Complementary rather than competitive\n- Belmont handles Lords; Valcourt handles merchants\n- Information sharing between houses\n- Profitable but unequal\n\n### What He Wants\n- Wealth, always more wealth\n- Stability for business\n- Good marriages for children\n- Gaston to inherit (somehow)\n\n### What He Fears\n- Trade disruption\n- War (bad for business)\n- Reynard inheriting\n- Being caught between greater powers\n\n### Story Hooks\n\n| Hook | Description |\n|------|-------------|\n| **The Smuggler's Toll** | Evidence of smuggling surfaces. Valcourt involvement suspected. Cover-up or exposure? |\n| **River Pirates** | Someone is raiding Valcourt shipping with suspiciously good information. |\n| **The Heir's Debt** | Reynard owes money to dangerous people. Does Bertrand pay or let him suffer? |\n| **Succession Crisis** | Bertrand makes his move against Reynard. Which brother do PCs support? |\n| **The Toll War** | Another Lord tries to bypass Valcourt's rivers. Economic conflict ensues. |\n\n---\n\n## Connections Map\n\n```mermaid\nflowchart TD\n    subgraph Valcourt[\"ðŸŒŠ House Valcourt\"]\n        Bertrand[\"<b>Lord Bertrand</b><br/>The Toll Lord\"]\n        Isabeau[\"Lady Isabeau<br/>nÃ©e Rotfels\"]\n        Reynard[\"Reynard (heir)<br/>ðŸ”´ The Wastrel\"]\n        Gaston[\"Gaston<br/>âœ“ The Numbers\"]\n        Margaux[\"Margaux<br/>The Pretty One\"]\n    end\n    \n    Bertrand ---|\"tolerates\"| Isabeau\n    Bertrand -->|\"despairs of\"| Reynard\n    Bertrand -->|\"values\"| Gaston\n    \n    Isabeau -.->|\"reports to\"| Rotfels[\"Lord Rotfels\"]\n    \n    Cordelia[\"Cordelia<br/>â†’ Lord Ravenscar\"] -.->|\"sister\"| Bertrand\n    Marian[\"Marian<br/>â†’ Lord Thornwood\"] -.->|\"sister\"| Bertrand\n    \n    Bertrand -->|\"junior partner\"| Belmont[\"Lord Belmont\"]\n    Bertrand -->|\"controls\"| Rivers[\"River Trade\"]\n    \n    style Bertrand fill:#d9ead3,color:#000\n    style Reynard fill:#f4cccc,color:#000\n    style Gaston fill:#d9ead3,color:#000\n```\n\n---\n\n## Notes\n- Reliable for transactional relationships\n- Succession crisis mirrors Belmont situation\n- River control is strategic asset\n- Pragmatic enough to work with anyone\n",
  "sourcePath": "06-NPCs/Aloria/Lord Bertrand de Valcourt.md",
  "slug": "lord-bertrand-de-valcourt",
  "category": "npcs"
}