{
  "title": "Orinvel Starwhisper",
  "metadata": {
    "Age": "380 years",
    "Race": "High Elf, Male",
    "Role": "Deputy Diplomat, Isileth's Second",
    "Reports To": "Starwarden Isileth",
    "Location": "Twilight Tower, Diplomatic Chambers"
  },
  "epigraph": "Diplomacy is the art of letting others believe they won.",
  "atAGlance": "Orinvel Starwhisper handles the day-to-day diplomatic communications that don't require the Starwarden's personal attention. He's negotiated trade agreements, resolved border disputes, and smoothed over countless incidents between the Empire and other nations. Less mystical than Isileth, more practical.\n\n---",
  "commonKnowledge": "- Speaks seven languages fluently\n- Has visited every major Aloria city\n- Negotiated the current Veraheim tunnel toll rates\n- One of few elves to have met Vera Wyrdweaver (diplomatically)\n\n---\n\nCharming, multilingual, adaptable. Can shift from elven formality to human directness to dwarven bluntness depending on his audience. Always seeking common ground. Genuinely enjoys meeting new cultures, even \"lesser\" races—though he keeps this enthusiasm private.\n\n---",
  "secretKnowledge": "He respects Veraheim more than he's supposed to. What Vera built shouldn't work—but it does. He's never said this to Isileth, but he suspects she feels similarly.\n\n---",
  "seeAlso": [],
  "rawContent": "# Orinvel Starwhisper\n\n**Dusk Speaker** | Twilight Tower (Twilight Assembly)\n\n> *\"Diplomacy is the art of letting others believe they won.\"*\n\n| | |\n|---|---|\n| **Age** | 380 years |\n| **Race** | High Elf, Male |\n| **Role** | Deputy Diplomat, Isileth's Second |\n| **Reports To** | Starwarden Isileth |\n| **Location** | Twilight Tower, Diplomatic Chambers |\n\n---\n\n## Overview\n\nOrinvel Starwhisper handles the day-to-day diplomatic communications that don't require the Starwarden's personal attention. He's negotiated trade agreements, resolved border disputes, and smoothed over countless incidents between the Empire and other nations. Less mystical than Isileth, more practical.\n\n---\n\n## Personality & Approach\n\nCharming, multilingual, adaptable. Can shift from elven formality to human directness to dwarven bluntness depending on his audience. Always seeking common ground. Genuinely enjoys meeting new cultures, even \"lesser\" races—though he keeps this enthusiasm private.\n\n---\n\n## Key Facts\n\n- Speaks seven languages fluently\n- Has visited every major Aloria city\n- Negotiated the current Veraheim tunnel toll rates\n- One of few elves to have met Vera Wyrdweaver (diplomatically)\n\n---\n\n## Secret (DM Only)\n\nHe respects Veraheim more than he's supposed to. What Vera built shouldn't work—but it does. He's never said this to Isileth, but he suspects she feels similarly.\n\n---\n\n## Connections\n\n- **Isileth**: Superior - Trusted deputy, learning her subtler methods\n- **Caelorin Silvervow**: Colleague - Keeper of Treaties, work closely together\n- **Aloria diplomats**: Professional contacts - Ongoing relationships\n",
  "sourcePath": "06-NPCs/Thelassian/Orinvel Starwhisper.md",
  "slug": "orinvel-starwhisper",
  "category": "npcs"
}