{
  "title": "Silindra Moonshadow",
  "metadata": {
    "Age": "340 years",
    "Race": "High Elf, Female",
    "Role": "Night Watch Commander",
    "Reports To": "Captain Thandril Ironsong",
    "Location": "Crown District (sunset to sunrise)"
  },
  "epigraph": "The sun sees all. The moon sees what hides from the sun.",
  "atAGlance": "Silindra Moonshadow commands the Eternal Guard's night watch—the 40 guards who protect the Crown from dusk to dawn. Night is when assassins prefer to strike, when magic is stronger, when dangers emerge. She has made the darkness her domain.\n\n---",
  "commonKnowledge": "- Has commanded night watch for 180 years\n- Caught two assassins through pure intuition (no warning signs)\n- Trains guards in night-fighting techniques\n- Has not seen sunlight voluntarily in decades\n\n---\n\nCalm, observant, comfortable in shadow. Prefers moonlight to torchlight; claims it shows more truth. Leads night patrols personally despite her rank. Has developed an almost supernatural awareness of movement in darkness. Sleeps during the day, lives at night.\n\n---",
  "secretKnowledge": "She's developing darkvision beyond normal elven ability—a side effect of centuries in darkness. She's not sure if it's magical or physical. She hasn't told anyone because she doesn't want to be studied. It makes her better at her job. That's enough.\n\n---",
  "seeAlso": [],
  "rawContent": "# Silindra Moonshadow\n\n**Night Warden** | Eternal Guard\n\n> *\"The sun sees all. The moon sees what hides from the sun.\"*\n\n| | |\n|---|---|\n| **Age** | 340 years |\n| **Race** | High Elf, Female |\n| **Role** | Night Watch Commander |\n| **Reports To** | Captain Thandril Ironsong |\n| **Location** | Crown District (sunset to sunrise) |\n\n---\n\n## Overview\n\nSilindra Moonshadow commands the Eternal Guard's night watch—the 40 guards who protect the Crown from dusk to dawn. Night is when assassins prefer to strike, when magic is stronger, when dangers emerge. She has made the darkness her domain.\n\n---\n\n## Personality & Approach\n\nCalm, observant, comfortable in shadow. Prefers moonlight to torchlight; claims it shows more truth. Leads night patrols personally despite her rank. Has developed an almost supernatural awareness of movement in darkness. Sleeps during the day, lives at night.\n\n---\n\n## Key Facts\n\n- Has commanded night watch for 180 years\n- Caught two assassins through pure intuition (no warning signs)\n- Trains guards in night-fighting techniques\n- Has not seen sunlight voluntarily in decades\n\n---\n\n## Secret (DM Only)\n\nShe's developing darkvision beyond normal elven ability—a side effect of centuries in darkness. She's not sure if it's magical or physical. She hasn't told anyone because she doesn't want to be studied. It makes her better at her job. That's enough.\n\n---\n\n## Connections\n\n- **Thandril Ironsong**: Commander - Reports at dawn/dusk transitions\n- **Caelorn Sunblade**: Counterpart - Day Warden, professional respect\n- **Velindor Shadowmere**: Professional - Night is when his agents move too\n",
  "sourcePath": "06-NPCs/Thelassian/Silindra Moonshadow.md",
  "slug": "silindra-moonshadow",
  "category": "npcs"
}