{
  "title": "Starwarden Isileth",
  "metadata": {
    "Age": "Ancient (centuries of magical study)",
    "Race": "Elf (Female)",
    "Title": "Starwarden, Voice of Twilight",
    "Role": "Arcane Advisor, Diplomat",
    "Pillar": "Twilight Assembly"
  },
  "atAGlance": "**Isileth** - Starwarden, Leader of the Twilight Assembly\n\n- Chief magical advisor and diplomat of the Thelassian\n- One of the Four Pillar leaders serving Emperor Valandor\n- Keeper of elven culture, arts, and traditions\n- Most likely Pillar leader to handle the \"Veraheim situation\"\n- *Common saying: \"The Starwarden sees what stars reveal. Best not to ask what she's seen.\"*\n\n| | |\n|---|---|\n| **Age** | Ancient (centuries of magical study) |\n| **Race** | Elf (Female) |\n| **Title** | Starwarden, Voice of Twilight |\n| **Role** | Arcane Advisor, Diplomat |\n| **Pillar** | Twilight Assembly |\n\n---",
  "commonKnowledge": "### Appearance & Manner\nAncient elven grace refined across centuries. Carries herself with mystical bearing—every gesture deliberate, meaningful. Speaks with poetic precision. Eyes that seem to see more than the present moment. Favors twilight colors: deep purples, silver, midnight blue.\n\n### Personality (Public)\nThe voice of elven culture and wisdom. Balances tradition with diplomacy. Speaks truth to power through prophecy and counsel. More subtle than military force, more flexible than rigid law. The Empire's connection to magic, stars, and destiny.\n\n### Role & Responsibilities\n- **Arcane matters:** Magical threats, magical education\n- **Diplomacy:** All official contact with other nations\n- **Culture:** Preservation of elven arts, music, traditions\n- **Prophecy:** Mystical guidance and foresight\n- Member of the Circle of Four\n\n### The Veraheim Connection\nMost likely Pillar leader to deal with Veraheim diplomatically:\n- Handles foreign relations\n- Must address the Thaelen situation somehow\n- Vera Wyrdweaver's magic is undeniably significant\n- Cultural implications of a successful multiracial city\n\n### Known Powers\nPowerful sorceress with specialization in:\n- Divination and foresight\n- Ancient elven high magic\n- Star and twilight magic\n- Diplomatic protections\n\n---",
  "secretKnowledge": "### True Nature\n*[Partially undefined for DM customization]*\n\n**The Key Question:** Is she conservative keeper of tradition, or does she secretly long for cultural evolution?\n\n**Archetype Options:**\n\n**Option 1 - The Mystic Seer:** Speaks in prophecy, guides through vision. Has seen things she cannot share. Trapped between knowledge and duty.\n\n**Option 2 - The Political Operator:** Uses culture and diplomacy as weapons. Subtle manipulator. Soft power is still power.\n\n**Option 3 - The True Believer:** Deeply devoted to elven culture as sacred duty. Preservation above all. Change is death.\n\n**Option 4 - The Secret Progressive:** Understands culture must evolve or die. Works for gradual change from within. Veraheim fascinates her.\n\n### Did She Foresee...?\nCritical question with major implications:\n- Did she foresee the Dragon War? Thaelen's defection? Vera's rise?\n- If yes: Did she warn? Was she ignored? Did she try to prevent it?\n- If no: What are the limits of her prophecy?\n- Either answer has story potential.\n\n### The Thaelen Question\nHow does she view the defection?\n- Cultural hero who fell from grace?\n- Romantic tragedy she secretly understands?\n- Stain on elven honor that must be addressed?\n- Did she know him personally? Foresee his path?\n\n### Veraheim Fascination\nShe likely has complex feelings:\n- **Diplomatic nightmare:** But she must deal with it\n- **Cultural challenge:** Non-elves built something that works\n- **Magical interest:** Vera's power is remarkable\n- **Secret admiration?:** Breaking free of rigid tradition?\n\n### What She Wants\n- Elven culture preserved (but what does that mean?)\n- Her prophecies heeded (are they?)\n- Understanding of the future (does she have it?)\n- Perhaps: proof that change doesn't mean destruction\n\n### What She Fears\n- Her visions being wrong\n- Elven culture calcifying into irrelevance\n- Being ignored until it's too late\n- The future she may have glimpsed\n\n### Story Hooks\n\n| Hook | Description |\n|------|-------------|\n| **The Prophecy** | Isileth has foreseen something about the PCs. She reaches out. |\n| **Diplomatic Mission** | She's sent to Veraheim. What are her true instructions? |\n| **Cultural Exchange** | She wants something from outside elven culture. A dangerous request. |\n| **The Vision** | She shares a prophecy about coming events. Is it warning or manipulation? |\n| **The Question** | She asks Thaelen: \"Was it worth it?\" She genuinely wants to know. |\n\n---",
  "seeAlso": [],
  "rawContent": "# Starwarden Isileth\n\n## At a Glance\n> **What anyone in the Thelassian would know**\n\n**Isileth** - Starwarden, Leader of the Twilight Assembly\n\n- Chief magical advisor and diplomat of the Thelassian\n- One of the Four Pillar leaders serving Emperor Valandor\n- Keeper of elven culture, arts, and traditions\n- Most likely Pillar leader to handle the \"Veraheim situation\"\n- *Common saying: \"The Starwarden sees what stars reveal. Best not to ask what she's seen.\"*\n\n| | |\n|---|---|\n| **Age** | Ancient (centuries of magical study) |\n| **Race** | Elf (Female) |\n| **Title** | Starwarden, Voice of Twilight |\n| **Role** | Arcane Advisor, Diplomat |\n| **Pillar** | Twilight Assembly |\n\n---\n\n## Common Knowledge\n> **What elves, diplomats, or mages would know**\n\n### Appearance & Manner\nAncient elven grace refined across centuries. Carries herself with mystical bearing—every gesture deliberate, meaningful. Speaks with poetic precision. Eyes that seem to see more than the present moment. Favors twilight colors: deep purples, silver, midnight blue.\n\n### Personality (Public)\nThe voice of elven culture and wisdom. Balances tradition with diplomacy. Speaks truth to power through prophecy and counsel. More subtle than military force, more flexible than rigid law. The Empire's connection to magic, stars, and destiny.\n\n### Role & Responsibilities\n- **Arcane matters:** Magical threats, magical education\n- **Diplomacy:** All official contact with other nations\n- **Culture:** Preservation of elven arts, music, traditions\n- **Prophecy:** Mystical guidance and foresight\n- Member of the Circle of Four\n\n### The Veraheim Connection\nMost likely Pillar leader to deal with Veraheim diplomatically:\n- Handles foreign relations\n- Must address the Thaelen situation somehow\n- Vera Wyrdweaver's magic is undeniably significant\n- Cultural implications of a successful multiracial city\n\n### Known Powers\nPowerful sorceress with specialization in:\n- Divination and foresight\n- Ancient elven high magic\n- Star and twilight magic\n- Diplomatic protections\n\n---\n\n## Secret Knowledge\n> **DM-only information**\n\n### True Nature\n*[Partially undefined for DM customization]*\n\n**The Key Question:** Is she conservative keeper of tradition, or does she secretly long for cultural evolution?\n\n**Archetype Options:**\n\n**Option 1 - The Mystic Seer:** Speaks in prophecy, guides through vision. Has seen things she cannot share. Trapped between knowledge and duty.\n\n**Option 2 - The Political Operator:** Uses culture and diplomacy as weapons. Subtle manipulator. Soft power is still power.\n\n**Option 3 - The True Believer:** Deeply devoted to elven culture as sacred duty. Preservation above all. Change is death.\n\n**Option 4 - The Secret Progressive:** Understands culture must evolve or die. Works for gradual change from within. Veraheim fascinates her.\n\n### Did She Foresee...?\nCritical question with major implications:\n- Did she foresee the Dragon War? Thaelen's defection? Vera's rise?\n- If yes: Did she warn? Was she ignored? Did she try to prevent it?\n- If no: What are the limits of her prophecy?\n- Either answer has story potential.\n\n### The Thaelen Question\nHow does she view the defection?\n- Cultural hero who fell from grace?\n- Romantic tragedy she secretly understands?\n- Stain on elven honor that must be addressed?\n- Did she know him personally? Foresee his path?\n\n### Veraheim Fascination\nShe likely has complex feelings:\n- **Diplomatic nightmare:** But she must deal with it\n- **Cultural challenge:** Non-elves built something that works\n- **Magical interest:** Vera's power is remarkable\n- **Secret admiration?:** Breaking free of rigid tradition?\n\n### What She Wants\n- Elven culture preserved (but what does that mean?)\n- Her prophecies heeded (are they?)\n- Understanding of the future (does she have it?)\n- Perhaps: proof that change doesn't mean destruction\n\n### What She Fears\n- Her visions being wrong\n- Elven culture calcifying into irrelevance\n- Being ignored until it's too late\n- The future she may have glimpsed\n\n### Story Hooks\n\n| Hook | Description |\n|------|-------------|\n| **The Prophecy** | Isileth has foreseen something about the PCs. She reaches out. |\n| **Diplomatic Mission** | She's sent to Veraheim. What are her true instructions? |\n| **Cultural Exchange** | She wants something from outside elven culture. A dangerous request. |\n| **The Vision** | She shares a prophecy about coming events. Is it warning or manipulation? |\n| **The Question** | She asks Thaelen: \"Was it worth it?\" She genuinely wants to know. |\n\n---\n\n## Connections Map\n\n```mermaid\nflowchart TD\n    subgraph Magic[\"✨ Twilight Assembly\"]\n        Isileth[\"<b>Starwarden Isileth</b><br/>Magic, Diplomacy, Culture\"]\n    end\n    \n    Isileth -->|\"serves\"| Valandor[\"Emperor Valandor\"]\n    Isileth -->|\"diplomacy with\"| Outside[\"Aloria<br/>Veraheim\"]\n    \n    Isileth -.->|\"fascinated by?\"| Vera[\"Vera Wyrdweaver\"]\n    Isileth -.->|\"knew?\"| Thaelen[\"Thaelen Ruincalen\"]\n    \n    subgraph OtherPillars[\"Other Pillars\"]\n        Caerwyn[\"Caerwyn<br/>Military\"]\n        Thaelorin[\"Thaelorin<br/>Law\"]\n        Faendril[\"Faendril<br/>Admin\"]\n    end\n    \n    Isileth --- OtherPillars\n    \n    subgraph Powers[\"Her Domain\"]\n        Magic_P[\"Arcane Matters\"]\n        Prophecy[\"Prophecy\"]\n        Culture[\"Culture & Arts\"]\n        Diplomacy[\"Diplomacy\"]\n    end\n    \n    Isileth --- Powers\n    \n    style Isileth fill:#d9d2e9,color:#000\n    style Vera fill:#d9ead3,color:#000\n```\n\n---\n\n## Notes\n- Soft power personified—subtler than military, more flexible than law\n- Natural contact for diplomatic plots\n- Her prophecies can drive or complicate plots\n- Most likely Pillar to see value in change\n- Could be ally, obstacle, or information source\n- Her view on Veraheim shapes elven cultural response\n",
  "sourcePath": "06-NPCs/Thelassian/Isileth.md",
  "slug": "starwarden-isileth",
  "category": "npcs"
}