{
  "title": "Thaelen Ruincalen",
  "metadata": {
    "Age": "400+ years",
    "Race": "High Elf",
    "Role": "Co-Ruler, Supreme Commander",
    "Partner": "Vera Wyrdweaver",
    "Dragon": "Thorongil (400-year bond)"
  },
  "atAGlance": "**Thaelen Ruincalen** - Co-Ruler of Veraheim, \"The Last Dragon Rider,\" \"The Dragon Knight\"\n\n- Elven warrior who co-founded Veraheim 80 years ago with Vera Wyrdweaver\n- The only living dragon rider with an intact bond‚Äîrides Thorongil\n- Was sent by the Thelassian to kill Vera; fell in love with her instead\n- Commands Veraheim's 300-guard force with legendary precision\n- *Common saying: \"The Lady holds the mountain. The Commander holds the line.\"*\n\n| | |\n|---|---|\n| **Age** | 400+ years |\n| **Race** | High Elf |\n| **Role** | Co-Ruler, Supreme Commander |\n| **Partner** | Vera Wyrdweaver |\n| **Dragon** | Thorongil (400-year bond) |\n\n---",
  "commonKnowledge": "### Appearance & Manner\nAppears middle-aged for an elf (equivalent to human 40s). 400 years of war and exile show in his bearing. Moves with a warrior's grace‚Äîevery motion precise, economical. Calm authority that doesn't need to shout. Eyes that have seen too much. Veterans recognize another veteran immediately.\n\n### Personality\nStoic, controlled, professional. Emotions carefully managed. Leads by example, not speeches. Economy of words‚Äîsays what needs saying, nothing more. Respectful to all unless they prove unworthy. The guards would follow him anywhere.\n\n### Family & Relationships\n- **Partner:** Vera Wyrdweaver - Their love story is legendary. Still deeply devoted after 80 years.\n- **Dragon:** Thorongil - 400-year telepathic bond. They don't need words.\n- **No children:** Veraheim is their legacy.\n\n### Known Capabilities\nFamous as the deadliest archer alive‚Äîcan hit targets from dragonback at impossible distances. Fought in the Dragon War 400 years ago. The dragon-rider combination makes him and Thorongil virtually unstoppable.\n\n### Public Role\n- Supreme Commander of Veraheim's 300 guards\n- Trains with guards regularly (3x per week minimum)\n- Oversees all major city projects\n- Handles security, logistics, and military matters\n- The \"practical hand\" to Vera's \"magical vision\"\n\n### His Leadership Style\nFair but demanding. Personally evaluates every recruit. Guards say: \"Would follow him anywhere,\" \"Doesn't waste words,\" \"Makes you want to be better.\" He earns loyalty, never demands it.\n\n---",
  "secretKnowledge": "### True Nature\nThaelen is a stoic professional carrying 400 years of regret. He was sent to kill Vera and almost did it‚Äîfollowing orders without question. That narrow-mindedness haunts him. He chose love over duty and lost everything: his people, his position, his homeland. He'd make the same choice again, but wishes he'd been worthy of it from the start.\n\n### The Dragon War Trauma\nWhat he survived 400 years ago:\n- 35 days fighting his own dragon's kin\n- Watched most dragon-elf bonds break or end in death\n- Beat dragons into retreat without killing them (but others died)\n- Thorongil considered traitor by dragonkind\n- Only survivor with intact bond\n\n**The Guilt:**\n- Survivor's guilt for 400 years\n- Why did his bond survive when others broke?\n- \"I was the lucky one. That doesn't feel like luck.\"\n\n### The Mission He Regrets\nThe Thelassian sent him to eliminate Vera:\n- He went intending to kill her\n- Didn't question orders (soldier's obedience)\n- Assumed guilt without evidence\n- Elven prejudice: \"humans are lesser\"\n- Almost murdered the love of his life\n\n**What Changed Him:**\n- Now questions orders\n- Judges by actions, not race\n- Values independent thought\n- \"Never again will I follow blindly\"\n\n### The Secret Weapon\n**Most people don't know:** He's equally deadly with a greatsword.\n- 400 years of blade training\n- Close-quarters dragon-fighting experience\n- Keeps it hidden‚Äîenemies plan for archer, get swordmaster\n- Element of surprise in combat\n\n### His Hidden Pain\n- Misses elven culture desperately (music, art, poetry, forests)\n- Doesn't talk about it‚Äîhe chose his path\n- Dreams of fighting dragons, of killing Vera (alternate timeline)\n- Wakes sometimes and has to check she's real\n- Thorongil senses these nightmares through their bond\n\n### What He Wants\n- Peace with his past (may never happen)\n- Veraheim to survive and thrive\n- To be worthy of the choice he made\n- More time with Vera and Thorongil\n\n### What He Fears\n- Losing Vera (she's mortal, he's not)\n- Losing Thorongil (the bond might kill him)\n- The past catching up (Empire assassination?)\n- Being the person he almost was\n\n### Story Hooks\n\n| Hook | Description |\n|------|-------------|\n| **The Empire's Offer** | Valandor reaches out‚Äîthey need him. Does he help his former people? |\n| **The Successor** | Thaelen needs to train someone to replace him. Who? |\n| **The Past Returns** | Someone from the Dragon War appears with information‚Äîor accusations. |\n| **The Mission File** | Evidence of his original orders to kill Vera surfaces. Political crisis. |\n| **Reconciliation** | Opportunity to make peace with elven heritage. At what cost? |\n\n---",
  "seeAlso": [],
  "rawContent": "# Thaelen Ruincalen\n\n## At a Glance\n> **What anyone in Exilium would know**\n\n**Thaelen Ruincalen** - Co-Ruler of Veraheim, \"The Last Dragon Rider,\" \"The Dragon Knight\"\n\n- Elven warrior who co-founded Veraheim 80 years ago with Vera Wyrdweaver\n- The only living dragon rider with an intact bond‚Äîrides Thorongil\n- Was sent by the Thelassian to kill Vera; fell in love with her instead\n- Commands Veraheim's 300-guard force with legendary precision\n- *Common saying: \"The Lady holds the mountain. The Commander holds the line.\"*\n\n| | |\n|---|---|\n| **Age** | 400+ years |\n| **Race** | High Elf |\n| **Role** | Co-Ruler, Supreme Commander |\n| **Partner** | Vera Wyrdweaver |\n| **Dragon** | Thorongil (400-year bond) |\n\n---\n\n## Common Knowledge\n> **What visitors or residents of Veraheim would know**\n\n### Appearance & Manner\nAppears middle-aged for an elf (equivalent to human 40s). 400 years of war and exile show in his bearing. Moves with a warrior's grace‚Äîevery motion precise, economical. Calm authority that doesn't need to shout. Eyes that have seen too much. Veterans recognize another veteran immediately.\n\n### Personality\nStoic, controlled, professional. Emotions carefully managed. Leads by example, not speeches. Economy of words‚Äîsays what needs saying, nothing more. Respectful to all unless they prove unworthy. The guards would follow him anywhere.\n\n### Family & Relationships\n- **Partner:** Vera Wyrdweaver - Their love story is legendary. Still deeply devoted after 80 years.\n- **Dragon:** Thorongil - 400-year telepathic bond. They don't need words.\n- **No children:** Veraheim is their legacy.\n\n### Known Capabilities\nFamous as the deadliest archer alive‚Äîcan hit targets from dragonback at impossible distances. Fought in the Dragon War 400 years ago. The dragon-rider combination makes him and Thorongil virtually unstoppable.\n\n### Public Role\n- Supreme Commander of Veraheim's 300 guards\n- Trains with guards regularly (3x per week minimum)\n- Oversees all major city projects\n- Handles security, logistics, and military matters\n- The \"practical hand\" to Vera's \"magical vision\"\n\n### His Leadership Style\nFair but demanding. Personally evaluates every recruit. Guards say: \"Would follow him anywhere,\" \"Doesn't waste words,\" \"Makes you want to be better.\" He earns loyalty, never demands it.\n\n---\n\n## Secret Knowledge\n> **DM-only information**\n\n### True Nature\nThaelen is a stoic professional carrying 400 years of regret. He was sent to kill Vera and almost did it‚Äîfollowing orders without question. That narrow-mindedness haunts him. He chose love over duty and lost everything: his people, his position, his homeland. He'd make the same choice again, but wishes he'd been worthy of it from the start.\n\n### The Dragon War Trauma\nWhat he survived 400 years ago:\n- 35 days fighting his own dragon's kin\n- Watched most dragon-elf bonds break or end in death\n- Beat dragons into retreat without killing them (but others died)\n- Thorongil considered traitor by dragonkind\n- Only survivor with intact bond\n\n**The Guilt:**\n- Survivor's guilt for 400 years\n- Why did his bond survive when others broke?\n- \"I was the lucky one. That doesn't feel like luck.\"\n\n### The Mission He Regrets\nThe Thelassian sent him to eliminate Vera:\n- He went intending to kill her\n- Didn't question orders (soldier's obedience)\n- Assumed guilt without evidence\n- Elven prejudice: \"humans are lesser\"\n- Almost murdered the love of his life\n\n**What Changed Him:**\n- Now questions orders\n- Judges by actions, not race\n- Values independent thought\n- \"Never again will I follow blindly\"\n\n### The Secret Weapon\n**Most people don't know:** He's equally deadly with a greatsword.\n- 400 years of blade training\n- Close-quarters dragon-fighting experience\n- Keeps it hidden‚Äîenemies plan for archer, get swordmaster\n- Element of surprise in combat\n\n### His Hidden Pain\n- Misses elven culture desperately (music, art, poetry, forests)\n- Doesn't talk about it‚Äîhe chose his path\n- Dreams of fighting dragons, of killing Vera (alternate timeline)\n- Wakes sometimes and has to check she's real\n- Thorongil senses these nightmares through their bond\n\n### What He Wants\n- Peace with his past (may never happen)\n- Veraheim to survive and thrive\n- To be worthy of the choice he made\n- More time with Vera and Thorongil\n\n### What He Fears\n- Losing Vera (she's mortal, he's not)\n- Losing Thorongil (the bond might kill him)\n- The past catching up (Empire assassination?)\n- Being the person he almost was\n\n### Story Hooks\n\n| Hook | Description |\n|------|-------------|\n| **The Empire's Offer** | Valandor reaches out‚Äîthey need him. Does he help his former people? |\n| **The Successor** | Thaelen needs to train someone to replace him. Who? |\n| **The Past Returns** | Someone from the Dragon War appears with information‚Äîor accusations. |\n| **The Mission File** | Evidence of his original orders to kill Vera surfaces. Political crisis. |\n| **Reconciliation** | Opportunity to make peace with elven heritage. At what cost? |\n\n---\n\n## Connections Map\n\n```mermaid\nflowchart TD\n    subgraph Veraheim[\"üèîÔ∏è Veraheim Leadership\"]\n        Thaelen[\"<b>Thaelen Ruincalen</b><br/>The Last Dragon Rider\"]\n        Vera[\"Vera Wyrdweaver<br/>Partner, Co-Ruler\"]\n        Thorongil[\"Thorongil<br/>üêâ Bonded Dragon\"]\n    end\n    \n    Thaelen ---|\"80 years of love\"| Vera\n    Thaelen ---|\"400-year bond\"| Thorongil\n    \n    Thaelen -->|\"commands\"| Guards[\"300 Guards\"]\n    Thaelen -->|\"oversees\"| Projects[\"City Projects\"]\n    \n    Thaelen -.->|\"exiled from\"| Empire[\"Thelassian\"]\n    Thaelen -.->|\"sent to kill\"| Vera\n    \n    subgraph Past[\"The Haunting Past\"]\n        DragonWar[\"Dragon War<br/>35 days of hell\"]\n        Mission[\"The Kill Order\"]\n        Guilt[\"Survivor's Guilt\"]\n    end\n    \n    Thaelen -.-> Past\n    \n    style Thaelen fill:#cfe2f3,color:#000\n    style Empire fill:#d9d9d9,color:#000\n    style Vera fill:#d9d2e9,color:#000\n```\n\n---\n\n## Combat Statistics\n\n**Class:** Fighter/Ranger (Dragon Rider)\n**Effective Level:** 18-20\n\n**Primary Weapon - Longbow:**\n- Masterwork, 400 years old\n- +3 enhancement (earned through Dragon War)\n- Can hit targets most archers can't see\n- No penalty shooting from dragonback\n\n**Secondary Weapon - Greatsword (Secret):**\n- Elven make, also 400+ years old\n- +3 enhancement\n- Wielded with perfect form\n- Unknown to most enemies\n\n**Special Abilities:**\n- Aerial archery (dragon rider specialty)\n- Telepathic coordination with Thorongil\n- 400 years of tactical experience\n- Near-perfect accuracy\n\n**With Thorongil:**\n- Instant telepathic tactics\n- Perfect hit-and-run aerial combat\n- Effectively unbeatable by conventional forces\n\n---\n\n## Notes\n- The stoic warrior with deep emotional currents\n- His regrets make him complex, not weak\n- Contrast with Vera: reserved vs. warm, patient vs. urgent\n- The Empire connection is unexplored story potential\n- Losing him would devastate Veraheim's defense\n",
  "sourcePath": "06-NPCs/Veraheim/Thaelen Ruincalen.md",
  "slug": "thaelen-ruincalen",
  "category": "npcs"
}