{
  "title": "Thandril Ironsong",
  "metadata": {
    "Age": "550 years",
    "Race": "High Elf, Male",
    "Title": "Captain of the Eternal Guard",
    "Reports To": "Emperor Valandor directly",
    "Location": "Eternal Spire, Crown Plaza"
  },
  "atAGlance": "**Thandril Ironsong** - Captain of the Eternal Guard, \"The Unblinking\"\n\n- Commander of the elite force protecting Emperor Valandor and the Eternal Spire\n- Has held the position for 300 years‚Äîlongest-serving captain in history\n- Famous for never having allowed a threat to reach the Emperor\n- The last face most petitioners see before entering the Throne Hall\n- *Common saying: \"If Ironsong doesn't nod, you don't pass. If he draws, you're already dead.\"*\n\n| | |\n|---|---|\n| **Age** | 550 years |\n| **Race** | High Elf, Male |\n| **Title** | Captain of the Eternal Guard |\n| **Reports To** | Emperor Valandor directly |\n| **Location** | Eternal Spire, Crown Plaza |\n\n---",
  "commonKnowledge": "### Appearance & Manner\nTall and still as a statue, with the build of someone who has spent five centuries preparing for violence. Silver hair cropped short, face weathered but ageless, eyes that seem to evaluate threats from every angle simultaneously. Wears the ceremonial armor of the Eternal Guard‚Äîwhite and gold‚Äîbut his is subtly modified for actual combat. Never slouches, rarely blinks, always watching.\n\n### Personality (Public)\nProfessional to the point of intimidation. Speaks only when necessary, in short precise sentences. Shows no favoritism‚Äîlords and laborers receive the same assessment. Neither cruel nor kind; simply absolute in his duty. His approval is expressed through a slight nod. His disapproval needs no expression.\n\n### The Eternal Guard\n100 elite warriors protecting the Crown:\n- **The Spire Guard** (40): Interior of Eternal Spire\n- **The Plaza Watch** (40): Crown Plaza and tower approaches\n- **The Shadow Shield** (20): Plainclothes, embedded in crowds\n\nThandril commands all of them. He personally trains the officers. He interviewed every guard currently serving. His standards are legendary‚Äîonly 1 in 50 applicants passes.\n\n### His Reputation\n- Stopped three assassination attempts personally (that are publicly known)\n- Once held the Throne Hall door alone for 20 minutes against insurgents\n- Has ejected nobles for disrespect (they didn't come back)\n- Is said to know every face that has ever entered the Crown\n- Even the Four Pillars speak to him with respect\n\n### Relationship with the Emperor\nHe sees Valandor daily. They rarely speak beyond protocol. But Thandril has protected the Emperor for 300 years. There is trust there that doesn't require words.\n\n---",
  "secretKnowledge": "### True Nature\nThandril Ironsong is exactly what he appears to be: a perfect guardian. But perfection has a cost. He has sacrificed everything‚Äîfamily, ambition, personal desires‚Äîfor one purpose: keeping the Emperor alive. He doesn't regret it. He doesn't know how to be anything else anymore.\n\nHe's not a fanatic. He doesn't worship Valandor. He simply made a choice 300 years ago, and he has honored it every day since. The choice has consumed him, defined him, become him. If Valandor died, Thandril isn't sure he'd know how to exist.\n\n### What He's Actually Stopped\nThe three public assassination attempts were minor. The real threats:\n- 7 magical attacks (dispelled before detonation)\n- 12 poisoning attempts (detected, poisoners quietly eliminated)\n- 3 insider betrayals (guards turned, dealt with privately)\n- 1 attack by a Pillar's agent (Thandril has never revealed which Pillar)\n\nHe keeps these secret because public knowledge would cause panic, damage trust, and encourage imitators. Only Valandor knows the true count.\n\n### His Network\nThe Eternal Guard isn't just the 100 visible soldiers. Thandril has:\n- **Informants** in every Great House\n- **Contacts** with Velindor Shadowmere (professional respect, mutual wariness)\n- **Agents** in the Outer City listening for threats\n- **Files** on everyone who regularly enters the Crown\n\nHe doesn't run spy operations‚Äîthat's Shadowmere's domain. But he knows things. Things that help him protect.\n\n### The Weight of Duty\nThandril has never married. Never had children. Never taken a vacation. In 300 years, he has spent perhaps 100 days outside the Crown‚Äîand only when the Emperor left Aelindor.\n\nHe doesn't resent this. He chose it. But sometimes, in the quiet hours before dawn, he wonders what his life might have been. Then the sun rises, and he stops wondering. There's work to do.\n\n### His Opinion on the Pillars\nHe trusts none of them completely:\n- **Caerwyn**: Respects his competence; watches for military ambition\n- **Thaelorin**: Values his neutrality; concerned about what secrets he keeps\n- **Isileth**: Uncertain‚Äîher prophecies could be weapons or warnings\n- **Faendril**: Practical alliance; monitors his economic leverage\n\nOne of them may have sent that assassin 200 years ago. He's never forgotten.\n\n### What He Wants\n- To die before Valandor (so he never has to fail)\n- The Empire stable (his life's work validated)\n- Perhaps: to know his sacrifice mattered\n\n### What He Fears\n- Failing at the moment it matters most\n- Living after Valandor dies (what would he be?)\n- A threat he doesn't see coming\n- Being used as a weapon against the Emperor (hostages, manipulation)\n\n### His Judgment of Visitors\nWhen PCs enter the Crown, Thandril evaluates them:\n- **Combat capability**: Can they hurt anyone?\n- **Intentions**: What do they want?\n- **Connections**: Who sent them?\n- **Threat level**: Should they be watched?\n\nHe makes these assessments in seconds. He's rarely wrong.\n\n### Story Hooks\n\n| Hook | Description |\n|------|-------------|\n| **The Gates** | PCs need access to the Crown. Thandril stands between them and their goal. |\n| **The Assassination** | He learns of a plot‚Äîbut the source is a Pillar. He needs outside help. |\n| **The Retirement** | After 300 years, he's considering stepping down. The transition is dangerous. |\n| **The Past** | His own history‚Äîfamily, old comrades‚Äîcatches up with him. |\n| **The Test** | He tests PCs before trusting them with sensitive information. |\n| **The Fall** | Valandor is attacked successfully. Thandril survives. What does he do next? |\n\n---",
  "seeAlso": [],
  "rawContent": "# Thandril Ironsong\n\n## At a Glance\n> **What anyone approaching the Crown would know**\n\n**Thandril Ironsong** - Captain of the Eternal Guard, \"The Unblinking\"\n\n- Commander of the elite force protecting Emperor Valandor and the Eternal Spire\n- Has held the position for 300 years‚Äîlongest-serving captain in history\n- Famous for never having allowed a threat to reach the Emperor\n- The last face most petitioners see before entering the Throne Hall\n- *Common saying: \"If Ironsong doesn't nod, you don't pass. If he draws, you're already dead.\"*\n\n| | |\n|---|---|\n| **Age** | 550 years |\n| **Race** | High Elf, Male |\n| **Title** | Captain of the Eternal Guard |\n| **Reports To** | Emperor Valandor directly |\n| **Location** | Eternal Spire, Crown Plaza |\n\n---\n\n## Common Knowledge\n> **What guards, nobles, or frequent visitors would know**\n\n### Appearance & Manner\nTall and still as a statue, with the build of someone who has spent five centuries preparing for violence. Silver hair cropped short, face weathered but ageless, eyes that seem to evaluate threats from every angle simultaneously. Wears the ceremonial armor of the Eternal Guard‚Äîwhite and gold‚Äîbut his is subtly modified for actual combat. Never slouches, rarely blinks, always watching.\n\n### Personality (Public)\nProfessional to the point of intimidation. Speaks only when necessary, in short precise sentences. Shows no favoritism‚Äîlords and laborers receive the same assessment. Neither cruel nor kind; simply absolute in his duty. His approval is expressed through a slight nod. His disapproval needs no expression.\n\n### The Eternal Guard\n100 elite warriors protecting the Crown:\n- **The Spire Guard** (40): Interior of Eternal Spire\n- **The Plaza Watch** (40): Crown Plaza and tower approaches\n- **The Shadow Shield** (20): Plainclothes, embedded in crowds\n\nThandril commands all of them. He personally trains the officers. He interviewed every guard currently serving. His standards are legendary‚Äîonly 1 in 50 applicants passes.\n\n### His Reputation\n- Stopped three assassination attempts personally (that are publicly known)\n- Once held the Throne Hall door alone for 20 minutes against insurgents\n- Has ejected nobles for disrespect (they didn't come back)\n- Is said to know every face that has ever entered the Crown\n- Even the Four Pillars speak to him with respect\n\n### Relationship with the Emperor\nHe sees Valandor daily. They rarely speak beyond protocol. But Thandril has protected the Emperor for 300 years. There is trust there that doesn't require words.\n\n---\n\n## Secret Knowledge\n> **DM-only information**\n\n### True Nature\nThandril Ironsong is exactly what he appears to be: a perfect guardian. But perfection has a cost. He has sacrificed everything‚Äîfamily, ambition, personal desires‚Äîfor one purpose: keeping the Emperor alive. He doesn't regret it. He doesn't know how to be anything else anymore.\n\nHe's not a fanatic. He doesn't worship Valandor. He simply made a choice 300 years ago, and he has honored it every day since. The choice has consumed him, defined him, become him. If Valandor died, Thandril isn't sure he'd know how to exist.\n\n### What He's Actually Stopped\nThe three public assassination attempts were minor. The real threats:\n- 7 magical attacks (dispelled before detonation)\n- 12 poisoning attempts (detected, poisoners quietly eliminated)\n- 3 insider betrayals (guards turned, dealt with privately)\n- 1 attack by a Pillar's agent (Thandril has never revealed which Pillar)\n\nHe keeps these secret because public knowledge would cause panic, damage trust, and encourage imitators. Only Valandor knows the true count.\n\n### His Network\nThe Eternal Guard isn't just the 100 visible soldiers. Thandril has:\n- **Informants** in every Great House\n- **Contacts** with Velindor Shadowmere (professional respect, mutual wariness)\n- **Agents** in the Outer City listening for threats\n- **Files** on everyone who regularly enters the Crown\n\nHe doesn't run spy operations‚Äîthat's Shadowmere's domain. But he knows things. Things that help him protect.\n\n### The Weight of Duty\nThandril has never married. Never had children. Never taken a vacation. In 300 years, he has spent perhaps 100 days outside the Crown‚Äîand only when the Emperor left Aelindor.\n\nHe doesn't resent this. He chose it. But sometimes, in the quiet hours before dawn, he wonders what his life might have been. Then the sun rises, and he stops wondering. There's work to do.\n\n### His Opinion on the Pillars\nHe trusts none of them completely:\n- **Caerwyn**: Respects his competence; watches for military ambition\n- **Thaelorin**: Values his neutrality; concerned about what secrets he keeps\n- **Isileth**: Uncertain‚Äîher prophecies could be weapons or warnings\n- **Faendril**: Practical alliance; monitors his economic leverage\n\nOne of them may have sent that assassin 200 years ago. He's never forgotten.\n\n### What He Wants\n- To die before Valandor (so he never has to fail)\n- The Empire stable (his life's work validated)\n- Perhaps: to know his sacrifice mattered\n\n### What He Fears\n- Failing at the moment it matters most\n- Living after Valandor dies (what would he be?)\n- A threat he doesn't see coming\n- Being used as a weapon against the Emperor (hostages, manipulation)\n\n### His Judgment of Visitors\nWhen PCs enter the Crown, Thandril evaluates them:\n- **Combat capability**: Can they hurt anyone?\n- **Intentions**: What do they want?\n- **Connections**: Who sent them?\n- **Threat level**: Should they be watched?\n\nHe makes these assessments in seconds. He's rarely wrong.\n\n### Story Hooks\n\n| Hook | Description |\n|------|-------------|\n| **The Gates** | PCs need access to the Crown. Thandril stands between them and their goal. |\n| **The Assassination** | He learns of a plot‚Äîbut the source is a Pillar. He needs outside help. |\n| **The Retirement** | After 300 years, he's considering stepping down. The transition is dangerous. |\n| **The Past** | His own history‚Äîfamily, old comrades‚Äîcatches up with him. |\n| **The Test** | He tests PCs before trusting them with sensitive information. |\n| **The Fall** | Valandor is attacked successfully. Thandril survives. What does he do next? |\n\n---\n\n## Connections Map\n\n```mermaid\nflowchart TD\n    subgraph Guard[\"üõ°Ô∏è Eternal Guard\"]\n        Thandril[\"<b>Thandril Ironsong</b><br/>Captain<br/>550 years, 300 as Captain\"]\n        Spire[\"Spire Guard (40)\"]\n        Plaza[\"Plaza Watch (40)\"]\n        Shadow[\"Shadow Shield (20)\"]\n    end\n    \n    Thandril --> Spire & Plaza & Shadow\n    Thandril -->|\"protects\"| Valandor[\"Emperor Valandor\"]\n    \n    Thandril -.->|\"professional contact\"| Velindor[\"Velindor Shadowmere\"]\n    Thandril -.->|\"watches\"| Pillars[\"All Four Pillars\"]\n    \n    subgraph Stopped[\"Threats Stopped (Secret)\"]\n        Magic[\"7 Magical Attacks\"]\n        Poison[\"12 Poisonings\"]\n        Betrayal[\"3 Insider Betrayals\"]\n        Pillar[\"1 Pillar Agent\"]\n    end\n    \n    Thandril -.-> Stopped\n    \n    style Thandril fill:#f9cb9c,color:#000\n    style Valandor fill:#d9d2e9,color:#000\n    style Pillar fill:#f4cccc,color:#000\n```\n\n---\n\n## Combat Statistics\n\n**Class:** Fighter (Battle Master)\n**Effective Level:** 17\n\n**Capabilities:**\n- 550 years of combat training\n- Master of multiple weapon styles\n- Tactical genius in close protection\n- Can coordinate entire guard force telepathically (enchanted helm)\n\n**Special Equipment:**\n- Armor of the Eternal Watch (+2, resistance to first damage each round)\n- Blade of Last Defense (longsword, +3, extra attack when defending another)\n- Helm of Command (telepathy with all Eternal Guard)\n\n**Fighting Style:**\n- Defensive specialist\n- Protects allies at cost to offense\n- Uses environment against threats\n- Never fights alone if avoidable\n\n---\n\n## Notes\n- Gatekeeper NPC‚Äîliterally controls access to power\n- Respecting him opens doors; disrespecting him closes everything\n- His evaluation of PCs can be a recurring element\n- The \"which Pillar tried to assassinate Valandor\" mystery is campaign fuel\n- If he ever fails, the consequences are setting-changing\n- Could become ally if PCs prove trustworthy\n",
  "sourcePath": "06-NPCs/Thelassian/Thandril Ironsong.md",
  "slug": "thandril-ironsong",
  "category": "npcs"
}