{
  "title": "Thelindor Greymantle",
  "metadata": {
    "Age": "400 years",
    "Race": "High Elf, Male",
    "Title": "Warden of Lesser Peoples",
    "Reports To": "First Steward Faendril",
    "Location": "Granite Tower, Office of Lesser Peoples"
  },
  "atAGlance": "**Thelindor Greymantle** - Warden of Lesser Peoples, \"The Grey Administrator\"\n\n- Runs the Office of the Lesser Peoplesâ€”managing all non-elven populations\n- Has held this position for 150 years, making him an expert in non-elven affairs\n- More daily contact with non-elves than any other high official\n- Implements the policies of elven supremacy while seeing its contradictions daily\n- *Common saying among non-elves: \"Greymantle isn't kind. But he's fair. That's more than we usually get.\"*\n\n| | |\n|---|---|\n| **Age** | 400 years |\n| **Race** | High Elf, Male |\n| **Title** | Warden of Lesser Peoples |\n| **Reports To** | First Steward Faendril |\n| **Location** | Granite Tower, Office of Lesser Peoples |\n\n---",
  "commonKnowledge": "### Appearance & Manner\nWears grey robesâ€”the color of his office, the color of his name. Average height, unremarkable features, the kind of elf who disappears in a crowd. This is deliberate. His job is administration, not intimidation. Carries ledgers more often than weapons. Speaks calmly, never raises his voice, treats everyoneâ€”elf and non-elfâ€”with the same detached professionalism.\n\n### Personality (Public)\nBureaucratic efficiency personified. Processes applications, resolves disputes, enforces restrictions without apparent emotion. Neither sympathetic nor cruelâ€”simply doing his job. Some say he has no feelings; others recognize the careful neutrality of someone who can't afford to care.\n\n### The Office of Lesser Peoples\nHis department handles:\n- **Residence permits** for non-elves in the Empire\n- **Work authorizations** (certain jobs are elf-only)\n- **Travel restrictions** (where non-elves can and cannot go)\n- **Separate courts** for non-elven legal matters\n- **Census and registration** of all non-elven populations\n\nThe Office employs 200 administrators across the Empire. Thelindor oversees all of them.\n\n### His Reputation\n- **Among elves**: A necessary administrator doing unpleasant work\n- **Among non-elves**: The face of their oppressionâ€”but predictable, not arbitrary\n- **Among reformers**: A waste of talent enforcing unjust policies\n- **Among supremacists**: Too soft on the lesser races\n\n### The Numbers He Manages\n- ~15,000 non-elves live legally within Imperial borders\n- ~5,000 work permits issued annually\n- ~500 deportations per year\n- ~100 executions (crimes that would earn elves fines)\n\nHe knows these numbers. He reviews them monthly.\n\n---",
  "secretKnowledge": "### True Nature\nThelindor Greymantle did not ask for this job. He was appointed 150 years ago because he was efficient, neutral, and had no strong opinions on non-elves. He accepted because refusing would have ended his career.\n\n150 years later, he has opinions.\n\nEvery day, he sees talented dwarven craftsmen denied permits because an elf wanted their workshop space. He processes execution orders for humans whose only crime was being human in the wrong place. He registers half-elven children who will never be accepted by either parent's people.\n\nHe still does his job. What choice does he have? The system exists with or without him. At least he can be fair within its rules.\n\nBut he's been quietly bending those rules for decades.\n\n### The Small Mercies\nThings Thelindor has done without authorization:\n- \"Lost\" paperwork for refugees fleeing worse persecution\n- Extended work permits that should have expired\n- Assigned non-elves to lenient judges when possible\n- Warned communities before \"random\" inspections\n- Quietly helped families reach Veraheim\n\nNone of this is treason. All of it is career-ending if discovered. He tells himself he's just being efficientâ€”eliminating unnecessary suffering. But he knows the truth.\n\n### His Private Files\nHe keeps unauthorized records:\n- Economic contributions by non-elven workers (proving their value)\n- Cases where non-elves were punished more harshly than elves for identical crimes\n- Evidence that the Empire depends on non-elven labor\n- A list of every execution he's been unable to prevent\n\nHe doesn't know what he'll do with these files. Maybe nothing. Maybe everything.\n\n### What He Sees Daily\nThe contradiction at the heart of elven supremacy:\n- The Empire needs non-elven labor (elves won't do certain work)\n- Non-elven craftsmen produce essential goods\n- Trade depends on non-elven merchants as intermediaries\n- The system that oppresses them requires their participation\n\nHe sees this. Faendril sees this. Neither can say it aloud.\n\n### His Relationship with Faendril\nFaendril appointed him and depends on him. They share an unspoken understanding:\n- Thelindor keeps non-elven affairs running smoothly\n- Faendril doesn't ask how\n- Both know the system is unsustainable\n- Neither has the power to change it alone\n\nThey've never discussed this openly. They don't need to.\n\n### What He Wants\n- The system to change (but he can't say that)\n- To stop signing execution orders (but he can't refuse)\n- Perhaps: someone to give him a reason to act\n- Perhaps: proof that his small mercies mattered\n\n### What He Fears\n- His unauthorized records being discovered\n- Becoming numb to the suffering he processes\n- The system continuing unchanged after he's gone\n- Being remembered as an oppressor (even if he tried to be fair)\n\n### Story Hooks\n\n| Hook | Description |\n|------|-------------|\n| **The Permit** | PCs need documents. He can provideâ€”but notices something about them. |\n| **The Files** | He offers his records to PCs who might actually use them. |\n| **The Rescue** | A non-elf family needs to disappear. He can't help officially, but... |\n| **The Reform** | Faendril is considering changes. Thelindor needs outside evidence to support the case. |\n| **The Exposure** | Someone threatens to reveal his mercies. What will he do? |\n| **The Choice** | A situation forces him to choose: follow orders or follow conscience. |\n\n---",
  "seeAlso": [],
  "rawContent": "# Thelindor Greymantle\n\n## At a Glance\n> **What anyone dealing with non-elves in the Empire would know**\n\n**Thelindor Greymantle** - Warden of Lesser Peoples, \"The Grey Administrator\"\n\n- Runs the Office of the Lesser Peoplesâ€”managing all non-elven populations\n- Has held this position for 150 years, making him an expert in non-elven affairs\n- More daily contact with non-elves than any other high official\n- Implements the policies of elven supremacy while seeing its contradictions daily\n- *Common saying among non-elves: \"Greymantle isn't kind. But he's fair. That's more than we usually get.\"*\n\n| | |\n|---|---|\n| **Age** | 400 years |\n| **Race** | High Elf, Male |\n| **Title** | Warden of Lesser Peoples |\n| **Reports To** | First Steward Faendril |\n| **Location** | Granite Tower, Office of Lesser Peoples |\n\n---\n\n## Common Knowledge\n> **What administrators, non-elves, or merchants would know**\n\n### Appearance & Manner\nWears grey robesâ€”the color of his office, the color of his name. Average height, unremarkable features, the kind of elf who disappears in a crowd. This is deliberate. His job is administration, not intimidation. Carries ledgers more often than weapons. Speaks calmly, never raises his voice, treats everyoneâ€”elf and non-elfâ€”with the same detached professionalism.\n\n### Personality (Public)\nBureaucratic efficiency personified. Processes applications, resolves disputes, enforces restrictions without apparent emotion. Neither sympathetic nor cruelâ€”simply doing his job. Some say he has no feelings; others recognize the careful neutrality of someone who can't afford to care.\n\n### The Office of Lesser Peoples\nHis department handles:\n- **Residence permits** for non-elves in the Empire\n- **Work authorizations** (certain jobs are elf-only)\n- **Travel restrictions** (where non-elves can and cannot go)\n- **Separate courts** for non-elven legal matters\n- **Census and registration** of all non-elven populations\n\nThe Office employs 200 administrators across the Empire. Thelindor oversees all of them.\n\n### His Reputation\n- **Among elves**: A necessary administrator doing unpleasant work\n- **Among non-elves**: The face of their oppressionâ€”but predictable, not arbitrary\n- **Among reformers**: A waste of talent enforcing unjust policies\n- **Among supremacists**: Too soft on the lesser races\n\n### The Numbers He Manages\n- ~15,000 non-elves live legally within Imperial borders\n- ~5,000 work permits issued annually\n- ~500 deportations per year\n- ~100 executions (crimes that would earn elves fines)\n\nHe knows these numbers. He reviews them monthly.\n\n---\n\n## Secret Knowledge\n> **DM-only information**\n\n### True Nature\nThelindor Greymantle did not ask for this job. He was appointed 150 years ago because he was efficient, neutral, and had no strong opinions on non-elves. He accepted because refusing would have ended his career.\n\n150 years later, he has opinions.\n\nEvery day, he sees talented dwarven craftsmen denied permits because an elf wanted their workshop space. He processes execution orders for humans whose only crime was being human in the wrong place. He registers half-elven children who will never be accepted by either parent's people.\n\nHe still does his job. What choice does he have? The system exists with or without him. At least he can be fair within its rules.\n\nBut he's been quietly bending those rules for decades.\n\n### The Small Mercies\nThings Thelindor has done without authorization:\n- \"Lost\" paperwork for refugees fleeing worse persecution\n- Extended work permits that should have expired\n- Assigned non-elves to lenient judges when possible\n- Warned communities before \"random\" inspections\n- Quietly helped families reach Veraheim\n\nNone of this is treason. All of it is career-ending if discovered. He tells himself he's just being efficientâ€”eliminating unnecessary suffering. But he knows the truth.\n\n### His Private Files\nHe keeps unauthorized records:\n- Economic contributions by non-elven workers (proving their value)\n- Cases where non-elves were punished more harshly than elves for identical crimes\n- Evidence that the Empire depends on non-elven labor\n- A list of every execution he's been unable to prevent\n\nHe doesn't know what he'll do with these files. Maybe nothing. Maybe everything.\n\n### What He Sees Daily\nThe contradiction at the heart of elven supremacy:\n- The Empire needs non-elven labor (elves won't do certain work)\n- Non-elven craftsmen produce essential goods\n- Trade depends on non-elven merchants as intermediaries\n- The system that oppresses them requires their participation\n\nHe sees this. Faendril sees this. Neither can say it aloud.\n\n### His Relationship with Faendril\nFaendril appointed him and depends on him. They share an unspoken understanding:\n- Thelindor keeps non-elven affairs running smoothly\n- Faendril doesn't ask how\n- Both know the system is unsustainable\n- Neither has the power to change it alone\n\nThey've never discussed this openly. They don't need to.\n\n### What He Wants\n- The system to change (but he can't say that)\n- To stop signing execution orders (but he can't refuse)\n- Perhaps: someone to give him a reason to act\n- Perhaps: proof that his small mercies mattered\n\n### What He Fears\n- His unauthorized records being discovered\n- Becoming numb to the suffering he processes\n- The system continuing unchanged after he's gone\n- Being remembered as an oppressor (even if he tried to be fair)\n\n### Story Hooks\n\n| Hook | Description |\n|------|-------------|\n| **The Permit** | PCs need documents. He can provideâ€”but notices something about them. |\n| **The Files** | He offers his records to PCs who might actually use them. |\n| **The Rescue** | A non-elf family needs to disappear. He can't help officially, but... |\n| **The Reform** | Faendril is considering changes. Thelindor needs outside evidence to support the case. |\n| **The Exposure** | Someone threatens to reveal his mercies. What will he do? |\n| **The Choice** | A situation forces him to choose: follow orders or follow conscience. |\n\n---\n\n## Connections Map\n\n```mermaid\nflowchart TD\n    subgraph Office[\"ðŸ“‹ Office of Lesser Peoples\"]\n        Thelindor[\"<b>Thelindor Greymantle</b><br/>Warden<br/>400 years old\"]\n        Staff[\"200 Administrators\"]\n    end\n    \n    Thelindor -->|\"reports to\"| Faendril[\"First Steward Faendril<br/>(shared understanding)\"]\n    Thelindor -->|\"manages\"| NonElves[\"15,000 Non-Elves\"]\n    \n    Thelindor -.->|\"helps reach\"| Veraheim[\"Veraheim<br/>(unofficially)\"]\n    \n    subgraph Hidden[\"Secret Actions\"]\n        Papers[\"Lost Paperwork\"]\n        Extended[\"Extended Permits\"]\n        Warnings[\"Tip-offs\"]\n        Files[\"Private Records\"]\n    end\n    \n    Thelindor -.-> Hidden\n    \n    subgraph Daily[\"What He Processes\"]\n        Permits[\"Work Permits\"]\n        Courts[\"Separate Courts\"]\n        Executions[\"Execution Orders\"]\n        Census[\"Census Records\"]\n    end\n    \n    Thelindor --> Daily\n    \n    style Thelindor fill:#d9d9d9,color:#000\n    style Hidden fill:#d9ead3,color:#000\n    style Executions fill:#f4cccc,color:#000\n```\n\n---\n\n## Notes\n- The \"good person in a bad system\" archetype\n- His records could be campaign-changing evidence\n- Represents the Empire's moral contradictions\n- Can be ally, information source, or tragic figure\n- His small mercies show systemic change isn't enoughâ€”but individual action matters\n- Meeting him should make players uncomfortable (he's part of the machine, but also human)\n",
  "sourcePath": "06-NPCs/Thelassian/Thelindor Greymantle.md",
  "slug": "thelindor-greymantle",
  "category": "npcs"
}