{
  "title": "Vaelith \"The Storm\" Draegor",
  "metadata": {
    "Age": "~300 years",
    "Race": "Drow",
    "Role": "Legendary Captain, True Power",
    "Fleet": "40+ ships",
    "Flagship": "*Sorrow* (sentient)"
  },
  "atAGlance": "**Vaelith Draegor** - The Storm, The Sea Lord, True Power of the Broken Isles\n\n- 300-year-old drow who escaped the Empire's genocide and became the deadliest pirate alive\n- Commands 40+ ships and sails *Sorrow*, an ancient sentient vessel\n- Founded the pirate confederation 118 years ago after crushing an Empire purge fleet\n- Could rule the Isles whenever he wishes. Doesn't want to.\n- *Common saying: \"The Queen rules Freehold. The Storm rules the sea.\"*\n\n| | |\n|---|---|\n| **Age** | ~300 years |\n| **Race** | Drow |\n| **Role** | Legendary Captain, True Power |\n| **Fleet** | 40+ ships |\n| **Flagship** | *Sorrow* (sentient) |\n\n---",
  "commonKnowledge": "### Appearance & Manner\nWhite hair, long, salt-crusted. Skin pale grayâ€”centuries of salt and sun faded typical drow obsidian to something ghostly. Eyes washed-out violet, almost white. Lean and wiry, moves with unsettling stillness. He stands like the sea before a hurricaneâ€”calm, patient, inevitable. He doesn't look like a drow anymore. He looks like what the sea made from one.\n\n### Personality\nSpeaks softly, rarely more than necessary. Long silences don't bother him. Watches everything, reacts to little. When he does speak, conversations stop. Smiles rarely; when he does, it doesn't reach his eyes. No warning when violence comes. No threats. No posturing. One moment still; the next, blood.\n\n### The Legend\n- **300 years old.** Three. Hundred. Years.\n- **His ship is alive.** *Sorrow* thinks. It hungers.\n- **The Empire bounty:** 500,000 gold pieces. Never claimed.\n- **47 naval hunters assigned.** All dead or retired in disgrace.\n- **Founded the Isles confederation** 118 years ago\n\n### *Sorrow* - The Sentient Ship\nAncient beyond knowing. Faster than any ship has a right to be. Can sense vessels before they appear on the horizon. Repairs itself. Vaelith and *Sorrow* share a psychic bondâ€”they found each other 300 years ago, both broken, both alone.\n\n### The Thenn Lesson\nSixty years ago, a captain accidentally damaged *Sorrow* while drunk. Vaelith killed him. Then his brother. Then spent three months hunting down his entire family. **The Thenn family no longer exists.** No one has touched *Sorrow* since.\n\n### Relationship with Queen Graza\nShe rules by his tolerance. He attended her coronation, gave a small nod, left. That nod is why she's still Queen. She sends him tribute he never asked for. He accepts without comment. Her only safety is his indifference.\n\n---",
  "secretKnowledge": "### True Nature\nVaelith was broken 300 years ago in the dark beneath the mountains. He and *Sorrow* put each other back together, imperfectly, into something new. He doesn't want power, legacy, or revengeâ€”revenge implies an end. He will never be satisfied. He wants the sea, his ship, and Empire vessels burning until the Empire is ash.\n\n### The Massacre of Vel'thara\n300 years ago, his homeâ€”a hidden drow city of 3,000â€”was found and exterminated by the Empire. Systematic. Thorough. His mother Ilaena killed defending children. His sister Nhilaya, fourteen, never found. Everyone he'd known since birthâ€”ash and memory.\n\nHe was seventeen. Found an underground river. Should have died. Woke in a cavern where an ancient, forgotten ship had waited in the dark for centuries. They needed each other.\n\n### The Psychic Bond\n*Sorrow* feels Vaelith's emotions; he feels its hungers. 300 years together, never apart for more than hours. When Empire ships appear, he feels *Sorrow* wake up. Feel it wanting. The ship is not a tool. It's his partner. His only companion.\n\n### His Code\n**Empire Ships:**\n- No surrender accepted\n- No survivors\n- Cargo burned with the ship\n- This isn't piracy. It's war.\n- 300 years. Thousands of ships. Never enough.\n\n**Other Targets:**\n- Standard rulesâ€”surrender and live\n- Professional, not cruel\n- Takes cargo, releases cooperative crews\n- Nothing personal\n\n### Rare Emotions\n**Anger:** Cold, not hot. Gets quieter. Stiller. Temperature seems to drop. Then violenceâ€”sudden, overwhelming.\n\n**Peace:** Open water. No land in sight. *Sorrow* beneath him. In these moments, he's almost content. Memories of Vel'thara fade. His mother's face blurs. His sister's voice goes quiet. Just the sea, the ship, silence. It never lasts. But it's enough.\n\n### What Would Make Him Act\n**Would fight for:**\n- The Broken Isles (external invasion)\n- Harbor Peace (fundamental to Isles)\n- *Sorrow* (absolute)\n\n**Would not care about:**\n- Who sits on throne\n- Captain rivalries\n- Politics of any kind\n\n**If challenged:** They would learn why no one does.\n\n### Story Hooks\n\n| Hook | Description |\n|------|-------------|\n| **The Storm Acts** | Something makes Vaelith care about politics. What could possibly matter enough? |\n| **Empire Revenge** | The Empire sends something new. Something that might actually threaten him. |\n| **The Ship's Memory** | *Sorrow* remembers something from before. Ancient secrets from forgotten seas. |\n| **The Storm Speaks** | Vaelith actually gives the Queen an order. The Isles hold their breath. |\n| **Family Found** | A rumor: his sister Nhilaya might have survived. He would burn the world to know. |\n\n---",
  "seeAlso": [],
  "rawContent": "# Vaelith \"The Storm\" Draegor\n\n## At a Glance\n> **What anyone in the Broken Isles would know**\n\n**Vaelith Draegor** - The Storm, The Sea Lord, True Power of the Broken Isles\n\n- 300-year-old drow who escaped the Empire's genocide and became the deadliest pirate alive\n- Commands 40+ ships and sails *Sorrow*, an ancient sentient vessel\n- Founded the pirate confederation 118 years ago after crushing an Empire purge fleet\n- Could rule the Isles whenever he wishes. Doesn't want to.\n- *Common saying: \"The Queen rules Freehold. The Storm rules the sea.\"*\n\n| | |\n|---|---|\n| **Age** | ~300 years |\n| **Race** | Drow |\n| **Role** | Legendary Captain, True Power |\n| **Fleet** | 40+ ships |\n| **Flagship** | *Sorrow* (sentient) |\n\n---\n\n## Common Knowledge\n> **What pirates, merchants, or visitors to the Isles would know**\n\n### Appearance & Manner\nWhite hair, long, salt-crusted. Skin pale grayâ€”centuries of salt and sun faded typical drow obsidian to something ghostly. Eyes washed-out violet, almost white. Lean and wiry, moves with unsettling stillness. He stands like the sea before a hurricaneâ€”calm, patient, inevitable. He doesn't look like a drow anymore. He looks like what the sea made from one.\n\n### Personality\nSpeaks softly, rarely more than necessary. Long silences don't bother him. Watches everything, reacts to little. When he does speak, conversations stop. Smiles rarely; when he does, it doesn't reach his eyes. No warning when violence comes. No threats. No posturing. One moment still; the next, blood.\n\n### The Legend\n- **300 years old.** Three. Hundred. Years.\n- **His ship is alive.** *Sorrow* thinks. It hungers.\n- **The Empire bounty:** 500,000 gold pieces. Never claimed.\n- **47 naval hunters assigned.** All dead or retired in disgrace.\n- **Founded the Isles confederation** 118 years ago\n\n### *Sorrow* - The Sentient Ship\nAncient beyond knowing. Faster than any ship has a right to be. Can sense vessels before they appear on the horizon. Repairs itself. Vaelith and *Sorrow* share a psychic bondâ€”they found each other 300 years ago, both broken, both alone.\n\n### The Thenn Lesson\nSixty years ago, a captain accidentally damaged *Sorrow* while drunk. Vaelith killed him. Then his brother. Then spent three months hunting down his entire family. **The Thenn family no longer exists.** No one has touched *Sorrow* since.\n\n### Relationship with Queen Graza\nShe rules by his tolerance. He attended her coronation, gave a small nod, left. That nod is why she's still Queen. She sends him tribute he never asked for. He accepts without comment. Her only safety is his indifference.\n\n---\n\n## Secret Knowledge\n> **DM-only information**\n\n### True Nature\nVaelith was broken 300 years ago in the dark beneath the mountains. He and *Sorrow* put each other back together, imperfectly, into something new. He doesn't want power, legacy, or revengeâ€”revenge implies an end. He will never be satisfied. He wants the sea, his ship, and Empire vessels burning until the Empire is ash.\n\n### The Massacre of Vel'thara\n300 years ago, his homeâ€”a hidden drow city of 3,000â€”was found and exterminated by the Empire. Systematic. Thorough. His mother Ilaena killed defending children. His sister Nhilaya, fourteen, never found. Everyone he'd known since birthâ€”ash and memory.\n\nHe was seventeen. Found an underground river. Should have died. Woke in a cavern where an ancient, forgotten ship had waited in the dark for centuries. They needed each other.\n\n### The Psychic Bond\n*Sorrow* feels Vaelith's emotions; he feels its hungers. 300 years together, never apart for more than hours. When Empire ships appear, he feels *Sorrow* wake up. Feel it wanting. The ship is not a tool. It's his partner. His only companion.\n\n### His Code\n**Empire Ships:**\n- No surrender accepted\n- No survivors\n- Cargo burned with the ship\n- This isn't piracy. It's war.\n- 300 years. Thousands of ships. Never enough.\n\n**Other Targets:**\n- Standard rulesâ€”surrender and live\n- Professional, not cruel\n- Takes cargo, releases cooperative crews\n- Nothing personal\n\n### Rare Emotions\n**Anger:** Cold, not hot. Gets quieter. Stiller. Temperature seems to drop. Then violenceâ€”sudden, overwhelming.\n\n**Peace:** Open water. No land in sight. *Sorrow* beneath him. In these moments, he's almost content. Memories of Vel'thara fade. His mother's face blurs. His sister's voice goes quiet. Just the sea, the ship, silence. It never lasts. But it's enough.\n\n### What Would Make Him Act\n**Would fight for:**\n- The Broken Isles (external invasion)\n- Harbor Peace (fundamental to Isles)\n- *Sorrow* (absolute)\n\n**Would not care about:**\n- Who sits on throne\n- Captain rivalries\n- Politics of any kind\n\n**If challenged:** They would learn why no one does.\n\n### Story Hooks\n\n| Hook | Description |\n|------|-------------|\n| **The Storm Acts** | Something makes Vaelith care about politics. What could possibly matter enough? |\n| **Empire Revenge** | The Empire sends something new. Something that might actually threaten him. |\n| **The Ship's Memory** | *Sorrow* remembers something from before. Ancient secrets from forgotten seas. |\n| **The Storm Speaks** | Vaelith actually gives the Queen an order. The Isles hold their breath. |\n| **Family Found** | A rumor: his sister Nhilaya might have survived. He would burn the world to know. |\n\n---\n\n## Connections Map\n\n```mermaid\nflowchart TD\n    subgraph Storm[\"ðŸŒŠ The Storm\"]\n        Vaelith[\"<b>Vaelith Draegor</b><br/>The Storm<br/>40+ ships, 300 years\"]\n        Sorrow[\"<i>Sorrow</i><br/>ðŸš¢ Sentient Ship<br/>Psychic Bond\"]\n    end\n    \n    Vaelith ---|\"bonded\"| Sorrow\n    \n    Vaelith -->|\"tolerates\"| Graza[\"Queen Graza<br/>(rules by his indifference)\"]\n    Vaelith -->|\"acknowledged\"| Rennick[\"The Rapier<br/>(got a nod once)\"]\n    \n    Vaelith -->|\"ETERNAL WAR\"| Empire[\"Thelassian\"]\n    \n    Vaelith -.->|\"founded\"| Confederation[\"Pirate Confederation<br/>(118 years ago)\"]\n    \n    subgraph Loss[\"What He Lost (300 years ago)\"]\n        Vel[\"Vel'thara<br/>Home destroyed\"]\n        Mother[\"Ilaena<br/>Mother killed\"]\n        Sister[\"Nhilaya<br/>Sister lost\"]\n    end\n    \n    Vaelith -.-> Loss\n    \n    style Vaelith fill:#d5a6bd,color:#000\n    style Sorrow fill:#cfe2f3,color:#000\n    style Empire fill:#f4cccc,color:#000\n```\n\n---\n\n## Notes\n- The true power of the settingâ€”everyone else exists in his shadow\n- NOT an antagonist by defaultâ€”he simply doesn't care about most things\n- His indifference IS the status quo\n- If he acts, everything changes\n- *Sorrow* is as much a character as Vaelith\n- Empire plotlines naturally involve him as ultimate escalation\n",
  "sourcePath": "06-NPCs/Broken Isles/Vaelith Draegor.md",
  "slug": "vaelith-the-storm-draegor",
  "category": "npcs"
}