{
  "title": "Vaelandor Shieldsworn",
  "metadata": {
    "Age": "380 years",
    "Race": "High Elf, Male",
    "Role": "Emperor's Personal Bodyguard",
    "Reports To": "Captain Thandril Ironsong",
    "Location": "Within arm's reach of Emperor Valandor"
  },
  "epigraph": "I am the last thing between danger and the Emperor. I will not move.",
  "atAGlance": "Vaelandor Shieldsworn is the Emperor's shadow—where Valandor goes, Vaelandor follows. He stands behind the Eternal Throne during audiences, walks three steps behind the Emperor in corridors, and sleeps in the antechamber outside the Imperial bedchamber. He is the last line of defense, and he has never failed.\n\n---",
  "commonKnowledge": "- Selected from 500 candidates for personal bodyguard role\n- Has served at the Emperor's side for 150 years\n- Survived three assassination attempts on Valandor (stopped all)\n- Sleeps only 4 hours per night (elven discipline)\n\n---\n\nSilent, vigilant, utterly focused. Rarely speaks except to acknowledge orders. Has trained his body to remain motionless for hours while maintaining combat readiness. Shows no personality on duty; off duty (rare), surprisingly warm. The job consumes everything else.\n\n---",
  "secretKnowledge": "He loves the Emperor—not romantically, but with absolute devotion. If ordered to let Valandor die to save the Empire, he would refuse. His duty is to one elf, not to institutions. This may be his greatest strength or greatest weakness.\n\n---",
  "seeAlso": [],
  "rawContent": "# Vaelandor Shieldsworn\n\n**Shield-Bearer** | Eternal Guard\n\n> *\"I am the last thing between danger and the Emperor. I will not move.\"*\n\n| | |\n|---|---|\n| **Age** | 380 years |\n| **Race** | High Elf, Male |\n| **Role** | Emperor's Personal Bodyguard |\n| **Reports To** | Captain Thandril Ironsong |\n| **Location** | Within arm's reach of Emperor Valandor |\n\n---\n\n## Overview\n\nVaelandor Shieldsworn is the Emperor's shadow—where Valandor goes, Vaelandor follows. He stands behind the Eternal Throne during audiences, walks three steps behind the Emperor in corridors, and sleeps in the antechamber outside the Imperial bedchamber. He is the last line of defense, and he has never failed.\n\n---\n\n## Personality & Approach\n\nSilent, vigilant, utterly focused. Rarely speaks except to acknowledge orders. Has trained his body to remain motionless for hours while maintaining combat readiness. Shows no personality on duty; off duty (rare), surprisingly warm. The job consumes everything else.\n\n---\n\n## Key Facts\n\n- Selected from 500 candidates for personal bodyguard role\n- Has served at the Emperor's side for 150 years\n- Survived three assassination attempts on Valandor (stopped all)\n- Sleeps only 4 hours per night (elven discipline)\n\n---\n\n## Secret (DM Only)\n\nHe loves the Emperor—not romantically, but with absolute devotion. If ordered to let Valandor die to save the Empire, he would refuse. His duty is to one elf, not to institutions. This may be his greatest strength or greatest weakness.\n\n---\n\n## Connections\n\n- **Thandril Ironsong**: Commander - Absolute obedience\n- **Emperor Valandor**: Ward - His entire purpose\n- **Miravel Dawnseeker**: Colleague - Both serve the Emperor directly\n",
  "sourcePath": "06-NPCs/Thelassian/Vaelandor Shieldsworn.md",
  "slug": "vaelandor-shieldsworn",
  "category": "npcs"
}