{
  "title": "Velindor Shadowmere",
  "metadata": {
    "Age": "500+ years (exact age unknown)",
    "Race": "High Elf, Male",
    "Title": "Master of Whispers",
    "Reports To": "Emperor Valandor directly",
    "Location": "Unknown (no official office)"
  },
  "atAGlance": "**Velindor Shadowmere** - Master of Whispers, \"The Unseen Hand\"\n\n- The Empire's spymaster, running intelligence operations for over 400 years\n- Reports directly to Emperor Valandor‚Äîno Pillar commands him\n- Knows secrets about everyone, including the Four Pillars\n- Rarely seen in public; when he appears, something significant is happening\n- *Common saying: \"Shadowmere knows. He always knows.\"*\n\n| | |\n|---|---|\n| **Age** | 500+ years (exact age unknown) |\n| **Race** | High Elf, Male |\n| **Title** | Master of Whispers |\n| **Reports To** | Emperor Valandor directly |\n| **Location** | Unknown (no official office) |\n\n---",
  "commonKnowledge": "### Appearance & Manner\nUnremarkable by design. Average height, average build, features that slide from memory moments after seeing him. Dresses in muted greys and deep blues‚Äînever the whites and silvers of the court. Moves silently, appears without warning, speaks softly. The most dangerous elf in Aelindor looks like a minor clerk.\n\n### Personality (Public)\nPolite, soft-spoken, forgettable. Never threatens‚Äîhe doesn't need to. Asks questions that seem innocent until you realize what you've revealed. Shows no emotion: not anger, not pleasure, not surprise. Some wonder if he feels anything at all.\n\n### Role & Methods\n- **Intelligence gathering**: Network of agents across the Empire and beyond\n- **Counter-espionage**: Identifying and neutralizing foreign spies\n- **Internal security**: Monitoring potential threats within the Empire\n- **Information control**: Deciding what the Emperor knows and when\n\n### Known Operations\nNo one knows his operations‚Äîthat's the point. But outcomes are attributed to him:\n- The exposure of a Aloria spy ring (200 years ago)\n- The \"suicide\" of a noble planning rebellion (150 years ago)\n- The mysterious deaths of three drow who infiltrated Aelindor (80 years ago)\n- Information that led to discovering Thaelen's defection\n\n### Relationship with the Pillars\nHe is not a Pillar. He answers to none of them. This creates tension:\n- **Caerwyn**: Respects his effectiveness, dislikes his independence\n- **Thaelorin**: Uneasy alliance‚ÄîShadowmere provides information, expects records access\n- **Isileth**: Complicated‚Äîtheir domains overlap in foreign affairs\n- **Faendril**: Professional cooperation on economic intelligence\n\n---",
  "secretKnowledge": "### True Nature\nVelindor Shadowmere is exactly as dangerous as rumored‚Äîpossibly more. He has served four roles across his career: assassin, spy, handler, and now spymaster. He has personally killed 47 elves and an unknown number of non-elves. He feels no guilt because he believes absolutely in the Empire's necessity.\n\nBut he is not a monster. He is a patriot who does monstrous things so others don't have to. He takes no pleasure in killing‚Äîit's simply a tool. He would sacrifice himself for the Empire without hesitation. He would sacrifice anyone else just as readily.\n\n### What He Actually Knows\n\n**About the Dragon War:**\nHis archives contain evidence that the drow experiments may have been sponsored by elven nobles seeking to control dragons. The drow were tools, not masterminds. He has never shared this with anyone‚Äînot even Valandor. The truth would destabilize everything.\n\n**About Thaelen's Defection:**\nHe knew Thaelen was falling in love with Vera. He could have intervened. He chose not to‚Äîpartly as a test of Thaelen's loyalty, partly because he was curious what would happen. He considers this his greatest intelligence failure and his most interesting experiment.\n\n**About the Pillars:**\n- Caerwyn's secret sympathy for Thaelen\n- Thaelorin's hidden doubts about the drow policy\n- Isileth's prophetic visions she hasn't shared\n- Faendril's quiet reforms in the Office of Lesser Peoples\n\n**About Veraheim:**\nHe has agents in Veraheim. He's had agents there for 80 years. Vera suspects but can't prove it. He's genuinely impressed by what she's built. In another life, he might have admired her openly.\n\n### His Network\n- **The Whispered**: Elite agents, deep cover operatives\n- **The Listeners**: Information gatherers, not operatives\n- **The Forgotten**: Sleeper agents, activated only for critical missions\n- **The Dead**: Agents who \"died\" and now operate with new identities\n\n### What He Wants\n- The Empire's security and stability\n- To know everything (knowledge is control)\n- A worthy successor (hasn't found one in 400 years)\n- Perhaps: to understand why Thaelen chose love over duty\n\n### What He Fears\n- A secret he doesn't know exists\n- His network being compromised\n- Dying before training a replacement\n- The Dragon War truth emerging without his control\n\n### The Question He Can't Answer\nWhy does he serve? He's had opportunities to seize power, to become a Pillar, to manipulate the Emperor. He's chosen not to. Is it loyalty? Duty? Habit? After 400 years, he's not sure anymore.\n\n### Story Hooks\n\n| Hook | Description |\n|------|-------------|\n| **The Recruitment** | Shadowmere approaches a PC. He wants them for a mission. Refusing has consequences. |\n| **The Leak** | Someone is feeding information to enemies. Shadowmere suspects a Pillar. He needs outside investigators. |\n| **The Defector** | One of his agents wants out. They know too much to simply leave. |\n| **The Truth** | He decides to reveal the Dragon War secret‚Äîbut only to PCs who can handle it. |\n| **The Succession** | He's dying (poison? age? magical disease?) and needs to choose a successor. Fast. |\n| **The Veraheim File** | His dossier on Veraheim goes missing. Someone took it. Who? Why? |\n\n---",
  "seeAlso": [],
  "rawContent": "# Velindor Shadowmere\n\n## At a Glance\n> **What court insiders would know**\n\n**Velindor Shadowmere** - Master of Whispers, \"The Unseen Hand\"\n\n- The Empire's spymaster, running intelligence operations for over 400 years\n- Reports directly to Emperor Valandor‚Äîno Pillar commands him\n- Knows secrets about everyone, including the Four Pillars\n- Rarely seen in public; when he appears, something significant is happening\n- *Common saying: \"Shadowmere knows. He always knows.\"*\n\n| | |\n|---|---|\n| **Age** | 500+ years (exact age unknown) |\n| **Race** | High Elf, Male |\n| **Title** | Master of Whispers |\n| **Reports To** | Emperor Valandor directly |\n| **Location** | Unknown (no official office) |\n\n---\n\n## Common Knowledge\n> **What those who deal with intelligence matters would know**\n\n### Appearance & Manner\nUnremarkable by design. Average height, average build, features that slide from memory moments after seeing him. Dresses in muted greys and deep blues‚Äînever the whites and silvers of the court. Moves silently, appears without warning, speaks softly. The most dangerous elf in Aelindor looks like a minor clerk.\n\n### Personality (Public)\nPolite, soft-spoken, forgettable. Never threatens‚Äîhe doesn't need to. Asks questions that seem innocent until you realize what you've revealed. Shows no emotion: not anger, not pleasure, not surprise. Some wonder if he feels anything at all.\n\n### Role & Methods\n- **Intelligence gathering**: Network of agents across the Empire and beyond\n- **Counter-espionage**: Identifying and neutralizing foreign spies\n- **Internal security**: Monitoring potential threats within the Empire\n- **Information control**: Deciding what the Emperor knows and when\n\n### Known Operations\nNo one knows his operations‚Äîthat's the point. But outcomes are attributed to him:\n- The exposure of a Aloria spy ring (200 years ago)\n- The \"suicide\" of a noble planning rebellion (150 years ago)\n- The mysterious deaths of three drow who infiltrated Aelindor (80 years ago)\n- Information that led to discovering Thaelen's defection\n\n### Relationship with the Pillars\nHe is not a Pillar. He answers to none of them. This creates tension:\n- **Caerwyn**: Respects his effectiveness, dislikes his independence\n- **Thaelorin**: Uneasy alliance‚ÄîShadowmere provides information, expects records access\n- **Isileth**: Complicated‚Äîtheir domains overlap in foreign affairs\n- **Faendril**: Professional cooperation on economic intelligence\n\n---\n\n## Secret Knowledge\n> **DM-only information**\n\n### True Nature\nVelindor Shadowmere is exactly as dangerous as rumored‚Äîpossibly more. He has served four roles across his career: assassin, spy, handler, and now spymaster. He has personally killed 47 elves and an unknown number of non-elves. He feels no guilt because he believes absolutely in the Empire's necessity.\n\nBut he is not a monster. He is a patriot who does monstrous things so others don't have to. He takes no pleasure in killing‚Äîit's simply a tool. He would sacrifice himself for the Empire without hesitation. He would sacrifice anyone else just as readily.\n\n### What He Actually Knows\n\n**About the Dragon War:**\nHis archives contain evidence that the drow experiments may have been sponsored by elven nobles seeking to control dragons. The drow were tools, not masterminds. He has never shared this with anyone‚Äînot even Valandor. The truth would destabilize everything.\n\n**About Thaelen's Defection:**\nHe knew Thaelen was falling in love with Vera. He could have intervened. He chose not to‚Äîpartly as a test of Thaelen's loyalty, partly because he was curious what would happen. He considers this his greatest intelligence failure and his most interesting experiment.\n\n**About the Pillars:**\n- Caerwyn's secret sympathy for Thaelen\n- Thaelorin's hidden doubts about the drow policy\n- Isileth's prophetic visions she hasn't shared\n- Faendril's quiet reforms in the Office of Lesser Peoples\n\n**About Veraheim:**\nHe has agents in Veraheim. He's had agents there for 80 years. Vera suspects but can't prove it. He's genuinely impressed by what she's built. In another life, he might have admired her openly.\n\n### His Network\n- **The Whispered**: Elite agents, deep cover operatives\n- **The Listeners**: Information gatherers, not operatives\n- **The Forgotten**: Sleeper agents, activated only for critical missions\n- **The Dead**: Agents who \"died\" and now operate with new identities\n\n### What He Wants\n- The Empire's security and stability\n- To know everything (knowledge is control)\n- A worthy successor (hasn't found one in 400 years)\n- Perhaps: to understand why Thaelen chose love over duty\n\n### What He Fears\n- A secret he doesn't know exists\n- His network being compromised\n- Dying before training a replacement\n- The Dragon War truth emerging without his control\n\n### The Question He Can't Answer\nWhy does he serve? He's had opportunities to seize power, to become a Pillar, to manipulate the Emperor. He's chosen not to. Is it loyalty? Duty? Habit? After 400 years, he's not sure anymore.\n\n### Story Hooks\n\n| Hook | Description |\n|------|-------------|\n| **The Recruitment** | Shadowmere approaches a PC. He wants them for a mission. Refusing has consequences. |\n| **The Leak** | Someone is feeding information to enemies. Shadowmere suspects a Pillar. He needs outside investigators. |\n| **The Defector** | One of his agents wants out. They know too much to simply leave. |\n| **The Truth** | He decides to reveal the Dragon War secret‚Äîbut only to PCs who can handle it. |\n| **The Succession** | He's dying (poison? age? magical disease?) and needs to choose a successor. Fast. |\n| **The Veraheim File** | His dossier on Veraheim goes missing. Someone took it. Who? Why? |\n\n---\n\n## Connections Map\n\n```mermaid\nflowchart TD\n    subgraph Shadows[\"üï∑Ô∏è The Intelligence Web\"]\n        Velindor[\"<b>Velindor Shadowmere</b><br/>Master of Whispers\"]\n    end\n    \n    Velindor -->|\"reports only to\"| Valandor[\"Emperor Valandor\"]\n    \n    subgraph Network[\"His Assets\"]\n        Whispered[\"The Whispered<br/>(Elite Operatives)\"]\n        Listeners[\"The Listeners<br/>(Information)\"]\n        Forgotten[\"The Forgotten<br/>(Sleepers)\"]\n    end\n    \n    Velindor --> Network\n    \n    Velindor -.->|\"watches\"| Pillars[\"All Four Pillars\"]\n    Velindor -.->|\"agents in\"| Veraheim[\"Veraheim\"]\n    Velindor -.->|\"hides truth about\"| DragonWar[\"Dragon War\"]\n    \n    subgraph Knows[\"What He Knows\"]\n        Secret1[\"Caerwyn's sympathy\"]\n        Secret2[\"Thaelorin's doubts\"]\n        Secret3[\"Isileth's visions\"]\n        Secret4[\"Faendril's reforms\"]\n    end\n    \n    Velindor -.-> Knows\n    \n    style Velindor fill:#4a4a4a,color:#fff\n    style DragonWar fill:#f4cccc,color:#000\n    style Veraheim fill:#d9ead3,color:#000\n```\n\n---\n\n## Notes\n- The most dangerous NPC in the Empire who isn't a Pillar\n- Can be patron, antagonist, or information source\n- His secrets are campaign-changing\n- Use sparingly‚Äîwhen he appears, it matters\n- He's not evil, but he's done evil things for \"good\" reasons\n",
  "sourcePath": "06-NPCs/Thelassian/Velindor Shadowmere.md",
  "slug": "velindor-shadowmere",
  "category": "npcs"
}