{
  "title": "Copperhill",
  "metadata": {
    "Type": "Settlement",
    "Location": "Ashfeld domain, at the base of Veraheim's cliffs",
    "Population": "~400",
    "Lord": "[[Lord Robert Ashfeld]]",
    "Function": "Waystation for Veraheim traffic"
  },
  "epigraph": "Copper's gone. Now we mine the travelers.",
  "atAGlance": "An old copper mining town at the foot of Veraheim's lifts. The mine dried up two generations ago, but the location kept the town alive. Now Copperhill exists to service the traffic going up and down.\n\n**Two economies, one town:**\n- **The workers' quarter**: Cheap bunks for humans who commute up the lifts daily. Wake before dawn, work in Veraheim, return at sunset. Functional, crowded, no frills.\n- **The merchant quarter**: Inns and stables for traders waiting their turn at the lifts. Better beds, hot meals, secure storage for goods.\n\n---",
  "commonKnowledge": "### The Layout\n\nCopperhill sits where the road from Ashfeld meets the base of Veraheim's eastern cliffs. The East Lift rises 500 feet directly above the town.\n\n**The workers' quarter:**\n- Bunkhouses rented by the week\n- Cheap food stalls open before dawn\n- Workers walk to the lift base each morning\n- Returns at sunset, exhausted\n\n**The merchant quarter:**\n- The Copper Crown Inn (best rooms, merchant clientele)\n- Several smaller inns and taverns\n- Stables and warehouses for goods awaiting lift transport\n- Lift ticket offices and customs agents\n\n### The Economy\n\nCopperhill has no real industry of its own. The copper's gone. What remains is location.\n\n- First and last stop before Veraheim\n- Lift tickets arranged here\n- Goods stored while awaiting transport up\n- Workers rent beds by the week\n- Everyone's either coming or going\n\n**The old mine**: Abandoned tunnels on the hillside. Local kids dare each other to explore. Occasionally someone claims to have found a remaining vein. They're always wrong.\n\n### The Commuters\n\nHundreds of Ashfeld humans work in Veraheim but can't or won't live there:\n- Some can't meet contribution requirements for housing\n- Some prefer to keep families in Aloria\n- Some just want to go home each night\n\nThey do the jobs Veraheim needs but doesn't glamorize: hauling cargo, cleaning, basic labor. The lifts run early for them.\n\n---",
  "secretKnowledge": "### Lord Ashfeld's Eyes\n\nRobert Ashfeld is obsessed with Veraheim. Copperhill is his listening post.\n\n- Several innkeepers report to his agents\n- Merchant gossip flows back to Ashfeld castle\n- Commuters are occasionally questioned about what they saw\n- The town constable is loyal to Ashfeld, not the King\n\n**What he's learning**: Trade volumes, guard rotations, who visits, who leaves. Nothing actionable yet—but he's building a picture.\n\n### The Tunnels\n\nThe old copper mine is more extensive than people think. Some tunnels run close to Veraheim's territory—not into the city, but near the cliff base.\n\n**The rumor**: Someone could get into Veraheim without using the lifts.\n\n**The truth**: The tunnels dead-end. There's no secret entrance. But Ashfeld doesn't know that for certain, and he's had people exploring.\n\n### Plot Hooks\n\n| Hook | Description |\n|------|-------------|\n| **The Informant** | A commuter sees something in Veraheim they shouldn't. Ashfeld's agents are interested. |\n| **Tunnel Trouble** | Something is living in the old mine. The explorers Ashfeld sent haven't come back. |\n| **Worker Strike** | Copperhill's commuters demand better conditions. Veraheim's labor supply is threatened. |\n| **The Copper Crown** | The inn's owner is playing both sides—reporting to Ashfeld while selling information to Veraheim's guard. |\n\n---",
  "seeAlso": [
    "Veraheim",
    "Lord Robert Ashfeld",
    "The Eleven Domains",
    "Aloria"
  ],
  "rawContent": "# Copperhill\n\n> *\"Copper's gone. Now we mine the travelers.\"*\n\n| | |\n|---|---|\n| **Type** | Settlement |\n| **Location** | Ashfeld domain, at the base of Veraheim's cliffs |\n| **Population** | ~400 |\n| **Lord** | [Lord Robert Ashfeld](/npcs/lord-robert-ashfeld) |\n| **Function** | Waystation for Veraheim traffic |\n\n---\n\n## At a Glance\n\nAn old copper mining town at the foot of Veraheim's lifts. The mine dried up two generations ago, but the location kept the town alive. Now Copperhill exists to service the traffic going up and down.\n\n**Two economies, one town:**\n- **The workers' quarter**: Cheap bunks for humans who commute up the lifts daily. Wake before dawn, work in Veraheim, return at sunset. Functional, crowded, no frills.\n- **The merchant quarter**: Inns and stables for traders waiting their turn at the lifts. Better beds, hot meals, secure storage for goods.\n\n---\n\n## Common Knowledge\n\n### The Layout\n\nCopperhill sits where the road from Ashfeld meets the base of Veraheim's eastern cliffs. The East Lift rises 500 feet directly above the town.\n\n**The workers' quarter:**\n- Bunkhouses rented by the week\n- Cheap food stalls open before dawn\n- Workers walk to the lift base each morning\n- Returns at sunset, exhausted\n\n**The merchant quarter:**\n- The Copper Crown Inn (best rooms, merchant clientele)\n- Several smaller inns and taverns\n- Stables and warehouses for goods awaiting lift transport\n- Lift ticket offices and customs agents\n\n### The Economy\n\nCopperhill has no real industry of its own. The copper's gone. What remains is location.\n\n- First and last stop before Veraheim\n- Lift tickets arranged here\n- Goods stored while awaiting transport up\n- Workers rent beds by the week\n- Everyone's either coming or going\n\n**The old mine**: Abandoned tunnels on the hillside. Local kids dare each other to explore. Occasionally someone claims to have found a remaining vein. They're always wrong.\n\n### The Commuters\n\nHundreds of Ashfeld humans work in Veraheim but can't or won't live there:\n- Some can't meet contribution requirements for housing\n- Some prefer to keep families in Aloria\n- Some just want to go home each night\n\nThey do the jobs Veraheim needs but doesn't glamorize: hauling cargo, cleaning, basic labor. The lifts run early for them.\n\n---\n\n## Secret Knowledge\n> **DM-only information**\n\n### Lord Ashfeld's Eyes\n\nRobert Ashfeld is obsessed with Veraheim. Copperhill is his listening post.\n\n- Several innkeepers report to his agents\n- Merchant gossip flows back to Ashfeld castle\n- Commuters are occasionally questioned about what they saw\n- The town constable is loyal to Ashfeld, not the King\n\n**What he's learning**: Trade volumes, guard rotations, who visits, who leaves. Nothing actionable yet—but he's building a picture.\n\n### The Tunnels\n\nThe old copper mine is more extensive than people think. Some tunnels run close to Veraheim's territory—not into the city, but near the cliff base.\n\n**The rumor**: Someone could get into Veraheim without using the lifts.\n\n**The truth**: The tunnels dead-end. There's no secret entrance. But Ashfeld doesn't know that for certain, and he's had people exploring.\n\n### Plot Hooks\n\n| Hook | Description |\n|------|-------------|\n| **The Informant** | A commuter sees something in Veraheim they shouldn't. Ashfeld's agents are interested. |\n| **Tunnel Trouble** | Something is living in the old mine. The explorers Ashfeld sent haven't come back. |\n| **Worker Strike** | Copperhill's commuters demand better conditions. Veraheim's labor supply is threatened. |\n| **The Copper Crown** | The inn's owner is playing both sides—reporting to Ashfeld while selling information to Veraheim's guard. |\n\n---\n\n## See Also\n\n- [Veraheim](/factions/veraheim-the-sanctuary) - The city above\n- [Lord Robert Ashfeld](/npcs/lord-robert-ashfeld) - The domain's lord\n- [The Eleven Domains](/factions/the-eleven-domains) - All Alorian domains\n- [Aloria](/factions/aloria) - The kingdom\n\n---\n\n*\"Copperhill doesn't make anything. It just makes sure you're ready for what's next.\"*\n",
  "sourcePath": "02-Geography/Copperhill.md",
  "slug": "copperhill",
  "category": "geography"
}