{
  "title": "Dragon Ecology",
  "metadata": {
    "Type": "Reference Document",
    "Population": "~30-50 dragons (estimated)",
    "Location": "Northwestern mountains",
    "Status": "Self-isolated for 400 years",
    "Related": "[[The Elves-Dragon War]], [[Thorongil (Vaethor)]]"
  },
  "epigraph": "We are not pets. We are not weapons. We are the oldest wisdom, and we choose our own fates.",
  "atAGlance": "Dragons are the most powerful beings in Exilium‚Äîand the most mysterious.\n\nThey live in the northwestern mountains, have for millennia, and haven't willingly spoken to elves since the Dragon War 400 years ago. What little is known comes from ancient texts, Thorongil's existence as the last bonded dragon, and occasional distant sightings.\n\nThey are not beasts. They are intelligent, ancient, and have their own society that predates elven civilization. They simply choose not to share it.\n\n*Common saying: \"Dragons don't need us. They never did. The bonding was their gift‚Äîand we broke it.\"*\n\n---",
  "commonKnowledge": "### Physical Characteristics\n\n**Size Range:**\n- Hatchlings: 4-6 feet long\n- Juveniles: 15-25 feet\n- Adults: 30-50 feet (Thorongil is 38 feet)\n- Ancient Elders: 60-80 feet (rarely seen)\n\n**Lifespan:**\n- Hatchling (0-50 years): Learning, growing, protected by parents\n- Juvenile (50-150 years): Testing boundaries, first flights beyond territory\n- Young Adult (150-400 years): Establishing territory, potential bonding age\n- Adult (400-800 years): Prime of life, full powers\n- Elder (800-1200+ years): Wisdom phase, council participation, reduced activity\n- Ancient (1200+ years): Extremely rare, legendary figures\n\n**Breath Types** (varies by individual, not subspecies):\n- Cold (most common) - paralyzing gas, freezing breath\n- Fire (second most common)\n- Lightning (rare)\n- Acid (rare)\n- Mixed capabilities (very rare, marks exceptional individuals)\n\n### Diet and Hunting\n\n**Dragons are apex predators** who require substantial prey:\n\n**Primary Food Sources:**\n- Large mountain game: elk, wild boar, mountain goats, bears\n- Megafauna: rare giant elk, cave bears, woolly creatures in high peaks\n- Sea creatures: whales, giant squid, large sharks (coastal dragons)\n- Occasional livestock from lowlands\n\n**Hunting Territory:**\n- Each adult dragon claims a territory of roughly 50-100 square miles\n- Territories are defended fiercely against other dragons\n- Territory size limits dragon population naturally\n- The northwestern mountains support ~30-50 dragons sustainably\n\n**Feeding Frequency:**\n- Juveniles: Every few days (growing rapidly)\n- Adults: Every 1-2 weeks for a major hunt\n- Elders: Monthly or less (metabolisms slow with age)\n\n**Why They Avoid Civilization:**\n- Hunting near settlements causes conflict\n- Easier prey exists in mountains (wild herds, isolation)\n- Pride‚Äîdragons don't beg or steal\n- Historical trauma from the war\n\n### Thorongil's Arrangement\n\n**How Veraheim's dragon feeds:**\n\nThorongil's situation is unique. He can't access traditional dragon hunting grounds (other dragons would attack a traitor). His arrangement:\n\n1. **Mountain Hunting** (primary): Wild game in the Shieldwall mountains around Veraheim\n2. **\"Tribute\" Livestock** (supplemental): Both the Empire and Kingdom quietly \"lose\" livestock to \"mountain predators\"\n3. **Sea Hunting** (occasional): Flights to the coast for whales and large fish\n4. **Understood Limits**: Never takes from small farms or poor settlements\n\n**The unspoken deal:** Trade caravans passing through the tunnel sometimes \"mysteriously\" lose a cow or two. Merchants factor this into costs. No one complains because the alternative is no dragon protection.\n\n### Society Structure\n\n**Dragon society is loosely organized:**\n\n**The Elder Council:**\n- Oldest dragons (800+ years) form an informal governing body\n- Meets rarely (decades between gatherings)\n- Decides matters affecting all dragons: territory disputes, responses to threats\n- No single leader‚Äîdecisions by consensus among those who care to attend\n\n**Social Organization:**\n- Dragons are primarily **solitary** (territorial needs)\n- Mated pairs share territory but often maintain separate lairs\n- Parents raise hatchlings together until juvenile phase (~50 years)\n- Juveniles leave to establish own territories or die trying\n- Elders sometimes gather for philosophical discussion\n\n**Communication:**\n- Draconic language (complex, includes subsonic tones humans can't hear)\n- Telepathic bonding (with chosen individuals‚Äîhistorically elves)\n- Territorial markers (scent, claw marks, magic-infused warnings)\n- Long-range calls (can be heard for miles)\n\n---",
  "secretKnowledge": "### The Retreat After the War\n\n**What really happened 400 years ago:**\n\nThe Dragon War killed dozens of dragons‚Äîmany at the hands of their own former bond-partners when the bonds shattered. The survivors retreated to the mountains with one decree from the Elder Council:\n\n**\"No more bonds. No more trust. No more contact.\"**\n\nFor 400 years, they've held to this:\n- Young dragons who suggest approaching elves are shunned\n- Thorongil is considered the ultimate traitor (bonded to an elf, killed dragons, lives among \"the lesser races\")\n- Some dragons have died of the loneliness‚Äîthe species is social despite its solitary nature\n\n**The hidden truth:**\n- Some elders know the truth‚Äîdrow, not elves, caused the war\n- They haven't shared this widely (admitting the war was based on error is painful)\n- A few younger dragons wonder if reconciliation is possible\n- The oldest dragon, **Vaemorthax**, remembers before the war and grieves privately\n\n### Dragon Psychology\n\n**What drives them:**\n\n**Pride:** Dragons consider themselves the pinnacle of creation. Not arrogant‚Äîfactual. They're the oldest sapient species, the most powerful, the wisest (in their view).\n\n**Longevity:** Living 1000+ years creates alien perspectives. A dragon's \"recent memory\" might be 200 years ago. They plan in centuries.\n\n**Territory:** Not greed‚Äînecessity. Dragons need space to hunt, to think, to exist. Crowding makes them violent.\n\n**Purpose:** Dragons fear meaninglessness more than death. A dragon with no purpose‚Äîno mate, no offspring, no project, no bond‚Äîbecomes dangerous or despondent.\n\n**The Bonding Mystery:**\n- Dragons still don't fully understand why bonds formed with elves\n- Something in elven minds was compatible‚Äîlong lives, magical affinity\n- Bonds were **chosen**, never forced\n- The torture in the war was an abomination‚Äîforcing bonds is like magical rape\n- Young dragons sometimes dream of bonding and wake ashamed\n\n### The Current Political Situation\n\n**Inside the mountains:**\n\n**Isolationist Majority** (~20 dragons):\n- \"The lesser races proved their nature. Stay away.\"\n- Led informally by **Vaemorthax** (1400+ years, oldest living dragon)\n- Will attack any dragon who suggests contact\n\n**Curious Minority** (~8 dragons):\n- Younger adults (200-400 years) who never knew bonds\n- Wonder if the punishment has gone on long enough\n- Secretly interested in what Thorongil chose\n- No leader‚Äîtoo dangerous to organize openly\n\n**The Undecided** (~10 dragons):\n- Elders who remember bonds and miss them\n- Adults who are simply tired of isolation\n- Won't act but might support change if someone else moves first\n\n**The Unknown Factor:**\n- 400 years of isolation may have produced dragons no one knows about\n- Rumored hatchlings raised in complete secrecy by isolationist parents\n- Possible small groups who've left the mountains entirely (no confirmation)\n\n### Thorongil's Status\n\n**Among his own kind:**\n\nThorongil is the dragon equivalent of a war criminal who defected to the enemy:\n- Fought against his own kind\n- Maintained a bond when others died or broke them\n- Lives among \"lesser races\" by choice\n- Has never returned to the mountains in 400 years\n\n**What other dragons think:**\n- Isolationists: Would kill him on sight\n- Curious minority: Fascinated but won't admit it\n- Elders who knew him: Grief, betrayal, confusion\n\n**What Thorongil thinks:**\n- He chose his bond over his species\n- They're right to call him traitor\n- He wouldn't change his choice\n- He's desperately lonely for dragon contact\n- Sometimes flies toward the mountains, stops before he's visible\n\n### Potential Storylines\n\n**The Dragon Emissary:**\nA young dragon approaches Veraheim. The isolationists want them dead. The curious minority wants to see what happens. Is it a trap, a peace offer, or a rogue acting alone?\n\n**Vaemorthax's Decision:**\nThe oldest dragon is dying. Before death, they might share the truth about the war. This could change everything‚Äîor spark dragon civil war.\n\n**The Lost Clutch:**\nRumors of dragon eggs hidden outside the mountains. If true, they could be raised without isolationist influence‚Äîor exploited by the powers.\n\n**Thorongil's Return:**\nSomething forces Thorongil to enter dragon territory. How do his people react? Can Thaelen follow? What happens to Veraheim without its protector?\n\n### What the Powers Know\n\n**Thelassian:**\n- Caerwyn (High Warden) has scouts watching the mountain borders\n- Isileth (Starwarden) believes reconciliation is possible‚Äîeventually\n- Velindor (Spymaster) has tried to contact dragons. Agents don't return.\n- Official policy: Dragons are a closed chapter\n\n**Aloria:**\n- Most Lords consider dragons legends or exaggerations\n- Lord Eisenwald believes a dragon could be captured and used (he's a fool)\n- The King knows better‚Äîhis grandfather met Thorongil\n- Official policy: Ignore them and hope they keep ignoring us\n\n**Broken Isles:**\n- Vaelith Draegor (drow) knows what drow did 400 years ago\n- Some orc shamans claim to speak with \"dragon spirits\" (unverified)\n- Practical pirates don't sail near the northwestern coasts\n\n### Plot Hooks\n\n| Hook | Description |\n|------|-------------|\n| **The Messenger** | A young dragon lands near Veraheim with a message for Thorongil. The isolationists are coming to kill them. Protect the messenger? |\n| **The Truth Spreads** | Someone found records proving drow caused the war. If dragons learn the truth from the wrong source, it could mean war with drow survivors everywhere. |\n| **Vaemorthax Dying** | The oldest dragon sends word: they want to speak to Thorongil before death. Is it reconciliation or trap? |\n| **Egg Hunters** | Lord Eisenwald funded an expedition to find dragon eggs. They might succeed. The consequences would be catastrophic. |\n| **The Bond Dreams** | A young elf in Veraheim is having dreams about dragons. Real contact, or wishful thinking? Dragons in the mountains are having the same dreams. |\n| **Civil War** | The curious minority makes a move. The isolationists respond. Dragons fighting dragons near the Thelassian‚Äîeveryone gets involved. |\n\n---",
  "connections": "flowchart TD\n    subgraph Mountains[\"üèîÔ∏è Northwestern Mountains\"]\n        Elders[\"Elder Council<br/>(Vaemorthax leads)\"]\n        Isolationists[\"Isolationist Majority<br/>(~20 dragons)\"]\n        Curious[\"Curious Minority<br/>(~8 younger dragons)\"]\n    end\n\n    Elders -->|\"enforces\"| Isolation[\"400-Year Isolation\"]\n    Isolationists -->|\"supports\"| Isolation\n    Curious -.->|\"questions\"| Isolation\n\n    Thorongil[\"Thorongil<br/>(Veraheim)\"] -.->|\"exile from\"| Mountains\n    Thorongil -.->|\"considered traitor by\"| Isolationists\n    Thorongil -.->|\"fascinates\"| Curious\n\n    subgraph External[\"üåç The Powers\"]\n        Empire[\"Thelassian<br/>(wants reconciliation)\"]\n        Kingdom[\"Aloria<br/>(ignorant)\"]\n        Veraheim[\"Veraheim<br/>(hosts Thorongil)\"]\n    end\n\n    Mountains -.->|\"no contact\"| External\n\n    style Mountains fill:#e8d5b7,color:#000\n    style Thorongil fill:#cfe2f3,color:#000\n    style Isolation fill:#f4cccc,color:#000",
  "seeAlso": [
    "Thorongil (Vaethor)",
    "The Elves-Dragon War",
    "Thaelen Ruincalen",
    "Drow Persecution"
  ],
  "rawContent": "# Dragon Ecology\n\n> *\"We are not pets. We are not weapons. We are the oldest wisdom, and we choose our own fates.\"*\n\n| | |\n|---|---|\n| **Type** | Reference Document |\n| **Population** | ~30-50 dragons (estimated) |\n| **Location** | Northwestern mountains |\n| **Status** | Self-isolated for 400 years |\n| **Related** | [The Elves-Dragon War](/history/the-elves-dragon-war), [Thorongil (Vaethor)](/npcs/thorongil-vaethor) |\n\n---\n\n## At a Glance\n> **What scholars and travelers would know**\n\nDragons are the most powerful beings in Exilium‚Äîand the most mysterious.\n\nThey live in the northwestern mountains, have for millennia, and haven't willingly spoken to elves since the Dragon War 400 years ago. What little is known comes from ancient texts, Thorongil's existence as the last bonded dragon, and occasional distant sightings.\n\nThey are not beasts. They are intelligent, ancient, and have their own society that predates elven civilization. They simply choose not to share it.\n\n*Common saying: \"Dragons don't need us. They never did. The bonding was their gift‚Äîand we broke it.\"*\n\n---\n\n## Common Knowledge\n> **What educated people would know**\n\n### Physical Characteristics\n\n**Size Range:**\n- Hatchlings: 4-6 feet long\n- Juveniles: 15-25 feet\n- Adults: 30-50 feet (Thorongil is 38 feet)\n- Ancient Elders: 60-80 feet (rarely seen)\n\n**Lifespan:**\n- Hatchling (0-50 years): Learning, growing, protected by parents\n- Juvenile (50-150 years): Testing boundaries, first flights beyond territory\n- Young Adult (150-400 years): Establishing territory, potential bonding age\n- Adult (400-800 years): Prime of life, full powers\n- Elder (800-1200+ years): Wisdom phase, council participation, reduced activity\n- Ancient (1200+ years): Extremely rare, legendary figures\n\n**Breath Types** (varies by individual, not subspecies):\n- Cold (most common) - paralyzing gas, freezing breath\n- Fire (second most common)\n- Lightning (rare)\n- Acid (rare)\n- Mixed capabilities (very rare, marks exceptional individuals)\n\n### Diet and Hunting\n\n**Dragons are apex predators** who require substantial prey:\n\n**Primary Food Sources:**\n- Large mountain game: elk, wild boar, mountain goats, bears\n- Megafauna: rare giant elk, cave bears, woolly creatures in high peaks\n- Sea creatures: whales, giant squid, large sharks (coastal dragons)\n- Occasional livestock from lowlands\n\n**Hunting Territory:**\n- Each adult dragon claims a territory of roughly 50-100 square miles\n- Territories are defended fiercely against other dragons\n- Territory size limits dragon population naturally\n- The northwestern mountains support ~30-50 dragons sustainably\n\n**Feeding Frequency:**\n- Juveniles: Every few days (growing rapidly)\n- Adults: Every 1-2 weeks for a major hunt\n- Elders: Monthly or less (metabolisms slow with age)\n\n**Why They Avoid Civilization:**\n- Hunting near settlements causes conflict\n- Easier prey exists in mountains (wild herds, isolation)\n- Pride‚Äîdragons don't beg or steal\n- Historical trauma from the war\n\n### Thorongil's Arrangement\n\n**How Veraheim's dragon feeds:**\n\nThorongil's situation is unique. He can't access traditional dragon hunting grounds (other dragons would attack a traitor). His arrangement:\n\n1. **Mountain Hunting** (primary): Wild game in the Shieldwall mountains around Veraheim\n2. **\"Tribute\" Livestock** (supplemental): Both the Empire and Kingdom quietly \"lose\" livestock to \"mountain predators\"\n3. **Sea Hunting** (occasional): Flights to the coast for whales and large fish\n4. **Understood Limits**: Never takes from small farms or poor settlements\n\n**The unspoken deal:** Trade caravans passing through the tunnel sometimes \"mysteriously\" lose a cow or two. Merchants factor this into costs. No one complains because the alternative is no dragon protection.\n\n### Society Structure\n\n**Dragon society is loosely organized:**\n\n**The Elder Council:**\n- Oldest dragons (800+ years) form an informal governing body\n- Meets rarely (decades between gatherings)\n- Decides matters affecting all dragons: territory disputes, responses to threats\n- No single leader‚Äîdecisions by consensus among those who care to attend\n\n**Social Organization:**\n- Dragons are primarily **solitary** (territorial needs)\n- Mated pairs share territory but often maintain separate lairs\n- Parents raise hatchlings together until juvenile phase (~50 years)\n- Juveniles leave to establish own territories or die trying\n- Elders sometimes gather for philosophical discussion\n\n**Communication:**\n- Draconic language (complex, includes subsonic tones humans can't hear)\n- Telepathic bonding (with chosen individuals‚Äîhistorically elves)\n- Territorial markers (scent, claw marks, magic-infused warnings)\n- Long-range calls (can be heard for miles)\n\n---\n\n## Secret Knowledge\n> **DM-only information**\n\n### The Retreat After the War\n\n**What really happened 400 years ago:**\n\nThe Dragon War killed dozens of dragons‚Äîmany at the hands of their own former bond-partners when the bonds shattered. The survivors retreated to the mountains with one decree from the Elder Council:\n\n**\"No more bonds. No more trust. No more contact.\"**\n\nFor 400 years, they've held to this:\n- Young dragons who suggest approaching elves are shunned\n- Thorongil is considered the ultimate traitor (bonded to an elf, killed dragons, lives among \"the lesser races\")\n- Some dragons have died of the loneliness‚Äîthe species is social despite its solitary nature\n\n**The hidden truth:**\n- Some elders know the truth‚Äîdrow, not elves, caused the war\n- They haven't shared this widely (admitting the war was based on error is painful)\n- A few younger dragons wonder if reconciliation is possible\n- The oldest dragon, **Vaemorthax**, remembers before the war and grieves privately\n\n### Dragon Psychology\n\n**What drives them:**\n\n**Pride:** Dragons consider themselves the pinnacle of creation. Not arrogant‚Äîfactual. They're the oldest sapient species, the most powerful, the wisest (in their view).\n\n**Longevity:** Living 1000+ years creates alien perspectives. A dragon's \"recent memory\" might be 200 years ago. They plan in centuries.\n\n**Territory:** Not greed‚Äînecessity. Dragons need space to hunt, to think, to exist. Crowding makes them violent.\n\n**Purpose:** Dragons fear meaninglessness more than death. A dragon with no purpose‚Äîno mate, no offspring, no project, no bond‚Äîbecomes dangerous or despondent.\n\n**The Bonding Mystery:**\n- Dragons still don't fully understand why bonds formed with elves\n- Something in elven minds was compatible‚Äîlong lives, magical affinity\n- Bonds were **chosen**, never forced\n- The torture in the war was an abomination‚Äîforcing bonds is like magical rape\n- Young dragons sometimes dream of bonding and wake ashamed\n\n### The Current Political Situation\n\n**Inside the mountains:**\n\n**Isolationist Majority** (~20 dragons):\n- \"The lesser races proved their nature. Stay away.\"\n- Led informally by **Vaemorthax** (1400+ years, oldest living dragon)\n- Will attack any dragon who suggests contact\n\n**Curious Minority** (~8 dragons):\n- Younger adults (200-400 years) who never knew bonds\n- Wonder if the punishment has gone on long enough\n- Secretly interested in what Thorongil chose\n- No leader‚Äîtoo dangerous to organize openly\n\n**The Undecided** (~10 dragons):\n- Elders who remember bonds and miss them\n- Adults who are simply tired of isolation\n- Won't act but might support change if someone else moves first\n\n**The Unknown Factor:**\n- 400 years of isolation may have produced dragons no one knows about\n- Rumored hatchlings raised in complete secrecy by isolationist parents\n- Possible small groups who've left the mountains entirely (no confirmation)\n\n### Thorongil's Status\n\n**Among his own kind:**\n\nThorongil is the dragon equivalent of a war criminal who defected to the enemy:\n- Fought against his own kind\n- Maintained a bond when others died or broke them\n- Lives among \"lesser races\" by choice\n- Has never returned to the mountains in 400 years\n\n**What other dragons think:**\n- Isolationists: Would kill him on sight\n- Curious minority: Fascinated but won't admit it\n- Elders who knew him: Grief, betrayal, confusion\n\n**What Thorongil thinks:**\n- He chose his bond over his species\n- They're right to call him traitor\n- He wouldn't change his choice\n- He's desperately lonely for dragon contact\n- Sometimes flies toward the mountains, stops before he's visible\n\n### Potential Storylines\n\n**The Dragon Emissary:**\nA young dragon approaches Veraheim. The isolationists want them dead. The curious minority wants to see what happens. Is it a trap, a peace offer, or a rogue acting alone?\n\n**Vaemorthax's Decision:**\nThe oldest dragon is dying. Before death, they might share the truth about the war. This could change everything‚Äîor spark dragon civil war.\n\n**The Lost Clutch:**\nRumors of dragon eggs hidden outside the mountains. If true, they could be raised without isolationist influence‚Äîor exploited by the powers.\n\n**Thorongil's Return:**\nSomething forces Thorongil to enter dragon territory. How do his people react? Can Thaelen follow? What happens to Veraheim without its protector?\n\n### What the Powers Know\n\n**Thelassian:**\n- Caerwyn (High Warden) has scouts watching the mountain borders\n- Isileth (Starwarden) believes reconciliation is possible‚Äîeventually\n- Velindor (Spymaster) has tried to contact dragons. Agents don't return.\n- Official policy: Dragons are a closed chapter\n\n**Aloria:**\n- Most Lords consider dragons legends or exaggerations\n- Lord Eisenwald believes a dragon could be captured and used (he's a fool)\n- The King knows better‚Äîhis grandfather met Thorongil\n- Official policy: Ignore them and hope they keep ignoring us\n\n**Broken Isles:**\n- Vaelith Draegor (drow) knows what drow did 400 years ago\n- Some orc shamans claim to speak with \"dragon spirits\" (unverified)\n- Practical pirates don't sail near the northwestern coasts\n\n### Plot Hooks\n\n| Hook | Description |\n|------|-------------|\n| **The Messenger** | A young dragon lands near Veraheim with a message for Thorongil. The isolationists are coming to kill them. Protect the messenger? |\n| **The Truth Spreads** | Someone found records proving drow caused the war. If dragons learn the truth from the wrong source, it could mean war with drow survivors everywhere. |\n| **Vaemorthax Dying** | The oldest dragon sends word: they want to speak to Thorongil before death. Is it reconciliation or trap? |\n| **Egg Hunters** | Lord Eisenwald funded an expedition to find dragon eggs. They might succeed. The consequences would be catastrophic. |\n| **The Bond Dreams** | A young elf in Veraheim is having dreams about dragons. Real contact, or wishful thinking? Dragons in the mountains are having the same dreams. |\n| **Civil War** | The curious minority makes a move. The isolationists respond. Dragons fighting dragons near the Thelassian‚Äîeveryone gets involved. |\n\n---\n\n## Dragon Lifecycle Details\n\n### Hatching and Youth\n\n**Eggs:**\n- Dragons lay 1-3 eggs per clutch\n- Incubation: 2-3 years (both parents guard)\n- Eggs require specific temperatures (volcanic vents, hot springs, or magical warmth)\n- Infant mortality was low before the war; now, isolationism limits mating opportunities\n\n**Hatchlings (0-50 years):**\n- Born with instincts but limited intelligence\n- First years spent near parents\n- Learn language, hunting, flying by observation\n- Rapid growth‚Äîdouble in size every decade\n- This phase creates strong parental bonds\n\n**Juveniles (50-150 years):**\n- Equivalent to human teenagers\n- Test boundaries, explore beyond territory\n- Historical bonding age‚Äîyoung dragons were curious about elves\n- Now this curiosity is suppressed (\"Don't think about the lesser races\")\n- Many juvenile deaths as they seek territory (competition fierce)\n\n### Adulthood and Mating\n\n**Young Adults (150-400 years):**\n- Establish territory or die trying\n- Begin accumulating treasure (instinctive, not greed‚Äînesting behavior)\n- Potential for finding mates\n- Pre-war: Bonding to elves often happened in this phase\n\n**Mating:**\n- Dragons are selective‚Äîmay wait centuries for the right partner\n- Courtship involves display flights, gift-giving, territory negotiation\n- Mated pairs don't necessarily live together (separate lairs, shared territory)\n- Some dragons never mate (solitary by preference or circumstance)\n- Same-sex partnerships occur (no reproduction, but recognized bonds)\n\n**Adults (400-800 years):**\n- Prime of power and influence\n- Most territorial conflicts\n- Most likely to hold strong opinions on politics\n- Pre-war: Many bonded dragons were in this phase\n\n### Elder Years\n\n**Elders (800-1200 years):**\n- Metabolisms slow; need less food\n- Territories often smaller (less need to hunt)\n- More philosophical, less aggressive\n- Participate in Elder Council\n- Some become mentors to younger dragons\n\n**Ancients (1200+ years):**\n- Extremely rare‚Äîmaybe 2-3 in all of dragonkind\n- Near-legendary figures\n- Vaemorthax (1400+ years) is the only confirmed ancient\n- Their words carry enormous weight\n- Often withdrawn, contemplative, speak in riddles\n\n---\n\n## Connections\n\n```mermaid\nflowchart TD\n    subgraph Mountains[\"üèîÔ∏è Northwestern Mountains\"]\n        Elders[\"Elder Council<br/>(Vaemorthax leads)\"]\n        Isolationists[\"Isolationist Majority<br/>(~20 dragons)\"]\n        Curious[\"Curious Minority<br/>(~8 younger dragons)\"]\n    end\n\n    Elders -->|\"enforces\"| Isolation[\"400-Year Isolation\"]\n    Isolationists -->|\"supports\"| Isolation\n    Curious -.->|\"questions\"| Isolation\n\n    Thorongil[\"Thorongil<br/>(Veraheim)\"] -.->|\"exile from\"| Mountains\n    Thorongil -.->|\"considered traitor by\"| Isolationists\n    Thorongil -.->|\"fascinates\"| Curious\n\n    subgraph External[\"üåç The Powers\"]\n        Empire[\"Thelassian<br/>(wants reconciliation)\"]\n        Kingdom[\"Aloria<br/>(ignorant)\"]\n        Veraheim[\"Veraheim<br/>(hosts Thorongil)\"]\n    end\n\n    Mountains -.->|\"no contact\"| External\n\n    style Mountains fill:#e8d5b7,color:#000\n    style Thorongil fill:#cfe2f3,color:#000\n    style Isolation fill:#f4cccc,color:#000\n```\n\n---\n\n## See Also\n\n- [Thorongil (Vaethor)](/npcs/thorongil-vaethor) - The last bonded dragon\n- [The Elves-Dragon War](/history/the-elves-dragon-war) - What broke the bonds\n- [Thaelen Ruincalen](/npcs/thaelen-ruincalen) - The last dragon rider\n- [Drow Persecution](/peoples/drow-persecution) - Why the war really happened\n\n---\n\n*\"Dragons live a thousand years. They remember what others forget. And for 400 years, they have remembered betrayal‚Äîeven if the memory is based on a lie.\"*\n",
  "sourcePath": "05-Peoples/Dragon Ecology.md",
  "slug": "dragon-ecology",
  "category": "peoples"
}